article_url|sentence|sentence_index|span_text|span_score|span_start_char|span_end_char|sentence_masked|accessibility|content_gen|automation
https://www.technologyreview.com/2023/12/19/1085696/four-trends-that-changed-ai-in-2023/|In an exciting counter-offensive , researchers at the University of Chicago developed Nightshade , a new data-poisoning tool that lets artists fight back against generative AI by messing up training data in ways that could cause serious damage to image-generating AI models .|50|generative AI|0.9999907|162|175|In an exciting counter-offensive , researchers at the University of Chicago developed Nightshade , a new data-poisoning tool that lets artists fight back against {TECHNOLOGY_X} by messing up training data in ways that could cause serious damage to image-generating AI models |0.07780720441427556|0.09460575539261921|0.005170543071172948
https://www.technologyreview.com/2023/12/19/1085696/four-trends-that-changed-ai-in-2023/|Now we know what OpenAI ’ s superalignment team has been up to OpenAI has announced the first results from its superalignment team , its in-house initiative dedicated to preventing a superintelligence—a hypothetical future AI that can outsmart humans—from going rogue .|52|AI|0.9999975|223|225|Now we know what OpenAI ’ s superalignment team has been up to OpenAI has announced the first results from its superalignment team , its in-house initiative dedicated to preventing a superintelligence—a hypothetical future {TECHNOLOGY_X} that can outsmart humans—from going rogue |0.12151167340363056|0.028767612398263177|0.005120081795356031
https://www.technologyreview.com/2023/12/19/1085696/four-trends-that-changed-ai-in-2023/|The team is led by chief scientist Ilya Sutskever , who was part of the group that just last month fired OpenAI ’ s CEO , Sam Altman , only to reinstate him a few days later .|53|group|0.99999|72|77|The team is led by chief scientist Ilya Sutskever , who was part of the {TECHNOLOGY_X} that just last month fired OpenAI ’ s CEO , Sam Altman , only to reinstate him a few days later |0.09705074219841196|0.023448834733063414|0.005472294064372083
https://www.technologyreview.com/2023/12/19/1085696/four-trends-that-changed-ai-in-2023/|The team is led by chief scientist Ilya Sutskever , who was part of the group that just last month fired OpenAI ’ s CEO , Sam Altman , only to reinstate him a few days later .|53|CEO|0.78435725|116|119|The team is led by chief scientist Ilya Sutskever , who was part of the group that just last month fired OpenAI ’ s {TECHNOLOGY_X} , Sam Altman , only to reinstate him a few days later |0.09492658019030929|0.023780033724104897|0.005039440959491006
https://www.technologyreview.com/2023/12/19/1085696/four-trends-that-changed-ai-in-2023/|In a low-key research paper , the team describes a technique that lets a less powerful large language model supervise a more powerful one—and suggests that this might be a small step toward figuring out how humans might supervise superhuman machines .|55|large language|0.9993105|87|101|In a low-key research paper , the team describes a technique that lets a less powerful {TECHNOLOGY_X} model supervise a more powerful one—and suggests that this might be a small step toward figuring out how humans might supervise superhuman machines |0.06150464609278682|0.013796811572121884|0.004248440795362533
https://www.technologyreview.com/2023/12/19/1085696/four-trends-that-changed-ai-in-2023/|In a low-key research paper , the team describes a technique that lets a less powerful large language model supervise a more powerful one—and suggests that this might be a small step toward figuring out how humans might supervise superhuman machines .|55|large language model|0.99998367|87|107|In a low-key research paper , the team describes a technique that lets a less powerful {TECHNOLOGY_X} supervise a more powerful one—and suggests that this might be a small step toward figuring out how humans might supervise superhuman machines |0.061841647771657814|0.013368724679258502|0.004306563222250595
https://www.technologyreview.com/2023/12/19/1085696/four-trends-that-changed-ai-in-2023/|Google DeepMind used a large language model to solve an unsolvable math problemIn a paper published in Nature , the company says it is the first time a large language model has been used to discover a solution to a long-standing scientific puzzle—producing verifiable and valuable new information that did not previously exist .|57|large language|0.85001075|152|166|Google DeepMind used a large language model to solve an unsolvable math problemIn a paper published in Nature , the company says it is the first time a {TECHNOLOGY_X} model has been used to discover a solution to a long-standing scientific puzzle—producing verifiable and valuable new information that did not previously exist |0.07722525611863928|0.029794671863937527|0.004462892659469307
https://www.technologyreview.com/2023/12/19/1085696/four-trends-that-changed-ai-in-2023/|Google DeepMind used a large language model to solve an unsolvable math problemIn a paper published in Nature , the company says it is the first time a large language model has been used to discover a solution to a long-standing scientific puzzle—producing verifiable and valuable new information that did not previously exist .|57|large language model|0.9999901|23|43|Google DeepMind used a {TECHNOLOGY_X} to solve an unsolvable math problemIn a paper published in Nature , the company says it is the first time a large language model has been used to discover a solution to a long-standing scientific puzzle—producing verifiable and valuable new information that did not previously exist |0.06920040931742173|0.019569499892176944|0.005713917622225721
https://www.technologyreview.com/2023/12/19/1085696/four-trends-that-changed-ai-in-2023/|Google DeepMind used a large language model to solve an unsolvable math problemIn a paper published in Nature , the company says it is the first time a large language model has been used to discover a solution to a long-standing scientific puzzle—producing verifiable and valuable new information that did not previously exist .|57|large language model|0.99999726|152|172|Google DeepMind used a large language model to solve an unsolvable math problemIn a paper published in Nature , the company says it is the first time a {TECHNOLOGY_X} has been used to discover a solution to a long-standing scientific puzzle—producing verifiable and valuable new information that did not previously exist |0.07482471823397656|0.02570213433683335|0.0048575467713460364
https://www.technologyreview.com/2023/12/19/1085696/four-trends-that-changed-ai-in-2023/|( MIT Technology Review ) This new system can teach a robot a simple household task within 20 minutesA new open-source system , called Dobb-E , was trained using data collected from real homes .|58|robot|0.9996655|54|59|( MIT Technology Review ) This new system can teach a {TECHNOLOGY_X} a simple household task within 20 minutesA new open-source system , called Dobb-E , was trained using data collected from real homes |0.3516224885552436|0.0355385281012953|0.01510499031516177
https://www.technologyreview.com/2023/12/19/1085696/four-trends-that-changed-ai-in-2023/|( MIT Technology Review ) This new system can teach a robot a simple household task within 20 minutesA new open-source system , called Dobb-E , was trained using data collected from real homes .|58|-source|0.66588724|111|118|( MIT Technology Review ) This new system can teach a robot a simple household task within 20 minutesA new open{TECHNOLOGY_X} system , called Dobb-E , was trained using data collected from real homes |0.1753992408743699|0.029737615846368932|0.010213160766276576
https://www.technologyreview.com/2023/12/19/1085696/four-trends-that-changed-ai-in-2023/|It can help to teach a robot how to open an air fryer , close a door , or straighten a cushion , among other tasks .|59|robot|0.98771614|23|28|It can help to teach a {TECHNOLOGY_X} how to open an air fryer , close a door , or straighten a cushion , among other tasks |0.2597506250851261|0.028990984405827314|0.00910775985228145
https://www.technologyreview.com/2023/12/19/1085696/four-trends-that-changed-ai-in-2023/|( MIT Technology Review ) ChatGPT is turning the internet into plumbingGerman media giant Axel Springer , which owns Politico and Business Insider , announced a partnership with OpenAI , in which the tech company will be able to use its news articles as training data and the news organizations will be able to use ChatGPT to do summaries of news .|61|ChatGPT|0.9996136|26|33|( MIT Technology Review ) {TECHNOLOGY_X} is turning the internet into plumbingGerman media giant Axel Springer , which owns Politico and Business Insider , announced a partnership with OpenAI , in which the tech company will be able to use its news articles as training data and the news organizations will be able to use ChatGPT to do summaries of news |0.16762820359731512|0.023716866965158633|0.008397816690095303
https://www.technologyreview.com/2023/12/19/1085696/four-trends-that-changed-ai-in-2023/|( MIT Technology Review ) ChatGPT is turning the internet into plumbingGerman media giant Axel Springer , which owns Politico and Business Insider , announced a partnership with OpenAI , in which the tech company will be able to use its news articles as training data and the news organizations will be able to use ChatGPT to do summaries of news .|61|internet|0.66866624|49|57|( MIT Technology Review ) ChatGPT is turning the {TECHNOLOGY_X} into plumbingGerman media giant Axel Springer , which owns Politico and Business Insider , announced a partnership with OpenAI , in which the tech company will be able to use its news articles as training data and the news organizations will be able to use ChatGPT to do summaries of news |0.13313459865554975|0.026113891300757464|0.007812130278568231
https://www.technologyreview.com/2023/12/19/1085696/four-trends-that-changed-ai-in-2023/|” ( The Atlantic ) Meet the former French official pushing for looser AI rules after joining startup MistralA profile of Mistral AI cofounder Cédric O , who used to be France ’ s digital minister .|63|AI|0.99818134|70|72|” ( The Atlantic ) Meet the former French official pushing for looser {TECHNOLOGY_X} rules after joining startup MistralA profile of Mistral AI cofounder Cédric O , who used to be France ’ s digital minister |0.1304597765087162|0.02601255260878638|0.005446950577795171
https://www.technologyreview.com/2023/12/19/1085696/four-trends-that-changed-ai-in-2023/|Before joining France ’ s AI unicorn , he was a vocal proponent of strict laws for tech , but he lobbied hard against rules in the AI Act that would have restricted Mistral ’ s models .|64|AI|0.99999845|26|28|Before joining France ’ s {TECHNOLOGY_X} unicorn , he was a vocal proponent of strict laws for tech , but he lobbied hard against rules in the AI Act that would have restricted Mistral ’ s models |0.06316722441023111|0.012770420295901015|0.004532361146789648
https://www.technologyreview.com/2023/12/19/1085696/four-trends-that-changed-ai-in-2023/|Before joining France ’ s AI unicorn , he was a vocal proponent of strict laws for tech , but he lobbied hard against rules in the AI Act that would have restricted Mistral ’ s models .|64|AI|0.99999106|131|133|Before joining France ’ s AI unicorn , he was a vocal proponent of strict laws for tech , but he lobbied hard against rules in the {TECHNOLOGY_X} Act that would have restricted Mistral ’ s models |0.05937579137538604|0.012023755063374933|0.004258807541165965
https://www.technologyreview.com/2023/12/19/1085696/four-trends-that-changed-ai-in-2023/|He was successful : the company ’ s models don ’ t meet the computing threshold set by the law , and its open-source models are also exempt from transparency obligations .|65|-source models|0.9371378|109|123|He was successful : the company ’ s models don ’ t meet the computing threshold set by the law , and its open{TECHNOLOGY_X} are also exempt from transparency obligations |0.11486634650332693|0.006706334490226454|0.004737376978948647
