article_url|sentence|sentence_index|span_text|span_score|span_start_char|span_end_char|sentence_masked|accessibility|content_gen|automation
https://www.technologyreview.com/2023/11/29/1084061/deepmind-ai-tool-for-new-materials-discovery/|From EV batteries to solar cells to microchips , new materials can supercharge technological breakthroughs .|0|EV batteries|0.99897265|5|17|From {TECHNOLOGY_X} to solar cells to microchips , new materials can supercharge technological breakthroughs |0.04989042505973659|0.014458412495764345|0.0037171707179841367
https://www.technologyreview.com/2023/11/29/1084061/deepmind-ai-tool-for-new-materials-discovery/|But discovering them usually takes months or even years of trial-and-error research .|1|trial-|0.97867566|59|65|But discovering them usually takes months or even years of {TECHNOLOGY_X}and-error research |0.03609056777074854|0.004495042009087046|0.002742448284450499
https://www.technologyreview.com/2023/11/29/1084061/deepmind-ai-tool-for-new-materials-discovery/|Google DeepMind hopes to change that with a new tool that uses deep learning to dramatically speed up the process of discovering new materials .|2|deep learning|0.9991968|63|76|Google DeepMind hopes to change that with a new tool that uses {TECHNOLOGY_X} to dramatically speed up the process of discovering new materials |0.058444887560056794|0.03356861393876719|0.03726087916316304
https://www.technologyreview.com/2023/11/29/1084061/deepmind-ai-tool-for-new-materials-discovery/|Called graphical networks for material exploration ( GNoME ) , the technology has already been used to predict structures for 2.2 million new materials , of which more than 700 have gone on to be created in the lab and are now being tested .|3|GNoME|0.9989518|53|58|Called graphical networks for material exploration ( {TECHNOLOGY_X} ) , the technology has already been used to predict structures for 2.2 million new materials , of which more than 700 have gone on to be created in the lab and are now being tested |0.040392901184373296|0.04101272862402131|0.006890427794093632
https://www.technologyreview.com/2023/11/29/1084061/deepmind-ai-tool-for-new-materials-discovery/|Called graphical networks for material exploration ( GNoME ) , the technology has already been used to predict structures for 2.2 million new materials , of which more than 700 have gone on to be created in the lab and are now being tested .|3|technology|0.9999839|67|77|Called graphical networks for material exploration ( GNoME ) , the {TECHNOLOGY_X} has already been used to predict structures for 2.2 million new materials , of which more than 700 have gone on to be created in the lab and are now being tested |0.08539717426166352|0.04384407490716571|0.015090778982480218
https://www.technologyreview.com/2023/11/29/1084061/deepmind-ai-tool-for-new-materials-discovery/|Called graphical networks for material exploration ( GNoME ) , the technology has already been used to predict structures for 2.2 million new materials , of which more than 700 have gone on to be created in the lab and are now being tested .|3|graphical networks|0.822946|7|25|Called {TECHNOLOGY_X} for material exploration ( GNoME ) , the technology has already been used to predict structures for 2.2 million new materials , of which more than 700 have gone on to be created in the lab and are now being tested |0.10282411069093188|0.019866117211649555|0.017154640648017364
https://www.technologyreview.com/2023/11/29/1084061/deepmind-ai-tool-for-new-materials-discovery/|Called graphical networks for material exploration ( GNoME ) , the technology has already been used to predict structures for 2.2 million new materials , of which more than 700 have gone on to be created in the lab and are now being tested .|3|material exploration|0.99998987|30|50|Called graphical networks for {TECHNOLOGY_X} ( GNoME ) , the technology has already been used to predict structures for 2.2 million new materials , of which more than 700 have gone on to be created in the lab and are now being tested |0.09365184140217252|0.03761166684507927|0.017039425111728426
https://www.technologyreview.com/2023/11/29/1084061/deepmind-ai-tool-for-new-materials-discovery/|The lab takes data from the materials database that includes some of GNoME ’ s discoveries and uses machine learning and robotic arms to engineer new materials without the help of humans .|6|machine learning|0.9999989|100|116|The lab takes data from the materials database that includes some of GNoME ’ s discoveries and uses {TECHNOLOGY_X} and robotic arms to engineer new materials without the help of humans |0.09878053248365669|0.019381330045732736|0.010291861641382025
https://www.technologyreview.com/2023/11/29/1084061/deepmind-ai-tool-for-new-materials-discovery/|Google DeepMind says that together , these advancements show the potential of using AI to scale up the discovery and development of new materials .|7|AI|0.9999989|84|86|Google DeepMind says that together , these advancements show the potential of using {TECHNOLOGY_X} to scale up the discovery and development of new materials |0.023153932208614694|0.027257425987287913|0.02909560970662905
https://www.technologyreview.com/2023/11/29/1084061/deepmind-ai-tool-for-new-materials-discovery/|The company has already used its protein-folding AI , AlphaFold , to generate structures for the human proteome , as well as yeast , fruit flies , mice , and more .|8|AI|0.88470834|49|51|The company has already used its protein-folding {TECHNOLOGY_X} , AlphaFold , to generate structures for the human proteome , as well as yeast , fruit flies , mice , and more |0.07484350681619849|0.0319724510378202|0.005271909960858263
https://www.technologyreview.com/2023/11/29/1084061/deepmind-ai-tool-for-new-materials-discovery/|The company has already used its protein-folding AI , AlphaFold , to generate structures for the human proteome , as well as yeast , fruit flies , mice , and more .|8|-folding AI|0.986891|40|51|The company has already used its protein{TECHNOLOGY_X} , AlphaFold , to generate structures for the human proteome , as well as yeast , fruit flies , mice , and more |0.06644225874173715|0.02813875117726364|0.005542588159556119
https://www.technologyreview.com/2023/11/29/1084061/deepmind-ai-tool-for-new-materials-discovery/|GNoME can be described as AlphaFold for materials discovery , according to Ju Li , a materials science and engineering professor at the Massachusetts Institute of Technology .|9|Technology|0.99969697|163|173|GNoME can be described as AlphaFold for materials discovery , according to Ju Li , a materials science and engineering professor at the Massachusetts Institute of {TECHNOLOGY_X} |0.12441211018289505|0.025956171198098787|0.004716278575352166
https://www.technologyreview.com/2023/11/29/1084061/deepmind-ai-tool-for-new-materials-discovery/|AlphaFold , a DeepMind AI system announced in 2020 , predicts the structures of proteins with high accuracy and has since advanced biological research and drug discovery .|10|AI|0.999997|23|25|AlphaFold , a DeepMind {TECHNOLOGY_X} system announced in 2020 , predicts the structures of proteins with high accuracy and has since advanced biological research and drug discovery |0.05552422597436343|0.033815570003969106|0.004294590283915362
https://www.technologyreview.com/2023/11/29/1084061/deepmind-ai-tool-for-new-materials-discovery/|“ While materials play a very critical role in almost any technology , we as humanity know only a few tens of thousands of stable materials , ” said Dogus Cubuk , materials discovery lead at Google DeepMind , at a press briefing .|12|technology|0.9999887|58|68|“ While materials play a very critical role in almost any {TECHNOLOGY_X} , we as humanity know only a few tens of thousands of stable materials , ” said Dogus Cubuk , materials discovery lead at Google DeepMind , at a press briefing |0.08362595763885466|0.021235985048993686|0.0031494867362907063
https://www.technologyreview.com/2023/11/29/1084061/deepmind-ai-tool-for-new-materials-discovery/|Once the candidate structures are generated , they are filtered through DeepMind ’ s GNoME models .|22|GNoME models|0.9747975|85|97|Once the candidate structures are generated , they are filtered through DeepMind ’ s {TECHNOLOGY_X} |0.06841544147403501|0.09502419538014606|0.008055016191206361
https://www.technologyreview.com/2023/11/29/1084061/deepmind-ai-tool-for-new-materials-discovery/|The models predict the decomposition energy of a given structure , which is an important indicator of how stable the material can be .|23|models|0.99999356|4|10|The {TECHNOLOGY_X} predict the decomposition energy of a given structure , which is an important indicator of how stable the material can be |0.049023016379214815|0.01823328860536591|0.0035893111968370037
https://www.technologyreview.com/2023/11/29/1084061/deepmind-ai-tool-for-new-materials-discovery/|GNoME selects the most promising candidates , which go through further evaluation based on known theoretical frameworks .|25|GNoME|0.9209804|0|5|{TECHNOLOGY_X} selects the most promising candidates , which go through further evaluation based on known theoretical frameworks |0.06623379428649727|0.003563780552286796|0.009607247450683278
https://www.technologyreview.com/2023/11/29/1084061/deepmind-ai-tool-for-new-materials-discovery/|In its first round , GNoME predicted different materials ' stability with a precision of around 5 % , but it increased quickly throughout the iterative learning process .|27|GNoME|0.5511553|21|26|In its first round , {TECHNOLOGY_X} predicted different materials ' stability with a precision of around 5 % , but it increased quickly throughout the iterative learning process |0.061335126558713295|0.026255565492443095|0.0025771162211904977
https://www.technologyreview.com/2023/11/29/1084061/deepmind-ai-tool-for-new-materials-discovery/|Using AI models to come up with new materials is not a novel idea .|29|AI models|0.99999225|6|15|Using {TECHNOLOGY_X} to come up with new materials is not a novel idea |0.04530594519600863|0.0023493861378378993|0.012500719191540017
https://www.technologyreview.com/2023/11/29/1084061/deepmind-ai-tool-for-new-materials-discovery/|However , GNoME ’ s size and precision set it apart from previous efforts .|31|GNoME|0.80429673|10|15|However , {TECHNOLOGY_X} ’ s size and precision set it apart from previous efforts |0.049236680523004804|0.00641917157458624|0.003213149837758024
https://www.technologyreview.com/2023/11/29/1084061/deepmind-ai-tool-for-new-materials-discovery/|It was trained on at least an order of magnitude more data than any previous model , says Chris Bartel , an assistant professor of chemical engineering and materials science at the University of Minnesota .|32|model|0.99998426|77|82|It was trained on at least an order of magnitude more data than any previous {TECHNOLOGY_X} , says Chris Bartel , an assistant professor of chemical engineering and materials science at the University of Minnesota |0.03543526839855324|0.02013213845798117|0.003617629801661985
https://www.technologyreview.com/2023/11/29/1084061/deepmind-ai-tool-for-new-materials-discovery/|GNoME allows these computations to scale up with higher accuracy and at much less computational cost , Mo says : “ The impact can be huge.|34|GNoME|0.82456857|0|5|{TECHNOLOGY_X} allows these computations to scale up with higher accuracy and at much less computational cost , Mo says : “ The impact can be huge|0.016755211102867353|0.0027971412929544913|0.010363211238139752
https://www.technologyreview.com/2023/11/29/1084061/deepmind-ai-tool-for-new-materials-discovery/|GNoME allows these computations to scale up with higher accuracy and at much less computational cost , Mo says : “ The impact can be huge.|34|computations|0.82482916|19|31|GNoME allows these {TECHNOLOGY_X} to scale up with higher accuracy and at much less computational cost , Mo says : “ The impact can be huge|0.16501871484239466|0.016994080757610303|0.008938988005286405
https://www.technologyreview.com/2023/11/29/1084061/deepmind-ai-tool-for-new-materials-discovery/|Berkeley Lab ’ s new autonomous laboratory , named the A-Lab , has been using some of GNoME ’ s discoveries with the Materials Project information , integrating robotics with machine learning to optimize the development of such materials .|36|machine learning|0.9999192|175|191|Berkeley Lab ’ s new autonomous laboratory , named the A-Lab , has been using some of GNoME ’ s discoveries with the Materials Project information , integrating robotics with {TECHNOLOGY_X} to optimize the development of such materials |0.07437992757259383|0.014403185947061449|0.017294608999906765
https://www.technologyreview.com/2023/11/29/1084061/deepmind-ai-tool-for-new-materials-discovery/|These formulations are generated by a machine-learning model trained on existing scientific literature .|38|formulations|0.9972825|6|18|These {TECHNOLOGY_X} are generated by a machine-learning model trained on existing scientific literature |0.09896925558102229|0.27290388909537505|0.0262925327501224
https://www.technologyreview.com/2023/11/29/1084061/deepmind-ai-tool-for-new-materials-discovery/|“ If you ’ re unlucky , it can take months or even years , ” said Persson at a press briefing .|43|”|0.95995|59|60|“ If you ’ re unlucky , it can take months or even years , {TECHNOLOGY_X} said Persson at a press briefing |0.09539532844132576|0.015932994504715997|0.002622458757679452
https://www.technologyreview.com/2023/11/29/1084061/deepmind-ai-tool-for-new-materials-discovery/|” Researchers at DeepMind and Berkeley Lab say these new AI tools can help accelerate hardware innovation in energy , computing , and many other sectors .|47|AI|0.99967027|57|59|” Researchers at DeepMind and Berkeley Lab say these new {TECHNOLOGY_X} tools can help accelerate hardware innovation in energy , computing , and many other sectors |0.03470067971946263|0.02590371860993057|0.05179208042433381
https://www.technologyreview.com/2023/11/29/1084061/deepmind-ai-tool-for-new-materials-discovery/|Conductors play an important role in batteries by facilitating the flow of electric current between various components .|52|batteries|0.99950075|37|46|Conductors play an important role in {TECHNOLOGY_X} by facilitating the flow of electric current between various components |0.07426303484624601|0.02476329675403447|0.005348978563785345
https://www.technologyreview.com/2023/11/29/1084061/deepmind-ai-tool-for-new-materials-discovery/|DeepMind says GNoME identified 528 promising lithium-ion conductors among other discoveries , some of which may help make batteries more efficient .|53|528|0.90027803|31|34|DeepMind says GNoME identified {TECHNOLOGY_X} promising lithium-ion conductors among other discoveries , some of which may help make batteries more efficient |0.09034130866237074|0.020336285534045997|0.004331145089094669
https://www.technologyreview.com/2023/11/29/1084061/deepmind-ai-tool-for-new-materials-discovery/|However , even after new materials are discovered , it usually takes decades for industries to take them to the commercial stage .|54|commercial stage|0.9999994|112|128|However , even after new materials are discovered , it usually takes decades for industries to take them to the {TECHNOLOGY_X} |0.024474928270790855|0.004154694336824119|0.0059184362832143626
