title,url,date,text,cleaning,tokens
02/28/2022 - Import AI 286: Fairness through dumbness; planet-scale AI computing; another AI safety startup appears - 2,http://eepurl.com/hVSMf1,2022-02-28,"#################################################### AI supercomputers? Cute. Planet-scale computers? Better.
…Microsoft reveals 'Singularity', a globe-spanning AI computer…
Microsoft has revealed Singularity, the software stack it uses to schedule and train AI jobs across its global fleet of data centers. Singularity gives an indication of the vast-scale at which modern AI workloads get run, and also speaks to the ambitions of technology companies to role all their data centers together into a single, vast blob of compute.

How big is Singularity? Singularity is designed to ""scale across a global fleet of hundreds of thousands of GPUs and other AI accelerators"". Singularity treats Microsoft's compute stack ""as a single, logical shared cluster"".

Something special: One neat feature of Singularity is how it deals with failures. Failures happen a lot in machine learning; when you're training a neural network across hundreds to thousands of GPUs, a ton of freaky shit happens - nodes die, tiny software bugs explode (usually at 2am), your scheduler goes into a crash-loop, etc. Singularity tries to deal with this by gathering node-specific data on all the jobs being run, so that jobs can be easily resumed after running into a problem. ""The checkpoint that Singularity takes is comprised of consistent address-space snapshots of individual workers of the job. As these snapshots capture the full program state such as instruction pointer, stack, heap etc., the job resumes exactly from the point where it was preempted at, with no lost work,"" the researchers write.  
Why this matters: Just as computation is going to be the fundamental resource of the 20th century, the ability to utilize that computation will be the thing that defines who wields power in this era. Systems like Singularity give us an indication of the ambition of companies like Microsoft, and should make policymakers pay attention: what happens when the ability to wield planet-scale computation is solely something within the competency of private sector actors unaffiliated with any single nation state?
  Read more: Singularity: Planet-Scale, Preemptible, Elastic Scheduling of AI Workloads (arXiv).","#################################################### AI supercomputers? Cute. Planet-scale computers? Better. …Microsoft reveals 'Singularity', a globe-spanning AI computer… Microsoft has revealed Singularity, the software stack it uses to schedule and train AI jobs across its global fleet of data centers. Singularity gives an indication of the vast-scale at which modern AI workloads get run, and also speaks to the ambitions of technology companies to role all their data centers together into a single, vast blob of compute. How big is Singularity? Singularity is designed to ""scale across a global fleet of hundreds of thousands of GPUs and other AI accelerators"". Singularity treats Microsoft's compute stack ""as a single, logical shared cluster"". Something special: One neat feature of Singularity is how it deals with failures. Failures happen a lot in machine learning; when you're training a neural network across hundreds to thousands of GPUs, a ton of freaky shit happens - nodes die, tiny software bugs explode (usually at 2am), your scheduler goes into a crash-loop, etc. Singularity tries to deal with this by gathering node-specific data on all the jobs being run, so that jobs can be easily resumed after running into a problem. ""The checkpoint that Singularity takes is comprised of consistent address-space snapshots of individual workers of the job. As these snapshots capture the full program state such as instruction pointer, stack, heap etc., the job resumes exactly from the point where it was preempted at, with no lost work,"" the researchers write. Why this matters: Just as computation is going to be the fundamental resource of the 20th century, the ability to utilize that computation will be the thing that defines who wields power in this era. Systems like Singularity give us an indication of the ambition of companies like Microsoft, and should make policymakers pay attention: what happens when the ability to wield planet-scale computation is solely something within the competency of private sector actors unaffiliated with any single nation state? Read more: Singularity: Planet-Scale, Preemptible, Elastic Scheduling of AI Workloads (arXiv).","['supercomputer', 'cute', 'planetscale', 'computer', 'well', 'microsoft', 'reveal', 'singularity', 'globespanne', 'ai', 'computer', 'reveal', 'singularity', 'software', 'stack', 'use', 'schedule', 'train', 'ai', 'job', 'global', 'fleet', 'datum', 'center', 'singularity', 'give', 'indication', 'vastscale', 'modern', 'ai', 'workload', 'run', 'also', 'speak', 'ambition', 'technology', 'company', 'role', 'datum', 'center', 'together', 'single', 'vast', 'blob', 'compute', 'big', 'singularity', 'singularity', 'design', 'scale', 'global', 'fleet', 'hundred', 'thousand', 'gpus', 'ai', 'accelerator', 'singularity', 'treat', 'microsoft', 'compute', 'stack', 'single', 'logical', 'share', 'cluster', 'special', 'neat', 'feature', 'singularity', 'deal', 'failure', 'failure', 'happen', 'lot', 'machine', 'learning', 'train', 'neural', 'network', 'hundred', 'thousand', 'ton', 'shit', 'happen', 'node', 'die', 'tiny', 'software', 'bug', 'explode', 'usually', 'scheduler', 'go', 'crashloop', 'etc', 'singularity', 'try', 'deal', 'gather', 'nodespecific', 'datum', 'job', 'run', 'job', 'easily', 'resume', 'run', 'problem', 'checkpoint', 'singularity', 'take', 'comprise', 'consistent', 'addressspace', 'snapshot', 'individual', 'worker', 'job', 'snapshot', 'capture', 'full', 'program', 'state', 'instruction', 'pointer', 'stack', 'heap', 'job', 'resume', 'exactly', 'point', 'preempt', 'lose', 'work', 'researcher', 'write', 'matter', 'computation', 'go', 'fundamental', 'resource', '20th', 'century', 'ability', 'utilize', 'computation', 'thing', 'define', 'wield', 'power', 'era', 'system', 'singularity', 'give', 'indication', 'ambition', 'company', 'make', 'policymaker', 'pay', 'attention', 'happen', 'ability', 'wield', 'planetscale', 'computation', 'solely', 'competency', 'private', 'sector', 'actor', 'unaffiliate', 'single', 'nation', 'state', 'read', 'singularity', 'planetscale', 'preemptible', 'elastic', 'scheduling', 'ai', 'workload']"
02/28/2022 - Import AI 286: Fairness through dumbness; planet-scale AI computing; another AI safety startup appears - 3,http://eepurl.com/hVSMf1,2022-02-28,"#################################################### AI is going to change games - this new beta service shows how:
…Latitude Voyage gestures at a future where games are built, extended, and adapted by AI…
Latitude, the startup game company that makes the GPT2/3/J1J-based game 'AI Dungeon', has announced a service called Voyage. Voyage is a subscription service for gaining access to new AI-based games built by Latitude, the ability to use various game-specific AI image generators, and - most intriguingly - eventually access to a 'creator studio', which will make it possible for people to build their own AI powered games and other software.

Why this matters: AI models are going to become the generative kernels around which new games get built. AI-based games hold the possibility for a dream of all games designers - a game that adapts to the individual that plays it, with games becoming more customized, idiosyncratic, and surprising the longer you play. Services like Latitude Voyage tell us that experiments in this new domain are about to be run at a large scale. 
  Read more: Latitude Voyage (Latitude).","#################################################### AI is going to change games - this new beta service shows how: …Latitude Voyage gestures at a future where games are built, extended, and adapted by AI… Latitude, the startup game company that makes the GPT2/3/J1J-based game 'AI Dungeon', has announced a service called Voyage. Voyage is a subscription service for gaining access to new AI-based games built by Latitude, the ability to use various game-specific AI image generators, and - most intriguingly - eventually access to a 'creator studio', which will make it possible for people to build their own AI powered games and other software. Why this matters: AI models are going to become the generative kernels around which new games get built. AI-based games hold the possibility for a dream of all games designers - a game that adapts to the individual that plays it, with games becoming more customized, idiosyncratic, and surprising the longer you play. Services like Latitude Voyage tell us that experiments in this new domain are about to be run at a large scale. Read more: Latitude Voyage (Latitude).","['ai', 'go', 'change', 'game', 'new', 'beta', 'service', 'show', 'latitude', 'voyage', 'gesture', 'future', 'game', 'build', 'extend', 'adapt', 'ai', 'latitude', 'startup', 'game', 'company', 'make', 'gpt23j1jbased', 'game', 'announce', 'service', 'call', 'voyage', 'voyage', 'subscription', 'service', 'gain', 'access', 'new', 'aibased', 'game', 'build', 'latitude', 'ability', 'use', 'various', 'gamespecific', 'ai', 'image', 'generator', 'intriguingly', 'eventually', 'access', 'creator', 'studio', 'make', 'possible', 'people', 'build', 'ai', 'power', 'game', 'software', 'matter', 'model', 'go', 'become', 'generative', 'kernel', 'new', 'game', 'build', 'aibased', 'game', 'hold', 'possibility', 'dream', 'game', 'designer', 'game', 'adapt', 'individual', 'play', 'game', 'become', 'customize', 'idiosyncratic', 'surprising', 'long', 'play', 'service', 'latitude', 'voyage', 'tell', 'experiment', 'new', 'domain', 'run', 'large', 'scale', 'read', 'latitude', 'voyage', 'latitude']"
02/28/2022 - Import AI 286: Fairness through dumbness; planet-scale AI computing; another AI safety startup appears - 4,http://eepurl.com/hVSMf1,2022-02-28,"#################################################### Fine-tune GPT-NeoX-20B - for free…
…GaaS me up, fool!...
We've talked about language models as a service (LMaaS). Now, we've got GPT-as-a-service (GaaS). Specifically, AI startup ForeFront has announced its now hosting Eleuther's 20B GPT model, GPT-NeoX-20B, and has built a bunch of fine-tuning features people can use. This is interesting for a couple of reasons:
1) Speed: GPT-NeoX-20B came out, like, two weeks ago. Model release > commercial service in two weeks is an indication of the rapidly growing ecosystem around commercializing general models.
2) Competition: For a while, OpenAI was the only show in town when it came to providing GaaS/LMaaS services. Now, it's competing with a bunch of entities, ranging from Forefront, to Cohere, to AI21 Labs. As competition steeps up, we'll see people race to the top and bottom on various things (top: safety vs libertarian access policies), (bottom: pricing, know your customer checks).

Why this matters: If AI is going to interact with the world, people need to be able to interact with AI. The emergence of these kinds of commercial AI services is how that'll happen, so it's worth paying attention.
  Read more: How To Fine-Tune GPT-NeoX (ForeFront blog).","#################################################### Fine-tune GPT-NeoX-20B - for free… …GaaS me up, fool!... We've talked about language models as a service (LMaaS). Now, we've got GPT-as-a-service (GaaS). Specifically, AI startup ForeFront has announced its now hosting Eleuther's 20B GPT model, GPT-NeoX-20B, and has built a bunch of fine-tuning features people can use. This is interesting for a couple of reasons: 1) Speed: GPT-NeoX-20B came out, like, two weeks ago. Model release > commercial service in two weeks is an indication of the rapidly growing ecosystem around commercializing general models. 2) Competition: For a while, OpenAI was the only show in town when it came to providing GaaS/LMaaS services. Now, it's competing with a bunch of entities, ranging from Forefront, to Cohere, to AI21 Labs. As competition steeps up, we'll see people race to the top and bottom on various things (top: safety vs libertarian access policies), (bottom: pricing, know your customer checks). Why this matters: If AI is going to interact with the world, people need to be able to interact with AI. The emergence of these kinds of commercial AI services is how that'll happen, so it's worth paying attention. Read more: How To Fine-Tune GPT-NeoX (ForeFront blog).","['finetune', 'gptneox20b', 'free', 'gaas', 'fool', 'talk', 'language', 'model', 'service', 'lmaas', 'get', 'gptasaservice', 'gaas', 'specifically', 'startup', 'forefront', 'announce', 'host', 'eleuther', 'model', 'build', 'bunch', 'finetune', 'feature', 'people', 'use', 'interesting', 'couple', 'reason', 'speed', 'gptneox20b', 'come', 'week', 'ago', 'model', 'release', 'commercial', 'service', 'week', 'indication', 'rapidly', 'grow', 'ecosystem', 'commercialize', 'general', 'model', 'competition', 'openai', 'show', 'town', 'come', 'provide', 'gaaslmaas', 'service', 'compete', 'bunch', 'entity', 'range', 'forefront', 'cohere', 'lab', 'competition', 'steep', 'well', 'see', 'people', 'race', 'top', 'bottom', 'various', 'thing', 'top', 'safety', 'libertarian', 'access', 'policy', 'bottom', 'pricing', 'know', 'customer', 'check', 'matter', 'go', 'interact', 'world', 'people', 'need', 'able', 'interact', 'emergence', 'kind', 'commercial', 'service', 'happen', 'worth', 'pay', 'attention', 'read', 'finetune', 'gptneox', 'forefront', 'blog']"
02/28/2022 - Import AI 286: Fairness through dumbness; planet-scale AI computing; another AI safety startup appears - 5,http://eepurl.com/hVSMf1,2022-02-28,"#################################################### Hark, yet another AI safety startup appears!
…Aligned AI comes out of the University of Oxford with big ambitions…
AI safety researcher Stuart Armstrong has left the Future of Humanity Institute to co-found Aligned AI, an AI research company.

Safety via value extrapolation: The company will work on value extrapolations, which Stuart describes as follows: ""It is easy to point at current examples of agents with low (or high) impact, at safe (or dangerous) suggestions, at low (or high) powered behaviors. So we have in a sense the 'training sets' for defining low-impact/Oracles/low-powered AIs.    It's extending these examples to the general situation that fails: definitions which cleanly divide the training set (whether produced by algorithms or humans) fail to extend to the general situation. Call this the 'value extrapolation problem[1], with 'value' interpreted broadly as a categorisation of situations into desirable and undesirable.    Humans turn out to face similar problems. We have broadly defined preferences in familiar situations we have encountered in the world or in fiction. Yet, when confronted with situations far from these, we have to stop and figure out how our values might possibly extend. Since these human values aren't - yet - defined, we can't directly input them into an algorithm, so AIs that can't solve value extrapolation can't be aligned with human values"".

But how do you make money off this? ""We'll start by offering alignment as a service for more limited AIs,"" Armstrong writes. ""Value extrapolation scales down as well as up: companies value algorithms that won't immediately misbehave in new situations, algorithms that will become conservative and ask for guidance when facing ambiguity.""

Why this matters: There's been a flurry of new companies forming in the AI safety space recently, including ARC, Anthropic, Redwood Research, and now Aligned AI. Along with this, there's also a proliferation of companies working on large-scale generative models (e.g, Cohere, AI21). It feels like AI has shifted into a multi-polar era, with a bunch more entities on the proverbial gameboard. This will present new opportunities and challenges for coordination.     Read more: Why I'm co-founding Aligned AI (Alignment Forum).","#################################################### Hark, yet another AI safety startup appears! …Aligned AI comes out of the University of Oxford with big ambitions… AI safety researcher Stuart Armstrong has left the Future of Humanity Institute to co-found Aligned AI, an AI research company. Safety via value extrapolation: The company will work on value extrapolations, which Stuart describes as follows: ""It is easy to point at current examples of agents with low (or high) impact, at safe (or dangerous) suggestions, at low (or high) powered behaviors. So we have in a sense the 'training sets' for defining low-impact/Oracles/low-powered AIs. It's extending these examples to the general situation that fails: definitions which cleanly divide the training set (whether produced by algorithms or humans) fail to extend to the general situation. Call this the 'value extrapolation problem[1], with 'value' interpreted broadly as a categorisation of situations into desirable and undesirable. Humans turn out to face similar problems. We have broadly defined preferences in familiar situations we have encountered in the world or in fiction. Yet, when confronted with situations far from these, we have to stop and figure out how our values might possibly extend. Since these human values aren't - yet - defined, we can't directly input them into an algorithm, so AIs that can't solve value extrapolation can't be aligned with human values"". But how do you make money off this? ""We'll start by offering alignment as a service for more limited AIs,"" Armstrong writes. ""Value extrapolation scales down as well as up: companies value algorithms that won't immediately misbehave in new situations, algorithms that will become conservative and ask for guidance when facing ambiguity."" Why this matters: There's been a flurry of new companies forming in the AI safety space recently, including ARC, Anthropic, Redwood Research, and now Aligned AI. Along with this, there's also a proliferation of companies working on large-scale generative models (e.g, Cohere, AI21). It feels like AI has shifted into a multi-polar era, with a bunch more entities on the proverbial gameboard. This will present new opportunities and challenges for coordination. Read more: Why I'm co-founding Aligned AI (Alignment Forum).","['hark', 'yet', 'safety', 'startup', 'appear', 'align', 'ai', 'come', 'big', 'ambition', 'safety', 'researcher', 'leave', 'future', 'humanity', 'institute', 'cofound', 'align', 'ai', 'research', 'company', 'safety', 'value', 'extrapolation', 'company', 'work', 'value', 'extrapolation', 'describe', 'follow', 'easy', 'point', 'current', 'example', 'agent', 'low', 'high', 'impact', 'safe', 'dangerous', 'suggestion', 'low', 'high', 'powered', 'behavior', 'sense', 'training', 'set', 'define', 'extend', 'example', 'general', 'situation', 'fail', 'definition', 'cleanly', 'divide', 'training', 'set', 'produce', 'algorithm', 'human', 'fail', 'extend', 'general', 'situation', 'call', 'value', 'extrapolation', 'problem1', 'value', 'interpret', 'broadly', 'categorisation', 'situation', 'desirable', 'undesirable', 'human', 'turn', 'face', 'similar', 'problem', 'broadly', 'define', 'preference', 'familiar', 'situation', 'encounter', 'world', 'fiction', 'yet', 'confront', 'situation', 'far', 'stop', 'figure', 'value', 'possibly', 'extend', 'human', 'value', 'yet', 'define', 'directly', 'input', 'solve', 'value', 'extrapolation', 'align', 'human', 'value', 'make', 'money', 'well', 'start', 'offer', 'alignment', 'service', 'limited', 'write', 'value', 'extrapolation', 'scale', 'well', 'company', 'value', 'algorithm', 'immediately', 'misbehave', 'new', 'situation', 'algorithm', 'become', 'conservative', 'ask', 'guidance', 'face', 'ambiguity', 'matter', 'flurry', 'new', 'company', 'form', 'safety', 'space', 'recently', 'include', 'anthropic', 'redwood', 'research', 'align', 'along', 'also', 'proliferation', 'company', 'work', 'largescale', 'generative', 'model', 'eg', 'cohere', 'ai21', 'feel', 'shift', 'multipolar', 'era', 'bunch', 'entity', 'proverbial', 'gameboard', 'present', 'new', 'opportunity', 'challenge', 'coordination', 'read', 'cofounde', 'align', 'forum']"
02/28/2022 - Import AI 286: Fairness through dumbness; planet-scale AI computing; another AI safety startup appears - 6,http://eepurl.com/hVSMf1,2022-02-28,"#################################################### After Chess, Go, and Shogi, DeepMind turns MuZero towards… video compression for YouTube?
…YouTube + MuZero = improved video compression…
DeepMind has applied MuZero, a more general successor to AlphaGo and AlphaZero, to video compression. Specifically, DeepMind has worked with YouTube to use MuZero to figure out the correct Quantisation Parameter to use in the open source version of the VP9 codec, libvpx. In tests, DeepMind found it was able to use the resulting MuZero Rate-Controller to lead to bitrate savings of between 3% and 5%. That's a big deal - just imagine how big the bandwidth bill for running YouTube is, then take off some percentage points.

How does this relate to general AI? ""​​By creating agents equipped with a range of new abilities to improve products across domains, we can help various computer systems become faster, less intensive, and more automated. Our long-term vision is to develop a single algorithm capable of optimizing thousands of real-world systems across a variety of domains,"" DeepMind writes.

Why this matters: If cutting-edge Ai research can be put to work optimizing some of the world's largest internet services, then that's gonna create a sustainable route to funding ambitious research. Kudos to DeepMind for threading all kinds of inner-Alphabet-needles to deploy MuZero in this way.    Read more: MuZero's first step from research into the real world (DeepMind blog).
  Check out the research: MuZero with Self-competition for Rate Control in VP9 Video Compression (arXiv).","#################################################### After Chess, Go, and Shogi, DeepMind turns MuZero towards… video compression for YouTube? …YouTube + MuZero = improved video compression… DeepMind has applied MuZero, a more general successor to AlphaGo and AlphaZero, to video compression. Specifically, DeepMind has worked with YouTube to use MuZero to figure out the correct Quantisation Parameter to use in the open source version of the VP9 codec, libvpx. In tests, DeepMind found it was able to use the resulting MuZero Rate-Controller to lead to bitrate savings of between 3% and 5%. That's a big deal - just imagine how big the bandwidth bill for running YouTube is, then take off some percentage points. How does this relate to general AI? ""​​By creating agents equipped with a range of new abilities to improve products across domains, we can help various computer systems become faster, less intensive, and more automated. Our long-term vision is to develop a single algorithm capable of optimizing thousands of real-world systems across a variety of domains,"" DeepMind writes. Why this matters: If cutting-edge Ai research can be put to work optimizing some of the world's largest internet services, then that's gonna create a sustainable route to funding ambitious research. Kudos to DeepMind for threading all kinds of inner-Alphabet-needles to deploy MuZero in this way. Read more: MuZero's first step from research into the real world (DeepMind blog). Check out the research: MuZero with Self-competition for Rate Control in VP9 Video Compression (arXiv).","['chess', 'go', 'turn', 'muzero', 'video', 'compression', 'youtube', 'improved', 'video', 'compression', 'deepmind', 'apply', 'muzero', 'general', 'successor', 'alphago', 'alphazero', 'video', 'compression', 'specifically', 'deepmind', 'work', 'youtube', 'use', 'muzero', 'figure', 'correct', 'quantisation', 'parameter', 'use', 'open', 'source', 'version', 'vp9', 'test', 'deepmind', 'find', 'able', 'use', 'result', 'muzero', 'ratecontroller', 'lead', 'bitrate', 'saving', 'big', 'deal', 'imagine', 'big', 'bandwidth', 'bill', 'run', 'youtube', 'take', 'percentage', 'point', 'relate', 'create', 'agent', 'equip', 'range', 'new', 'ability', 'improve', 'product', 'domain', 'help', 'various', 'computer', 'system', 'become', 'fast', 'less', 'intensive', 'automate', 'longterm', 'vision', 'develop', 'single', 'algorithm', 'capable', 'optimize', 'thousand', 'realworld', 'system', 'variety', 'domain', 'deepmind', 'write', 'matter', 'cuttingedge', 'ai', 'research', 'put', 'work', 'optimize', 'world', 'large', 'internet', 'service', 'going', 'create', 'sustainable', 'route', 'fund', 'ambitious', 'research', 'kudo', 'deepmind', 'thread', 'kind', 'inneralphabetneedle', 'deploy', 'muzero', 'way', 'read', 'muzero', 'first', 'step', 'research', 'real', 'world', 'deepmind', 'blog', 'check', 'research', 'muzero', 'selfcompetition', 'rate', 'control', 'video', 'compression']"
