title,url,date,text,cleaning,tokens
05/20/2022 - Import AI 295: DeepMind's baby general agent; NVIDIA simulates a robot factory; AI wars. - 0,http://eepurl.com/h2sj1D,2022-05-20,"Intro (no tag) Welcome to Import AI, a newsletter about artificial intelligence. Forward this email to give your chums an AI upgrade. Subscribe here.

Import AI is taking a short break (and here's why):
Import AI is taking two weeks off! That's because I (Jack Clark) am serially bad at taking holiday. I've recently worked with my colleagues to figure out some time and so I'm going to spend the next couple of weeks hiking and traveling and reading and generally trying to unplug my brain a bit so it can do some deep background cogitation. I admit that the thought of not writing this newsletter for two weeks fills me with a bit of anxiety, but I also think sometimes you need to step away so you can come back fresher in the future. I hope all of you, my dear readers, are doing well, and I'll be back soon. Now, back to the regularly scheduled programming!... CRPD: Chinese license plate recognition:
…A basic dataset for a useful capability…
Researchers with the University of Electronic Science and Technology of China have built a dataset for recognizing Chinese license plates. The authors use the dataset to train some models that get state-of-the-art accuracy while running at 30 frames per second.

The dataset: The Chinese Road Plate Dataset (CRPD) contains 25k images (around 30k total). Each image is annotated with the Chinese and English characters of the depicted license plate, the coordinate of the vertices of the license plates, and the type of license plate (e.g, whether for police cars, small cars, etc).  Images for the dataset were ""collected from electronic monitoring systems in most provinces of mainland China in different periods and weather conditions,"" the authors write.

Why this matters: Datasets like CRPD represent the basic infrastructure on which AI capabilities get developed. It's also notable how universities in China can access large-scale surveillance datasets.
  Read more: Unified Chinese License Plate Detection and Recognition with High Efficiency (arXiv).    Get the dataset: Github https://github.com/yxgong0/CRPD","Intro (no tag) Welcome to Import AI, a newsletter about artificial intelligence. Forward this email to give your chums an AI upgrade. Subscribe here. Import AI is taking a short break (and here's why): Import AI is taking two weeks off! That's because I (Jack Clark) am serially bad at taking holiday. I've recently worked with my colleagues to figure out some time and so I'm going to spend the next couple of weeks hiking and traveling and reading and generally trying to unplug my brain a bit so it can do some deep background cogitation. I admit that the thought of not writing this newsletter for two weeks fills me with a bit of anxiety, but I also think sometimes you need to step away so you can come back fresher in the future. I hope all of you, my dear readers, are doing well, and I'll be back soon. Now, back to the regularly scheduled programming!... CRPD: Chinese license plate recognition: …A basic dataset for a useful capability… Researchers with the University of Electronic Science and Technology of China have built a dataset for recognizing Chinese license plates. The authors use the dataset to train some models that get state-of-the-art accuracy while running at 30 frames per second. The dataset: The Chinese Road Plate Dataset (CRPD) contains 25k images (around 30k total). Each image is annotated with the Chinese and English characters of the depicted license plate, the coordinate of the vertices of the license plates, and the type of license plate (e.g, whether for police cars, small cars, etc). Images for the dataset were ""collected from electronic monitoring systems in most provinces of mainland China in different periods and weather conditions,"" the authors write. Why this matters: Datasets like CRPD represent the basic infrastructure on which AI capabilities get developed. It's also notable how universities in China can access large-scale surveillance datasets. Read more: Unified Chinese License Plate Detection and Recognition with High Efficiency (arXiv). Get the dataset: Github https://github.com/yxgong0/CRPD","['tag', 'welcome', 'import', 'newsletter', 'artificial', 'intelligence', 'email', 'give', 'chum', 'ai', 'upgrade', 'subscribe', 'import', 'take', 'short', 'break', 'import', 'ai', 'take', 'week', 'jack', 'serially', 'bad', 'take', 'holiday', 'recently', 'work', 'colleague', 'figure', 'time', 'go', 'spend', 'next', 'couple', 'week', 'hike', 'travel', 'reading', 'generally', 'try', 'unplug', 'brain', 'bit', 'deep', 'background', 'cogitation', 'admit', 'thought', 'write', 'newsletter', 'week', 'fill', 'bit', 'anxiety', 'also', 'think', 'sometimes', 'need', 'step', 'away', 'come', 'back', 'fresher', 'future', 'hope', 'dear', 'reader', 'well', 'ill', 'back', 'soon', 'back', 'regularly', 'schedule', 'programming', 'crpd', 'chinese', 'license', 'plate', 'recognition', 'basic', 'dataset', 'useful', 'capability', 'researcher', 'electronic', 'science', 'technology', 'build', 'dataset', 'recognize', 'chinese', 'license', 'plate', 'author', 'use', 'dataset', 'train', 'model', 'get', 'stateoftheart', 'accuracy', 'run', 'frame', 'second', 'dataset', 'chinese', 'road', 'plate', 'dataset', 'crpd', 'contain', '25k', 'image', 'total', 'image', 'annotate', 'chinese', 'english', 'character', 'depict', 'license', 'plate', 'coordinate', 'vertex', 'license', 'plate', 'type', 'license', 'plate', 'eg', 'police', 'car', 'small', 'car', 'image', 'dataset', 'collect', 'electronic', 'monitoring', 'system', 'province', 'mainland', 'different', 'period', 'weather', 'condition', 'author', 'write', 'matter', 'dataset', 'crpd', 'represent', 'basic', 'infrastructure', 'capability', 'develop', 'also', 'notable', 'university', 'access', 'largescale', 'surveillance', 'dataset', 'read', 'unify', 'chinese', 'license', 'plate', 'detection', 'recognition', 'high', 'efficiency', 'arxiv', 'get', 'dataset', 'github']"
05/20/2022 - Import AI 295: DeepMind's baby general agent; NVIDIA simulates a robot factory; AI wars. - 1,http://eepurl.com/h2sj1D,2022-05-20,"#################################################### DeepMind builds a (very preliminary) general AI agent: …AKA: The dawn of really preliminary, general AI systems.. In the past few years, the dumbest thing has tended to work surprisingly well. Take for example GPT3 - just scale-up next word prediction on an internet-scale corpus and you wind up with something capable of few-shot learning, fielding a vast range of NLP capabilities.
  Another example is computer vision systems - just create a vast dataset and you wind up with increasingly robust vision systems.
  Or contrastive learning - just embed a couple of modalities into the same space and sort of flip-flop between them through the learning process and you get powerful multimodal systems like CLIP.
  Now DeepMind has done the same thing for reinforcement learning with GATO, an agent where basically DeepMind takes a bunch of distinct tasks in different modalities and embeds them into the same space, then learns prediction tasks from them. The result is a system where ""the same network with the same weights can play Atari, caption images, chat, stack blocks with a real robot arm and much more, deciding based on its context whether to output text, joint torques, button presses, or other tokens."" This is wild stuff! What GATO can do: After training, GATO can do okay at tasks ranging from DeepMind Lab, to robot manipulation, to the procgen benchmark, to image captioning, to natural language generation. It's a big deal: The fact you can take a bunch of different tasks from different modalities and just… tokenize them… and it works? That's wild! It's both a) wildly dumb and b) wildly effective, and c) another nice example of 'The Bitter Lesson', where given enough compute/scale, the dumb things (aka, the simple ones) tend to work really well.
  In a small package: The largest (disclosed here) GATO agent is 1.18 billion parameters, making it fairly small in the grand scheme of recent AI developments.  An even crazier thing: The GATO model only has a context window of 1024 tokens (by comparison, GPT3 was 2048 when it launched), so the fact 1024 tokens is enough to get a somewhat capable multimodal agent is pretty surprising.

Why this matters: ""Although still at the proof-of-concept stage, the recent progress in generalist models suggests that safety researchers, ethicists, and most importantly, the general public, should consider their risks and benefits,"" DeepMind writes.    Check out the blog: A Generalist Agent (DeepMind website).    Read more: A Generalist Agent (DeepMind PDF).","#################################################### DeepMind builds a (very preliminary) general AI agent: …AKA: The dawn of really preliminary, general AI systems.. In the past few years, the dumbest thing has tended to work surprisingly well. Take for example GPT3 - just scale-up next word prediction on an internet-scale corpus and you wind up with something capable of few-shot learning, fielding a vast range of NLP capabilities. Another example is computer vision systems - just create a vast dataset and you wind up with increasingly robust vision systems. Or contrastive learning - just embed a couple of modalities into the same space and sort of flip-flop between them through the learning process and you get powerful multimodal systems like CLIP. Now DeepMind has done the same thing for reinforcement learning with GATO, an agent where basically DeepMind takes a bunch of distinct tasks in different modalities and embeds them into the same space, then learns prediction tasks from them. The result is a system where ""the same network with the same weights can play Atari, caption images, chat, stack blocks with a real robot arm and much more, deciding based on its context whether to output text, joint torques, button presses, or other tokens."" This is wild stuff! What GATO can do: After training, GATO can do okay at tasks ranging from DeepMind Lab, to robot manipulation, to the procgen benchmark, to image captioning, to natural language generation. It's a big deal: The fact you can take a bunch of different tasks from different modalities and just… tokenize them… and it works? That's wild! It's both a) wildly dumb and b) wildly effective, and c) another nice example of 'The Bitter Lesson', where given enough compute/scale, the dumb things (aka, the simple ones) tend to work really well. In a small package: The largest (disclosed here) GATO agent is 1.18 billion parameters, making it fairly small in the grand scheme of recent AI developments. An even crazier thing: The GATO model only has a context window of 1024 tokens (by comparison, GPT3 was 2048 when it launched), so the fact 1024 tokens is enough to get a somewhat capable multimodal agent is pretty surprising. Why this matters: ""Although still at the proof-of-concept stage, the recent progress in generalist models suggests that safety researchers, ethicists, and most importantly, the general public, should consider their risks and benefits,"" DeepMind writes. Check out the blog: A Generalist Agent (DeepMind website). Read more: A Generalist Agent (DeepMind PDF).","['deepmind', 'build', 'preliminary', 'general', 'agent', 'aka', 'dawn', 'really', 'preliminary', 'general', 'ai', 'system', 'past', 'year', 'dumb', 'thing', 'tend', 'work', 'surprisingly', 'well', 'take', 'example', 'gpt3', 'scaleup', 'next', 'word', 'prediction', 'internetscale', 'corpus', 'wind', 'capable', 'fewshot', 'learning', 'field', 'vast', 'range', 'nlp', 'capability', 'example', 'computer', 'vision', 'system', 'create', 'vast', 'dataset', 'wind', 'increasingly', 'robust', 'vision', 'system', 'contrastive', 'learning', 'embe', 'couple', 'modality', 'space', 'sort', 'flipflop', 'learning', 'process', 'get', 'powerful', 'multimodal', 'system', 'clip', 'thing', 'reinforcement', 'learning', 'gato', 'agent', 'basically', 'deepmind', 'take', 'bunch', 'distinct', 'task', 'different', 'modality', 'embed', 'space', 'learn', 'prediction', 'task', 'result', 'system', 'network', 'weight', 'play', 'atari', 'caption', 'image', 'chat', 'stack', 'block', 'real', 'robot', 'arm', 'much', 'decide', 'base', 'context', 'output', 'text', 'joint', 'torque', 'button', 'press', 'token', 'wild', 'stuff', 'gato', 'training', 'gato', 'okay', 'task', 'range', 'deepmind', 'lab', 'robot', 'manipulation', 'procgen', 'benchmark', 'image', 'captioning', 'natural', 'language', 'generation', 'big', 'deal', 'fact', 'take', 'bunch', 'different', 'task', 'different', 'modality', 'tokenize', 'work', 'wild', 'wildly', 'dumb', 'wildly', 'effective', 'c', 'nice', 'example', 'bitter', 'lesson', 'give', 'enough', 'computescale', 'dumb', 'thing', 'aka', 'simple', 'one', 'tend', 'work', 'really', 'well', 'small', 'package', 'large', 'disclose', 'gato', 'agent', 'parameter', 'make', 'fairly', 'small', 'grand', 'scheme', 'recent', 'development', 'even', 'crazy', 'thing', 'gato', 'model', 'context', 'window', 'token', 'comparison', 'gpt3', 'launch', 'fact', 'token', 'enough', 'get', 'somewhat', 'capable', 'multimodal', 'agent', 'pretty', 'surprising', 'matter', 'still', 'proofofconcept', 'stage', 'recent', 'progress', 'generalist', 'model', 'suggest', 'safety', 'researcher', 'ethicist', 'importantly', 'general', 'public', 'consider', 'risk', 'benefit', 'deepmind', 'write', 'check', 'blog', 'generalist', 'agent', 'deepmind', 'website', 'read', 'generalist', 'agent', 'deepmind', 'pdf']"
05/20/2022 - Import AI 295: DeepMind's baby general agent; NVIDIA simulates a robot factory; AI wars. - 2,http://eepurl.com/h2sj1D,2022-05-20,"#################################################### Chinese researchers build a large multi-modal dataset, and evaluation suite:
…'Zero' makes it easier to develop AI systems for the Chinese cultural context…
Chinese researchers with startup Qihoo 360 AI Research and the Department of Automation at Tsinghua University have built Zero, a benchmark for assessing the quality of vision-text Chinese AI models. Zero consists of a dataset (the Zero-Corpus, consisting of 23-million image-text pairs, filtered via high click through rates - so the top image people click in response to a query), as well as five downstream datasets for evaluating Chinese vision-text models (an Image-Caption Matching Dataset, an Image-Query Matching dataset, an Image-Caption Retrieval Dataset, an Image-Query Retrieval Dataset, and a Chinese-translated version of the Flickr30k dataset).

Model training: The authors also train a model, called R2D2, on the corpus. They show that their model significantly outperforms another Chinse model named Wukong. R2D2 incorporates some pre-ranking techniques to improve its performance.  Why this matters: The main idea behind datasets and models like this is described in the paper: ""promote the development of Chinese vision language learning. We expect that a fair Chinese cross-modal benchmark and a good cross-modal framework will encourage a plethora of engineers to develop more effective methods in specific real-world scenarios, such as searching images by texts.""
  Read more: Zero and R2D2: A Large-scale Chinese Cross-modal Benchmark and A Vision-Language Framework (arXiv).","#################################################### Chinese researchers build a large multi-modal dataset, and evaluation suite: …'Zero' makes it easier to develop AI systems for the Chinese cultural context… Chinese researchers with startup Qihoo 360 AI Research and the Department of Automation at Tsinghua University have built Zero, a benchmark for assessing the quality of vision-text Chinese AI models. Zero consists of a dataset (the Zero-Corpus, consisting of 23-million image-text pairs, filtered via high click through rates - so the top image people click in response to a query), as well as five downstream datasets for evaluating Chinese vision-text models (an Image-Caption Matching Dataset, an Image-Query Matching dataset, an Image-Caption Retrieval Dataset, an Image-Query Retrieval Dataset, and a Chinese-translated version of the Flickr30k dataset). Model training: The authors also train a model, called R2D2, on the corpus. They show that their model significantly outperforms another Chinse model named Wukong. R2D2 incorporates some pre-ranking techniques to improve its performance. Why this matters: The main idea behind datasets and models like this is described in the paper: ""promote the development of Chinese vision language learning. We expect that a fair Chinese cross-modal benchmark and a good cross-modal framework will encourage a plethora of engineers to develop more effective methods in specific real-world scenarios, such as searching images by texts."" Read more: Zero and R2D2: A Large-scale Chinese Cross-modal Benchmark and A Vision-Language Framework (arXiv).","['chinese', 'researcher', 'build', 'large', 'multimodal', 'dataset', 'evaluation', 'suite', 'make', 'easy', 'develop', 'ai', 'system', 'context', 'chinese', 'researcher', 'startup', 'qihoo', 'research', 'department', 'automation', 'build', 'benchmark', 'assess', 'quality', 'model', 'consist', 'dataset', 'consist', 'imagetext', 'pair', 'filter', 'high', 'click', 'rate', 'top', 'image', 'people', 'click', 'response', 'query', 'well', 'downstream', 'dataset', 'evaluate', 'chinese', 'visiontext', 'model', 'imagecaption', 'match', 'dataset', 'imagequery', 'matching', 'dataset', 'imagecaption', 'retrieval', 'imagequery', 'retrieval', 'dataset', 'chinesetranslated', 'version', 'dataset', 'model', 'training', 'author', 'also', 'train', 'model', 'call', 'corpus', 'show', 'model', 'significantly', 'outperform', 'chinse', 'model', 'name', 'wukong', 'incorporate', 'preranke', 'technique', 'improve', 'performance', 'matter', 'main', 'idea', 'dataset', 'model', 'describe', 'paper', 'promote', 'development', 'chinese', 'vision', 'language', 'learning', 'expect', 'fair', 'chinese', 'crossmodal', 'benchmark', 'good', 'crossmodal', 'framework', 'encourage', 'plethora', 'engineer', 'develop', 'effective', 'method', 'specific', 'realworld', 'scenario', 'search', 'image', 'text', 'read', 'largescale', 'chinese', 'crossmodal', 'benchmark', 'visionlanguage', 'framework']"
05/20/2022 - Import AI 295: DeepMind's baby general agent; NVIDIA simulates a robot factory; AI wars. - 3,http://eepurl.com/h2sj1D,2022-05-20,"#################################################### NVIDIA makes some efficient Factory simulation software:
…Finally, a physics simulator built around the needs of robots…
Researchers with NVIDIA and the University of Washington have built Factory, software for doing rich, efficient physics situations of robots. Factory is basically some highly optimized simulation software, with NVIDIA claiming significant performance speedups relative to widely-used software like Bullet. NVIDIA claims Factory can be used to do ""100s to 1000s of contact-rich interactions"" that can be ""simulated in real-time on a single GPU"".

What Factory includes:
- Physics simulation: A module for physics simulation, available within the 'PhysX' physics engine, as well as NVIDIA's robot software simulation tech, Isaac Gym
- A robot learning suite: A 'Franka' robot and rigid-body assemblies from NIST's 'Assembly Task Board 1' benchmark. This suite includes 60 robotic assets, 3 robotic assembly environments (a nut-and-bolt test, a peg insertion task, and a 4-party gear assembly task), and 7 classical robot controllers.
- Prototype reinforcement learning: Some basic RL policies (trained via PPO) for a simulated Franke robot to help it solve the NIST challenge.  Why this matters: One of the blockers on deploying AI-driven robots into the world is the challenge in crossing the 'sim-2-real' gap. Software like Factory makes that gap a lot narrower, and also makes it cheaper to explore what it takes to cross it.
  Read more: Factory: Fast Contact for Robotic Assembly (arXiv).","#################################################### NVIDIA makes some efficient Factory simulation software: …Finally, a physics simulator built around the needs of robots… Researchers with NVIDIA and the University of Washington have built Factory, software for doing rich, efficient physics situations of robots. Factory is basically some highly optimized simulation software, with NVIDIA claiming significant performance speedups relative to widely-used software like Bullet. NVIDIA claims Factory can be used to do ""100s to 1000s of contact-rich interactions"" that can be ""simulated in real-time on a single GPU"". What Factory includes: - Physics simulation: A module for physics simulation, available within the 'PhysX' physics engine, as well as NVIDIA's robot software simulation tech, Isaac Gym - A robot learning suite: A 'Franka' robot and rigid-body assemblies from NIST's 'Assembly Task Board 1' benchmark. This suite includes 60 robotic assets, 3 robotic assembly environments (a nut-and-bolt test, a peg insertion task, and a 4-party gear assembly task), and 7 classical robot controllers. - Prototype reinforcement learning: Some basic RL policies (trained via PPO) for a simulated Franke robot to help it solve the NIST challenge. Why this matters: One of the blockers on deploying AI-driven robots into the world is the challenge in crossing the 'sim-2-real' gap. Software like Factory makes that gap a lot narrower, and also makes it cheaper to explore what it takes to cross it. Read more: Factory: Fast Contact for Robotic Assembly (arXiv).","['make', 'efficient', 'factory', 'simulation', 'software', 'finally', 'physics', 'simulator', 'build', 'need', 'robot', 'researcher', 'build', 'factory', 'software', 'rich', 'efficient', 'physics', 'situation', 'robot', 'factory', 'basically', 'highly', 'optimize', 'simulation', 'software', 'nvidia', 'claim', 'significant', 'performance', 'speedup', 'relative', 'widelyused', 'software', 'bullet', 'claim', 'factory', 'use', '100', 'contactrich', 'interaction', 'simulate', 'realtime', 'single', 'gpu', 'factory', 'include', 'physics', 'simulation', 'module', 'physics', 'simulation', 'available', 'physx', 'physics', 'engine', 'well', 'robot', 'software', 'gym', 'robot', 'learning', 'suite', 'franka', 'robot', 'rigidbody', 'assembly', 'nist', 'assembly', 'task', 'board', 'benchmark', 'suite', 'include', 'robotic', 'asset', 'robotic', 'assembly', 'environment', 'nutandbolt', 'test', 'peg', 'insertion', 'task', 'gear', 'assembly', 'task', 'classical', 'robot', 'controller', 'prototype', 'reinforcement', 'learn', 'basic', 'rl', 'policy', 'train', 'simulated', 'franke', 'robot', 'help', 'solve', 'nist', 'challenge', 'matter', 'blocker', 'deploy', 'robot', 'world', 'challenge', 'cross', 'sim2real', 'gap', 'software', 'factory', 'make', 'gap', 'lot', 'narrower', 'also', 'make', 'cheap', 'explore', 'take', 'cross', 'read', 'factory', 'fast', 'contact', 'robotic', 'assembly']"
