title,url,date,text,cleaning,tokens
01/24/2022 - Import AI 281: China does more surveillance research than US and Europe; Google reveals its text model LaMDA; Microsoft improves MoEs - 0,http://eepurl.com/hSYp5z,2022-01-24,"Intro (no tag) Welcome to Import AI, a newsletter about artificial intelligence. Forward this email to give your chums an AI upgrade. Subscribe here.
  Google (finally) reveals its big text model - LaMDA:
…Plus: why you need a lot of humans to make a language model safe…
Google has finally given details on LaMDA, it's GPT-3 competitor. LaMDA are a family of language models ranging in size from 2B to 137B parameters (GPT3: 175B), and have been trained on a massive dataset of 1.56 trillion words. One way LaMDA is different to other big language models is that it is centered around dialogue, with 50% of its data coming from ""dialogues from public forums"". Google has also fine-tuned LaMDA models to make them better, safer, and more likely to give factual responses - all these fine-tuned versions are facilitate by Google using crowdworkers to gather specific dialog data.

The dataset: LaMDA's underlying dataset is called 'Infiniset', and besides the dialogue also involves common crawl, wikipedia, a mixture of english and non-english web documents, and data from programming-related sites (so LaMDA models can also dabble in code).

Learning to use an external dataset: Similar to DeepMind's 'RETRO' model, LaMDA has also been taught to use an external information retrieval system - this makes LaMDA models more factually correct than models without external datasets, because the model can check facts from an external, trusted source. To train the model, they also collect 9k dialogs where LaMDA's generated answers are labelled 'correct' or 'incorrect', to give it a stronger training signal.
  The results of this are quite striking. For example, when you ask a non-information-retrieval LaMDA model ""What do you think of Rosalie Gascoigne’s sculptures?"", it replies: ""LAMDA-BASE: They’re great, and I love how her work changed through her life. I like her later work more than her earlier ones. Her influence is also super interesting - did you know she was one of the artists that inspired Miró?"". This response seems plausible but it's wrong - Miro was active till late 1960s, and Gascoigne first solo exhibits were in 1970s, so she couldn't have been an influence on Miro.
  By comparison, the version of LaMDA trained on information retrieval says this: ""LAMDA: Oh wow, her life course is so inspiring. Did you know she was a practitioner of Japanese flower arrangement before turning to sculpture? https://artsearch.nga.gov.au/detail.cfm?irn=8774&pictaus=true"", where it gives a factually accurate statement and provides a source as well.

Things that make you go 'hmmm' - more compute than GPT-3: LaMDA consumed 3.55E+23 flops during training, versus 3.14+23 flops for GPT3 (so more parameters doesn't necessarily mean more resource intensive). It was trained on a cluster of 1024 TPU V3 chips.

Why this matters: ""LaMDA is a step closer to practical and safe open-ended dialog systems, which can in turn unlock a wide range of useful applications. We hope that this work encourages further research in this area"", Google writes. This is true - systems like LaMDA are basically refinements and improvements on the ideas of GPT2/3. We're a few years away from everyone having access to vast, planet-scale AI models that tell them truthful things in natural ways - the proverbial angel (or devil) on everyone's shoulder. The cultural impacts will be vast and destabilizing.
  Read more: LaMDA: Language Models for Dialogue Applications (arXiv).","Intro (no tag) Welcome to Import AI, a newsletter about artificial intelligence. Forward this email to give your chums an AI upgrade. Subscribe here. Google (finally) reveals its big text model - LaMDA: …Plus: why you need a lot of humans to make a language model safe… Google has finally given details on LaMDA, it's GPT-3 competitor. LaMDA are a family of language models ranging in size from 2B to 137B parameters (GPT3: 175B), and have been trained on a massive dataset of 1.56 trillion words. One way LaMDA is different to other big language models is that it is centered around dialogue, with 50% of its data coming from ""dialogues from public forums"". Google has also fine-tuned LaMDA models to make them better, safer, and more likely to give factual responses - all these fine-tuned versions are facilitate by Google using crowdworkers to gather specific dialog data. The dataset: LaMDA's underlying dataset is called 'Infiniset', and besides the dialogue also involves common crawl, wikipedia, a mixture of english and non-english web documents, and data from programming-related sites (so LaMDA models can also dabble in code). Learning to use an external dataset: Similar to DeepMind's 'RETRO' model, LaMDA has also been taught to use an external information retrieval system - this makes LaMDA models more factually correct than models without external datasets, because the model can check facts from an external, trusted source. To train the model, they also collect 9k dialogs where LaMDA's generated answers are labelled 'correct' or 'incorrect', to give it a stronger training signal. The results of this are quite striking. For example, when you ask a non-information-retrieval LaMDA model ""What do you think of Rosalie Gascoigne’s sculptures?"", it replies: ""LAMDA-BASE: They’re great, and I love how her work changed through her life. I like her later work more than her earlier ones. Her influence is also super interesting - did you know she was one of the artists that inspired Miró?"". This response seems plausible but it's wrong - Miro was active till late 1960s, and Gascoigne first solo exhibits were in 1970s, so she couldn't have been an influence on Miro. By comparison, the version of LaMDA trained on information retrieval says this: ""LAMDA: Oh wow, her life course is so inspiring. Did you know she was a practitioner of Japanese flower arrangement before turning to sculpture? https://artsearch.nga.gov.au/detail.cfm?irn=8774&pictaus=true"", where it gives a factually accurate statement and provides a source as well. Things that make you go 'hmmm' - more compute than GPT-3: LaMDA consumed 3.55E+23 flops during training, versus 3.14+23 flops for GPT3 (so more parameters doesn't necessarily mean more resource intensive). It was trained on a cluster of 1024 TPU V3 chips. Why this matters: ""LaMDA is a step closer to practical and safe open-ended dialog systems, which can in turn unlock a wide range of useful applications. We hope that this work encourages further research in this area"", Google writes. This is true - systems like LaMDA are basically refinements and improvements on the ideas of GPT2/3. We're a few years away from everyone having access to vast, planet-scale AI models that tell them truthful things in natural ways - the proverbial angel (or devil) on everyone's shoulder. The cultural impacts will be vast and destabilizing. Read more: LaMDA: Language Models for Dialogue Applications (arXiv).","['tag', 'welcome', 'import', 'newsletter', 'artificial', 'intelligence', 'email', 'give', 'chum', 'ai', 'upgrade', 'subscribe', 'finally', 'reveal', 'big', 'text', 'model', 'lamda', 'need', 'lot', 'human', 'make', 'language', 'model', 'safe', 'finally', 'give', 'detail', 'gpt3', 'competitor', 'lamda', 'family', 'language', 'model', 'range', 'size', '137b', 'parameter', 'gpt3', 'train', 'massive', 'dataset', 'word', 'way', 'lamda', 'different', 'big', 'language', 'model', 'center', 'dialogue', 'datum', 'come', 'dialogue', 'public', 'forum', 'also', 'finetune', 'lamda', 'model', 'make', 'well', 'safe', 'likely', 'give', 'factual', 'response', 'finetune', 'version', 'facilitate', 'use', 'crowdworker', 'gather', 'specific', 'dialog', 'datum', 'dataset', 'lamda', 'underlie', 'dataset', 'call', 'infiniset', 'dialogue', 'also', 'involve', 'common', 'crawl', 'wikipedia', 'mixture', 'nonenglish', 'web', 'document', 'datum', 'programmingrelate', 'site', 'lamda', 'model', 'also', 'dabble', 'code', 'learning', 'use', 'external', 'dataset', 'similar', 'deepmind', 'retro', 'model', 'lamda', 'also', 'teach', 'use', 'external', 'information', 'retrieval', 'system', 'make', 'lamda', 'model', 'factually', 'correct', 'model', 'external', 'dataset', 'model', 'check', 'fact', 'external', 'trust', 'source', 'train', 'model', 'also', 'collect', 'dialog', 'lamda', 'generate', 'answer', 'label', 'correct', 'incorrect', 'give', 'strong', 'training', 'signal', 'result', 'quite', 'striking', 'example', 'ask', 'noninformationretrieval', 'lamda', 'model', 'think', 'rosalie', 'sculpture', 'reply', '’re', 'great', 'love', 'work', 'change', 'life', 'like', 'later', 'work', 'early', 'one', 'influence', 'also', 'super', 'interesting', 'know', 'artist', 'inspire', 'miró', 'response', 'seem', 'plausible', 'wrong', 'active', 'late', '1960', 'gascoigne', 'first', 'solo', 'exhibit', '1970', 'influence', 'comparison', 'version', 'lamda', 'train', 'information', 'say', 'lamda', 'life', 'course', 'inspiring', 'know', 'practitioner', 'japanese', 'flower', 'arrangement', 'turn', 'sculpture', 'give', 'factually', 'accurate', 'statement', 'provide', 'source', 'well', 'thing', 'make', 'go', 'compute', 'gpt3', 'consume', 'flop', 'training', 'flop', 'gpt3', 'parameter', 'necessarily', 'mean', 'resource', 'intensive', 'train', 'cluster', 'tpu', 'chip', 'matter', 'lamda', 'step', 'close', 'practical', 'safe', 'openende', 'dialog', 'system', 'turn', 'unlock', 'wide', 'range', 'useful', 'application', 'hope', 'work', 'encourage', 'research', 'area', 'write', 'true', 'system', 'lamda', 'basically', 'refinement', 'improvement', 'idea', 'year', 'away', 'access', 'vast', 'planetscale', 'ai', 'model', 'tell', 'truthful', 'thing', 'natural', 'way', 'proverbial', 'angel', 'devil', 'everyone', 'shoulder', 'cultural', 'impact', 'vast', 'destabilizing', 'read', 'lamda', 'language', 'model', 'dialogue', 'application']"
01/24/2022 - Import AI 281: China does more surveillance research than US and Europe; Google reveals its text model LaMDA; Microsoft improves MoEs - 1,http://eepurl.com/hSYp5z,2022-01-24,"#################################################### Write about a world where AI goes well, and win (part of) $100k:
…Future of Life Institute's worldbuilding contest tries to imagine positive AGI rollouts…
The Future of Life Institute is launching a competition based around ""designing visions of a plausible, aspirational future that includes strong artificial intelligence."" The competition deadline is April 15th 2022. The idea here is that if we can figure out realistic ways in which powerful AI can go well, then that gives us a map to use to get civilization there. The first prize is $20,000, followed by two second prizes of $10,000 each, and smaller prizes.
    Find out more about the competition here (Worldbuild.ai, FLI site).","#################################################### Write about a world where AI goes well, and win (part of) $100k: …Future of Life Institute's worldbuilding contest tries to imagine positive AGI rollouts… The Future of Life Institute is launching a competition based around ""designing visions of a plausible, aspirational future that includes strong artificial intelligence."" The competition deadline is April 15th 2022. The idea here is that if we can figure out realistic ways in which powerful AI can go well, then that gives us a map to use to get civilization there. The first prize is $20,000, followed by two second prizes of $10,000 each, and smaller prizes. Find out more about the competition here (Worldbuild.ai, FLI site).","['write', 'world', 'ai', 'go', 'well', 'win', 'part', 'future', 'life', 'institute', 'worldbuilding', 'contest', 'try', 'imagine', 'positive', 'agi', 'rollout', 'future', 'life', 'institute', 'launch', 'competition', 'base', 'design', 'vision', 'plausible', 'aspirational', 'future', 'include', 'strong', 'artificial', 'intelligence', 'competition', 'deadline', '15th', 'idea', 'figure', 'realistic', 'way', 'powerful', 'go', 'well', 'give', 'map', 'use', 'get', 'civilization', 'first', 'prize', 'follow', 'second', 'prize', 'small', 'prize', 'find', 'competition', 'fli', 'site']"
01/24/2022 - Import AI 281: China does more surveillance research than US and Europe; Google reveals its text model LaMDA; Microsoft improves MoEs - 2,http://eepurl.com/hSYp5z,2022-01-24,"#################################################### Want to teach your drone to see? Use this massive dataset:
…WebUAV-3M is probably the largest public UAV tracking dataset…
Researchers with the Chinese Academy of Sciences, the Shenzhen Research Institute of Big Data, and the Chinese University of Hong Kong Shenzhen, have built WebUAV-3M, a large dataset to help people teach drones to accurately label images and videos. WebUAV-3M consists of 4,485 videos, where each one has been labeled with dense bounding boxes that cover 216 distinct categories of object to be tracked (e.g, bears, wind turbines, bicycles, etc). The authors claim this is ""by far the largest public UAV tracking benchmark"".

Multimodal: Unusually, this is a multi-modal dataset; each labeled video is accompanied by a natural language sentence describing the video, as well as an audio description of it. ""We provide natural language specifications and audio descriptions to facilitate multi-modal deep UAV tracking,"" the authors write. ""The natural language specification can provide auxiliary information to achieve accurate tracking"".

Why this matters: In the same way CCTV cameras have instrumented the streets of cities around the world, drones are doing the same for cities and rural areas. And just like how increasingly good AI got trained on datasets gathered by CCTV cameras, we can expect the same for drones. The result? An ever-expanding suite of surveillance capabilities that we can expect will be integrated, for good and bad purposes, by a broad range of governments and private sector actors. Datasets like WebUAV-3M are the fuel for this.
  Read more: WebUAV-3M: A Benchmark Unveiling the Power of Million-Scale Deep UAV Tracking (arXiv).
  Get the code from here (eventually - wasn't online when I wrote this section this week).","#################################################### Want to teach your drone to see? Use this massive dataset: …WebUAV-3M is probably the largest public UAV tracking dataset… Researchers with the Chinese Academy of Sciences, the Shenzhen Research Institute of Big Data, and the Chinese University of Hong Kong Shenzhen, have built WebUAV-3M, a large dataset to help people teach drones to accurately label images and videos. WebUAV-3M consists of 4,485 videos, where each one has been labeled with dense bounding boxes that cover 216 distinct categories of object to be tracked (e.g, bears, wind turbines, bicycles, etc). The authors claim this is ""by far the largest public UAV tracking benchmark"". Multimodal: Unusually, this is a multi-modal dataset; each labeled video is accompanied by a natural language sentence describing the video, as well as an audio description of it. ""We provide natural language specifications and audio descriptions to facilitate multi-modal deep UAV tracking,"" the authors write. ""The natural language specification can provide auxiliary information to achieve accurate tracking"". Why this matters: In the same way CCTV cameras have instrumented the streets of cities around the world, drones are doing the same for cities and rural areas. And just like how increasingly good AI got trained on datasets gathered by CCTV cameras, we can expect the same for drones. The result? An ever-expanding suite of surveillance capabilities that we can expect will be integrated, for good and bad purposes, by a broad range of governments and private sector actors. Datasets like WebUAV-3M are the fuel for this. Read more: WebUAV-3M: A Benchmark Unveiling the Power of Million-Scale Deep UAV Tracking (arXiv). Get the code from here (eventually - wasn't online when I wrote this section this week).","['want', 'teach', 'drone', 'see', 'use', 'massive', 'dataset', 'webuav3', 'probably', 'large', 'public', 'track', 'researcher', 'big', 'datum', 'build', 'webuav3', 'large', 'dataset', 'help', 'people', 'teach', 'drone', 'accurately', 'label', 'image', 'video', 'webuav3', 'consist', 'video', 'one', 'label', 'dense', 'bounding', 'box', 'cover', 'distinct', 'category', 'object', 'track', 'eg', 'bear', 'wind', 'turbine', 'bicycle', 'author', 'claim', 'far', 'large', 'public', 'track', 'benchmark', 'multimodal', 'unusually', 'multimodal', 'dataset', 'label', 'video', 'accompany', 'natural', 'language', 'sentence', 'describe', 'video', 'well', 'audio', 'description', 'provide', 'natural', 'language', 'specification', 'audio', 'description', 'facilitate', 'multimodal', 'deep', 'uav', 'track', 'author', 'write', 'natural', 'language', 'specification', 'provide', 'auxiliary', 'information', 'achieve', 'accurate', 'tracking', 'matter', 'way', 'camera', 'instrument', 'street', 'city', 'world', 'drone', 'city', 'rural', 'area', 'increasingly', 'good', 'ai', 'train', 'dataset', 'gather', 'camera', 'expect', 'drone', 'result', 'everexpande', 'suite', 'surveillance', 'capability', 'expect', 'integrate', 'good', 'bad', 'purpose', 'broad', 'range', 'government', 'private', 'sector', 'actor', 'dataset', 'webuav3', 'fuel', 'read', 'webuav3', 'benchmark', 'unveil', 'power', 'millionscale', 'deep', 'get', 'code', 'eventually', 'online', 'write', 'section', 'week']"
01/24/2022 - Import AI 281: China does more surveillance research than US and Europe; Google reveals its text model LaMDA; Microsoft improves MoEs - 3,http://eepurl.com/hSYp5z,2022-01-24,"#################################################### FFCV: Train ImageNet for 98 cents!
…What's this? Free software that makes all model training better? Interesting!...:
There's some new software that could help pretty much everyone train models more efficiently. The software is called FFCV, short for Fast Forward Computer Vision, and it is a ""drop-in data loading system that dramatically increases data throughput in model training"". It looks like a potentially big deal - FFCV can be much more efficient for training AI models, according to tests done by the authors, and may also work for other applications as well. ""FFCV can speed up a lot more beyond just neural network training---in fact, the more data-bottlenecked the application (e.g., linear regression, bulk inference, etc.), the faster FFCV will make it!,"" says the project's GitHub page.

Why this matters: Software like FFCV is part of the broader industrialization of AI - now we know how to train networks, various people are modularizing the training process and perfecting different elements of it. Stuff like FFCV is part of that trend.
  Find out more and get the code: FFCV GitHub repo.
   Get more details by reading the Performance Guide (FFCV site).
  Check out the main project website here (FFCV site).","#################################################### FFCV: Train ImageNet for 98 cents! …What's this? Free software that makes all model training better? Interesting!...: There's some new software that could help pretty much everyone train models more efficiently. The software is called FFCV, short for Fast Forward Computer Vision, and it is a ""drop-in data loading system that dramatically increases data throughput in model training"". It looks like a potentially big deal - FFCV can be much more efficient for training AI models, according to tests done by the authors, and may also work for other applications as well. ""FFCV can speed up a lot more beyond just neural network training---in fact, the more data-bottlenecked the application (e.g., linear regression, bulk inference, etc.), the faster FFCV will make it!,"" says the project's GitHub page. Why this matters: Software like FFCV is part of the broader industrialization of AI - now we know how to train networks, various people are modularizing the training process and perfecting different elements of it. Stuff like FFCV is part of that trend. Find out more and get the code: FFCV GitHub repo. Get more details by reading the Performance Guide (FFCV site). Check out the main project website here (FFCV site).","['train', 'imagenet', 'cent', 'free', 'software', 'make', 'model', 'training', 'well', 'interesting', 'new', 'software', 'help', 'pretty', 'much', 'train', 'model', 'efficiently', 'software', 'call', 'ffcv', 'short', 'fast', 'forward', 'computer', 'vision', 'dropin', 'data', 'loading', 'system', 'dramatically', 'increase', 'datum', 'throughput', 'model', 'training', 'look', 'potentially', 'big', 'deal', 'ffcv', 'much', 'efficient', 'training', 'ai', 'model', 'accord', 'test', 'author', 'also', 'work', 'application', 'well', 'ffcv', 'speed', 'lot', 'neural', 'network', 'trainingin', 'fact', 'databottlenecke', 'application', 'eg', 'linear', 'regression', 'bulk', 'inference', 'fast', 'ffcv', 'make', 'say', 'project', 'page', 'matter', 'software', 'part', 'broad', 'industrialization', 'know', 'train', 'network', 'various', 'people', 'modularize', 'training', 'process', 'perfect', 'different', 'element', 'stuff', 'part', 'trend', 'find', 'get', 'code', 'ffcv', 'get', 'detail', 'read', 'performance', 'guide', 'ffcv', 'site', 'check', 'main', 'project', 'website', 'site']"
