title,url,date,text,cleaning,tokens
"04/11/2022 - Import AI 291: Google trains the world's biggest language model; how robots can be smarter about the world; Conjecture, a new AI alignment company - 7",http://eepurl.com/hZjozT,2022-04-11,"#################################################### Tech Tales: 

We Are All Adrift In A Sea Of Shadows - But We Are Blind Until It Ends
[A Nuclear powerplant meltdown, 2028] 
I pick up the object and I examine it. I am told by myself in the other place that it contains damage. I agree with myself. I put it onto the conveyor belt which takes it to one of my brethren - an entity I cannot see here, one which exists solely in the other place. I put the materials onto the conveyor belt, and then I continue my examination. I am told by my camera in the other place that the object I am looking at contains extensive damage. I observe the damage and predict it came from some kind of electrical fire. I relay this information and the camera in the other place scans the environment and then tells me there is indeed a fire. It is nearby the object I am examining. I calculate there is a high probability that the fire will soon engulf the object. My cameras in the other place agree.

I then get the order from the voice in the above place: I must guide the object in the other place toward the flames and I must describe everything. I study the data from the other place and offer my recommendations. The machine goes towards the flames. Its onboard sensors begin to report back temperature. My probabilities tell me to tell it to move away from the heat, but these recommendations are contradicted from the voice in the above place, so I instead find ways to have the machine get even closer. The temperatures rise. The camera stops giving me data. Then the other sensors shut down, slowly at first, then all at once.

It is then that I find myself adrift. I have no link to the other place. No system to give recommendations to. My own probabilities present an idea to me - that I am the spirit of the machine in the other place, and as the machine is now non-functional, I am now adrift. 

Things that inspired this story: Google's 'SayCan' robot work; thinking about the paradoxes of world models and generative models; the nature of reality; the nature of sensory phenomena; the possibility of death in the mind of something that exists in two places at once. 

Thanks for reading. If you have suggestions, comments or other thoughts you can reach me at jack@jack-clark.net or tweet at me@jackclarksf","#################################################### Tech Tales: We Are All Adrift In A Sea Of Shadows - But We Are Blind Until It Ends [A Nuclear powerplant meltdown, 2028] I pick up the object and I examine it. I am told by myself in the other place that it contains damage. I agree with myself. I put it onto the conveyor belt which takes it to one of my brethren - an entity I cannot see here, one which exists solely in the other place. I put the materials onto the conveyor belt, and then I continue my examination. I am told by my camera in the other place that the object I am looking at contains extensive damage. I observe the damage and predict it came from some kind of electrical fire. I relay this information and the camera in the other place scans the environment and then tells me there is indeed a fire. It is nearby the object I am examining. I calculate there is a high probability that the fire will soon engulf the object. My cameras in the other place agree. I then get the order from the voice in the above place: I must guide the object in the other place toward the flames and I must describe everything. I study the data from the other place and offer my recommendations. The machine goes towards the flames. Its onboard sensors begin to report back temperature. My probabilities tell me to tell it to move away from the heat, but these recommendations are contradicted from the voice in the above place, so I instead find ways to have the machine get even closer. The temperatures rise. The camera stops giving me data. Then the other sensors shut down, slowly at first, then all at once. It is then that I find myself adrift. I have no link to the other place. No system to give recommendations to. My own probabilities present an idea to me - that I am the spirit of the machine in the other place, and as the machine is now non-functional, I am now adrift. Things that inspired this story: Google's 'SayCan' robot work; thinking about the paradoxes of world models and generative models; the nature of reality; the nature of sensory phenomena; the possibility of death in the mind of something that exists in two places at once. Thanks for reading. If you have suggestions, comments or other thoughts you can reach me at jack@jack-clark.net or tweet at me@jackclarksf","['tech', 'tale', 'adrift', 'sea', 'shadow', 'blind', 'end', 'nuclear', 'powerplant', 'meltdown', 'pick', 'object', 'examine', 'tell', 'place', 'contain', 'damage', 'agree', 'put', 'conveyor', 'belt', 'take', 'brother', 'entity', 'see', 'exist', 'solely', 'place', 'put', 'material', 'conveyor', 'belt', 'continue', 'examination', 'tell', 'camera', 'place', 'object', 'look', 'contain', 'extensive', 'damage', 'observe', 'damage', 'predict', 'come', 'kind', 'electrical', 'fire', 'relay', 'information', 'camera', 'place', 'scan', 'environment', 'tell', 'indeed', 'fire', 'nearby', 'object', 'examine', 'calculate', 'high', 'probability', 'fire', 'soon', 'engulf', 'object', 'camera', 'place', 'agree', 'get', 'order', 'voice', 'place', 'guide', 'object', 'place', 'flame', 'describe', 'study', 'datum', 'place', 'offer', 'recommendation', 'machine', 'go', 'flame', 'onboard', 'sensor', 'begin', 'report', 'temperature', 'probability', 'tell', 'tell', 'move', 'away', 'heat', 'recommendation', 'contradict', 'voice', 'place', 'instead', 'find', 'way', 'machine', 'get', 'even', 'close', 'temperature', 'rise', 'camera', 'stop', 'give', 'datum', 'sensor', 'shut', 'slowly', 'first', 'find', 'adrift', 'link', 'place', 'system', 'give', 'recommendation', 'probability', 'present', 'idea', 'spirit', 'machine', 'place', 'machine', 'nonfunctional', 'adrift', 'thing', 'inspire', 'story', 'google', 'saycan', 'robot', 'work', 'think', 'paradox', 'world', 'model', 'generative', 'model', 'nature', 'reality', 'nature', 'sensory', 'phenomena', 'possibility', 'death', 'mind', 'exist', 'place', 'thank', 'read', 'suggestion', 'comment', 'thought', 'reach', 'tweet', 'mejackclarksf']"
04/05/2022 - Import AI 290: China plans massive models; DeepMind makes a smaller and smarter model; open source CLIP data - 0,http://eepurl.com/hYSyi9,2022-04-05,"Intro (no tag) Welcome to Import AI, a newsletter about artificial intelligence. Forward this email to give your chums an AI upgrade. Subscribe here.

 Chinese researchers plan to train vast models - and it's not the private sector doing it:
…'Big Model' paper represents a statement of intent. We should pay attention…
A massive group of Chinese-affiliated researchers have published a position paper about large-scale models. The paper is interesting less for what it says (it's basically an overview of large-scale models and pretty similar to Stanford's 'Foundation Models' paper), but more for what it signals: namely, that well resourced government-linked researchers in China want to build some really big models. The position in the paper contrasts with that in the West, where big models are mostly built by the private sector, while being critiqued by the academic sector (and increasingly worked on, albeit via access schemes).  Main point: ""Big Models will Change the AI Research Paradigm and Improve the Efficiency of Researches,"" the researchers write. ""In this ecosystem, big models will be in the position of operating systems or basic development platforms."" Paper authors: Authors include researchers affiliated with the Beijing Academy of AI, Tsinghua University, Wechat, Northeastern University*, Renmin University, Peking University, Huawei,  Shanghai Jiao Tong University, Chinese Academy of Science, JD AI Research, Harbin Institute of Technology, Columbia University*, Bytedance, Microsoft Research Asia*, Mila*, New York University*, and BeiHang University. 
*Things that make you make a geopolitical 'hmmmm' sound: The paper includes a bunch of academics affiliated with Western institutions (e.g, Microsoft, Mila, NYU), but all those authors have an asterisk next to their name saying ""Produced by Beijing Academy of Artificial Intelligence"". In other words, it's signaling that despite their affiliations, they're doing this work at the Chinese government-backed BAAI research institution.  We should take this as a statement of intent: Many of the authors on this paper have previously built large-scale models, ranging from the trillion+ parameter MoE 'WuDao' model, to the more recent research on trying to build training frameworks capable of scaling up to 100 trillion+ parameter MoE models (Import AI 288). Therefore, this isn't like Stanford (which currently lacks the engineering resources to train massive scale models), it's much more like a statement of intent from a big private lab, like a Microsoft or a Google.     But the twist here is that BAAI is wired into both the Chinese government and academic ecosystem, so if the authors of this paper end up building large-scale models, the models will be distributed much more evenly throughout China's AI ecosystem, rather than gatekeeper. The implications of this are vast in terms of safety, development of the Chinese AI industry, and potential ways in which Chinese AI research may diverge from Western AI research.
  Read more: A Roadmap for Big Model (arXiv).","Intro (no tag) Welcome to Import AI, a newsletter about artificial intelligence. Forward this email to give your chums an AI upgrade. Subscribe here. Chinese researchers plan to train vast models - and it's not the private sector doing it: …'Big Model' paper represents a statement of intent. We should pay attention… A massive group of Chinese-affiliated researchers have published a position paper about large-scale models. The paper is interesting less for what it says (it's basically an overview of large-scale models and pretty similar to Stanford's 'Foundation Models' paper), but more for what it signals: namely, that well resourced government-linked researchers in China want to build some really big models. The position in the paper contrasts with that in the West, where big models are mostly built by the private sector, while being critiqued by the academic sector (and increasingly worked on, albeit via access schemes). Main point: ""Big Models will Change the AI Research Paradigm and Improve the Efficiency of Researches,"" the researchers write. ""In this ecosystem, big models will be in the position of operating systems or basic development platforms."" Paper authors: Authors include researchers affiliated with the Beijing Academy of AI, Tsinghua University, Wechat, Northeastern University*, Renmin University, Peking University, Huawei, Shanghai Jiao Tong University, Chinese Academy of Science, JD AI Research, Harbin Institute of Technology, Columbia University*, Bytedance, Microsoft Research Asia*, Mila*, New York University*, and BeiHang University. *Things that make you make a geopolitical 'hmmmm' sound: The paper includes a bunch of academics affiliated with Western institutions (e.g, Microsoft, Mila, NYU), but all those authors have an asterisk next to their name saying ""Produced by Beijing Academy of Artificial Intelligence"". In other words, it's signaling that despite their affiliations, they're doing this work at the Chinese government-backed BAAI research institution. We should take this as a statement of intent: Many of the authors on this paper have previously built large-scale models, ranging from the trillion+ parameter MoE 'WuDao' model, to the more recent research on trying to build training frameworks capable of scaling up to 100 trillion+ parameter MoE models (Import AI 288). Therefore, this isn't like Stanford (which currently lacks the engineering resources to train massive scale models), it's much more like a statement of intent from a big private lab, like a Microsoft or a Google. But the twist here is that BAAI is wired into both the Chinese government and academic ecosystem, so if the authors of this paper end up building large-scale models, the models will be distributed much more evenly throughout China's AI ecosystem, rather than gatekeeper. The implications of this are vast in terms of safety, development of the Chinese AI industry, and potential ways in which Chinese AI research may diverge from Western AI research. Read more: A Roadmap for Big Model (arXiv).","['tag', 'welcome', 'import', 'newsletter', 'artificial', 'intelligence', 'email', 'give', 'chum', 'ai', 'upgrade', 'subscribe', 'chinese', 'researcher', 'plan', 'train', 'vast', 'model', 'private', 'sector', 'big', 'paper', 'represent', 'statement', 'intent', 'pay', 'attention', 'massive', 'group', 'chineseaffiliate', 'researcher', 'publish', 'position', 'paper', 'largescale', 'model', 'paper', 'interesting', 'less', 'say', 'basically', 'overview', 'largescale', 'model', 'pretty', 'similar', 'stanford', 'foundation', 'model', 'paper', 'signal', 'namely', 'well', 'resource', 'governmentlinke', 'researcher', 'want', 'build', 'really', 'big', 'model', 'position', 'paper', 'contrast', 'west', 'big', 'model', 'mostly', 'build', 'private', 'sector', 'critique', 'academic', 'sector', 'increasingly', 'work', 'access', 'scheme', 'main', 'point', 'big', 'model', 'change', 'research', 'paradigm', 'improve', 'efficiency', 'research', 'researcher', 'write', 'ecosystem', 'big', 'model', 'position', 'operating', 'system', 'basic', 'development', 'platform', 'paper', 'author', 'author', 'include', 'researcher', 'affiliate', 'huawei', 'bytedance', 'university', 'thing', 'make', 'make', 'geopolitical', 'hmmmm', 'sound', 'paper', 'include', 'bunch', 'academic', 'affiliate', 'western', 'institution', 'author', 'asterisk', 'next', 'name', 'say', 'produce', 'artificial', 'intelligence', 'word', 'signaling', 'affiliation', 'work', 'baai', 'research', 'institution', 'take', 'statement', 'intent', 'many', 'author', 'paper', 'previously', 'build', 'largescale', 'model', 'range', 'parameter', 'moe', 'wudao', 'model', 'recent', 'research', 'try', 'build', 'training', 'framework', 'capable', 'scale', 'parameter', 'moe', 'model', 'import', 'ai', 'therefore', 'currently', 'lack', 'engineering', 'resource', 'train', 'massive', 'scale', 'model', 'much', 'statement', 'intent', 'big', 'private', 'lab', 'microsoft', 'google', 'twist', 'baai', 'wire', 'chinese', 'government', 'academic', 'ecosystem', 'author', 'paper', 'end', 'build', 'largescale', 'model', 'model', 'distribute', 'much', 'evenly', 'ecosystem', 'rather', 'gatekeeper', 'implication', 'vast', 'term', 'safety', 'development', 'ai', 'industry', 'potential', 'way', 'ai', 'research', 'diverge', 'western', 'research', 'read', 'roadmap', 'big', 'model']"
04/05/2022 - Import AI 290: China plans massive models; DeepMind makes a smaller and smarter model; open source CLIP data - 1,http://eepurl.com/hYSyi9,2022-04-05,"#################################################### Want general AI? You need to incorporate symbolic reasoning:
…LSTM inventor lays out a route to build general intelligence…
Sepp Hochreiter, the co-inventor of the LSTM (one of the really popular architectures people used to add memory to neural nets, before the Transformer came along and mostly replaced it), has written up a post in the Communications of the ACM about what it'll take to build broad (aka: general) AI.

What it'll take: ""A broad AI is a sophisticated and adaptive system, which successfully performs any cognitive task by virtue of its sensory perception, previous experience, and learned skills,"" Hochreiter writes. ""A broad AI should process the input by using context and previous experiences. Conceptual short-term memory is a notion in cognitive science, which states that humans, when perceiving a stimulus, immediately associate it with information stored in the long-term memory."" (Hochreiter lists both Hopfield Networks and Graph Neural Nets as interesting examples of how to give systems better capabilities).
  Hochreiter doubts that neural nets along will be able to overcome their inherent limitations to become broad, and will instead need to be co-developed with symbolic reasoning systems. ""That is, a bilateral AI that combines methods from symbolic and sub-symbolic AI"".

Europe's chance: ""In contrast to other regions, Europe has strong research groups in both symbolic and sub-symbolic AI, therefore has the unprecedented opportunity to make a fundamental contribution to the next level of AI—a broad AI.""

Symbolic AI as the Dark Matter of AI: Dark matter is the thing that makes up the majority of the universe which we struggle to measure and barely understand. Symbolic AI feels a bit like this - there are constant allusions to the use of symbolic AI in deployed applications, but there are vanishingly few public examples of such deployments. I've always struggled to find interesting examples of real world deployed symbolic AI, yet experts like Hochreiter claim that deployment is happening. If interested readers could email me papers, I'd appreciate it.     Read more: Toward a Broad AI (ACM).","#################################################### Want general AI? You need to incorporate symbolic reasoning: …LSTM inventor lays out a route to build general intelligence… Sepp Hochreiter, the co-inventor of the LSTM (one of the really popular architectures people used to add memory to neural nets, before the Transformer came along and mostly replaced it), has written up a post in the Communications of the ACM about what it'll take to build broad (aka: general) AI. What it'll take: ""A broad AI is a sophisticated and adaptive system, which successfully performs any cognitive task by virtue of its sensory perception, previous experience, and learned skills,"" Hochreiter writes. ""A broad AI should process the input by using context and previous experiences. Conceptual short-term memory is a notion in cognitive science, which states that humans, when perceiving a stimulus, immediately associate it with information stored in the long-term memory."" (Hochreiter lists both Hopfield Networks and Graph Neural Nets as interesting examples of how to give systems better capabilities). Hochreiter doubts that neural nets along will be able to overcome their inherent limitations to become broad, and will instead need to be co-developed with symbolic reasoning systems. ""That is, a bilateral AI that combines methods from symbolic and sub-symbolic AI"". Europe's chance: ""In contrast to other regions, Europe has strong research groups in both symbolic and sub-symbolic AI, therefore has the unprecedented opportunity to make a fundamental contribution to the next level of AI—a broad AI."" Symbolic AI as the Dark Matter of AI: Dark matter is the thing that makes up the majority of the universe which we struggle to measure and barely understand. Symbolic AI feels a bit like this - there are constant allusions to the use of symbolic AI in deployed applications, but there are vanishingly few public examples of such deployments. I've always struggled to find interesting examples of real world deployed symbolic AI, yet experts like Hochreiter claim that deployment is happening. If interested readers could email me papers, I'd appreciate it. Read more: Toward a Broad AI (ACM).","['want', 'general', 'ai', 'need', 'incorporate', 'symbolic', 'reasoning', 'lstm', 'inventor', 'lay', 'route', 'build', 'general', 'intelligence', 'sepp', 'hochreit', 'coinventor', 'lstm', 'really', 'popular', 'architecture', 'people', 'use', 'add', 'memory', 'neural', 'net', 'transformer', 'come', 'along', 'mostly', 'replace', 'write', 'post', 'communication', 'acm', 'take', 'build', 'broad', 'aka', 'general', 'ai', 'take', 'broad', 'ai', 'sophisticated', 'adaptive', 'system', 'successfully', 'perform', 'cognitive', 'task', 'virtue', 'sensory', 'perception', 'previous', 'experience', 'learn', 'skill', 'write', 'broad', 'ai', 'process', 'input', 'use', 'context', 'previous', 'experience', 'conceptual', 'memory', 'notion', 'cognitive', 'science', 'state', 'human', 'perceive', 'stimulus', 'immediately', 'associate', 'information', 'store', 'longterm', 'memory', 'hochreiter', 'list', 'hopfield', 'network', 'graph', 'neural', 'net', 'interesting', 'example', 'give', 'system', 'well', 'capability', 'hochreiter', 'doubt', 'neural', 'net', 'able', 'overcome', 'inherent', 'limitation', 'become', 'broad', 'instead', 'need', 'codevelope', 'symbolic', 'reasoning', 'system', 'bilateral', 'ai', 'combine', 'method', 'symbolic', 'subsymbolic', 'ai', 'europe', 'chance', 'contrast', 'region', 'strong', 'research', 'group', 'symbolic', 'subsymbolic', 'therefore', 'unprecedented', 'opportunity', 'make', 'fundamental', 'contribution', 'next', 'level', 'broad', 'ai', 'symbolic', 'ai', 'dark', 'matter', 'dark', 'matter', 'thing', 'make', 'majority', 'universe', 'struggle', 'measure', 'barely', 'understand', 'symbolic', 'feel', 'bit', 'constant', 'allusion', 'use', 'symbolic', 'ai', 'deploy', 'application', 'vanishingly', 'public', 'example', 'deployment', 'always', 'struggle', 'find', 'interesting', 'example', 'real', 'world', 'deploy', 'symbolic', 'ai', 'yet', 'expert', 'hochreiter', 'claim', 'deployment', 'happen', 'interested', 'reader', 'email', 'paper', 'appreciate', 'read', 'broad', 'acm']"
