title,url,date,summary,text,cleaning,tokens
Banning ChatGPT will do more harm than good,https://www.technologyreview.com/2023/04/14/1071194/chatgpt-ai-high-school-education-first-person/,2023-04-14,"<p>A high school senior argues that ChatGPT can help reshape education for the better.</p>
","The narrative around cheating students doesn’t tell the whole story. Meet the teachers who think generative AI could actually make learning better. The release of ChatGPT has sent shock waves through the halls of higher education. Universities have rushed to release guidelines on how it can be used in the classroom. Professors have taken to social media to share a spectrum of AI policies. And students—whether or not they’ll admit it—have cautiously experimented with the idea of allowing it to play a part in their academic work.  But the notion of a measured response to the emergence of this powerful chatbot seems to have barely penetrated the world of K–12 education. Instead of transparent, well-defined expectations, high schoolers across the country have been confronted with a silent coup of blocked AI websites.1  That’s a shame. If educators actively engage with students about the technology’s capabilities and limitations—and work with them to define new academic standards—ChatGPT, and generative AI more broadly, could both democratize and revitalize K–12 education on an unprecedented scale.  A bold claim, I know. But after a few months of putting generative AI to the test (a nerdy case of senioritis, if you will), I’m optimistic. Exhibit A? College applications.  Few things are as mentally draining as applying to college these days, and as I slaved away at my supplemental essays, the promise of using ChatGPT as a real-time editor was attractive—partly as a potential productivity boost, but mostly as a distraction.  I had ChatGPT carefully review my cloying use of semicolons, grade my writing on a 0–10 scale (the results were erratic and maddening)2, and even role-play as an admissions counselor. Its advice was fundamentally incompatible with the creative demands of the modern college essay, and I mostly ignored it. But the very act of discussing my writing “out loud,” albeit with a machine, helped me figure out what I wanted to say next. Using ChatGPT to verbalize the space of possibilities—from the scale of words to paragraphs—strengthened my own thinking. And I’ve experienced something similar across every domain I’ve applied it to, from generating fifth-grader-level explanations of the French pluperfect to deciphering the Latin names of human muscles. All this adds up to a simple but profound fact: anyone with an internet connection now has a personal tutor, without the costs associated with private tutoring. Sure, an easily hoodwinked, slightly delusional tutor, but a tutor nonetheless. The impact of this is hard to overstate, and it is as relevant in large public school classrooms where students struggle to receive individual attention as it is in underserved and impoverished communities without sufficient educational infrastructure. As the psychologist Benjamin Bloom demonstrated in the early 1980s, one-on-one instruction until mastery allowed almost all students to outperform the class average by two standard deviations (“about 90% … attained the level … reached by only the highest 20%”).   ChatGPT certainly can’t replicate human interaction, but even its staunchest critics have to admit it’s a step in the right direction on this front. Maybe only 1% of students will use it in this way, and maybe it’s only half as effective as a human tutor, but even with these lowball numbers, its potential for democratizing educational access is enormous. I would even go so far as to say that if ChatGPT had existed during the pandemic, many fewer students would have fallen behind.  Of course, those decrying ChatGPT as the end of critical thinking would likely protest that the bot will only exacerbate the lazy academic habits students might have formed over the course of the pandemic. I have enough experience with the tips and tricks we high schoolers employ on a regular basis to know that this is a valid concern—one that shouldn’t be brushed off by casting ChatGPT as just the latest in a long line of technological revolutions in the classroom, from the calculator to the internet. That said, ChatGPT has just as much potential in the classroom as it does for improving individual educational outcomes. English teachers could use it to rephrase the notoriously confusing answer keys to AP test questions, to help students prepare more effectively. They could provide each student with an essay antithetical to the one they turned in, and have them pick apart these contrary arguments in a future draft. No human teacher could spend the time or energy needed to explain pages upon pages of lengthy reading comprehension questions or compose hundreds of five-page essays, but a chatbot can.  Educators can even lean into ChatGPT’s tendency to falsify, misattribute, and straight-out lie as a way of teaching students about disinformation. Imagine using ChatGPT to pen essays that conceal subtle logical fallacies or propose scientific explanations that are almost, but not quite, correct. Learning to discriminate between these convincing mistakes and the correct answer is the very pinnacle of critical thinking, and this new breed of academic assignment will prepare students for a world fraught with everything from politically correct censorship to deepfakes.  There are certainly less optimistic visions for the future. But the only way we avoid them—the only way this technology gets normalized and regulated alongside its similarly disruptive forebears—is with more discussion, more guidance, and more understanding. And it’s not as if there’s no time to catch up. ChatGPT won’t be acing AP English classes anytime soon, and with the recent release of GPT-4, we are already seeing an explosion of ed-tech companies that reduce the effort and expertise needed for teachers and students to operate the bot.  So here’s my pitch to those in power. Regardless of the specific policy you choose to employ at your school, unblock and unban. The path forward starts by trusting students to experiment with the tool, and guiding them through how, when, and where it can be used. You don’t need to restructure your whole curriculum around it, but blocking it will only send it underground. That will lead to confusion and misinterpretation in the best of cases, and misuse and abuse in the worst.  ChatGPT is the only beginning. There are simply too many generative AI tools to try to block them all, and doing so sends the wrong message. What we need is a direct discourse between students, teachers, and administrators. I’m lucky enough to be at a school that has taken the first steps in this direction, and it’s my hope that many more will follow suit. Rohan Mehta is a high school senior at Moravian Academy in Bethlehem, Pennsylvania.   ","The narrative around cheating students doesn ’ t tell the whole story . Meet the teachers who think generative AI could actually make learning better . The release of ChatGPT has sent shock waves through the halls of higher education . Universities have rushed to release guidelines on how it can be used in the classroom . Professors have taken to social media to share a spectrum of AI policies . And students—whether or not they ’ ll admit it—have cautiously experimented with the idea of allowing it to play a part in their academic work . But the notion of a measured response to the emergence of this powerful chatbot seems to have barely penetrated the world of K–12 education . Instead of transparent , well-defined expectations , high schoolers across the country have been confronted with a silent coup of blocked AI websites.1 That ’ s a shame . If educators actively engage with students about the technology ’ s capabilities and limitations—and work with them to define new academic standards—ChatGPT , and generative AI more broadly , could both democratize and revitalize K–12 education on an unprecedented scale . A bold claim , I know . But after a few months of putting generative AI to the test ( a nerdy case of senioritis , if you will ) , I ’ m optimistic . Exhibit A ? College applications . Few things are as mentally draining as applying to college these days , and as I slaved away at my supplemental essays , the promise of using ChatGPT as a real-time editor was attractive—partly as a potential productivity boost , but mostly as a distraction . I had ChatGPT carefully review my cloying use of semicolons , grade my writing on a 0–10 scale ( the results were erratic and maddening ) 2 , and even role-play as an admissions counselor . Its advice was fundamentally incompatible with the creative demands of the modern college essay , and I mostly ignored it . But the very act of discussing my writing “ out loud , ” albeit with a machine , helped me figure out what I wanted to say next . Using ChatGPT to verbalize the space of possibilities—from the scale of words to paragraphs—strengthened my own thinking . And I ’ ve experienced something similar across every domain I ’ ve applied it to , from generating fifth-grader-level explanations of the French pluperfect to deciphering the Latin names of human muscles . All this adds up to a simple but profound fact : anyone with an internet connection now has a personal tutor , without the costs associated with private tutoring . Sure , an easily hoodwinked , slightly delusional tutor , but a tutor nonetheless . The impact of this is hard to overstate , and it is as relevant in large public school classrooms where students struggle to receive individual attention as it is in underserved and impoverished communities without sufficient educational infrastructure . As the psychologist Benjamin Bloom demonstrated in the early 1980s , one-on-one instruction until mastery allowed almost all students to outperform the class average by two standard deviations ( “ about 90 % … attained the level … reached by only the highest 20 % ” ) . ChatGPT certainly can ’ t replicate human interaction , but even its staunchest critics have to admit it ’ s a step in the right direction on this front . Maybe only 1 % of students will use it in this way , and maybe it ’ s only half as effective as a human tutor , but even with these lowball numbers , its potential for democratizing educational access is enormous . I would even go so far as to say that if ChatGPT had existed during the pandemic , many fewer students would have fallen behind . Of course , those decrying ChatGPT as the end of critical thinking would likely protest that the bot will only exacerbate the lazy academic habits students might have formed over the course of the pandemic . I have enough experience with the tips and tricks we high schoolers employ on a regular basis to know that this is a valid concern—one that shouldn ’ t be brushed off by casting ChatGPT as just the latest in a long line of technological revolutions in the classroom , from the calculator to the internet . That said , ChatGPT has just as much potential in the classroom as it does for improving individual educational outcomes . English teachers could use it to rephrase the notoriously confusing answer keys to AP test questions , to help students prepare more effectively . They could provide each student with an essay antithetical to the one they turned in , and have them pick apart these contrary arguments in a future draft . No human teacher could spend the time or energy needed to explain pages upon pages of lengthy reading comprehension questions or compose hundreds of five-page essays , but a chatbot can . Educators can even lean into ChatGPT ’ s tendency to falsify , misattribute , and straight-out lie as a way of teaching students about disinformation . Imagine using ChatGPT to pen essays that conceal subtle logical fallacies or propose scientific explanations that are almost , but not quite , correct . Learning to discriminate between these convincing mistakes and the correct answer is the very pinnacle of critical thinking , and this new breed of academic assignment will prepare students for a world fraught with everything from politically correct censorship to deepfakes . There are certainly less optimistic visions for the future . But the only way we avoid them—the only way this technology gets normalized and regulated alongside its similarly disruptive forebears—is with more discussion , more guidance , and more understanding . And it ’ s not as if there ’ s no time to catch up . ChatGPT won ’ t be acing AP English classes anytime soon , and with the recent release of GPT-4 , we are already seeing an explosion of ed-tech companies that reduce the effort and expertise needed for teachers and students to operate the bot . So here ’ s my pitch to those in power . Regardless of the specific policy you choose to employ at your school , unblock and unban . The path forward starts by trusting students to experiment with the tool , and guiding them through how , when , and where it can be used . You don ’ t need to restructure your whole curriculum around it , but blocking it will only send it underground . That will lead to confusion and misinterpretation in the best of cases , and misuse and abuse in the worst . ChatGPT is the only beginning . There are simply too many generative AI tools to try to block them all , and doing so sends the wrong message . What we need is a direct discourse between students , teachers , and administrators . I ’ m lucky enough to be at a school that has taken the first steps in this direction , and it ’ s my hope that many more will follow suit . Rohan Mehta is a high school senior at Moravian Academy in Bethlehem , Pennsylvania .","['narrative', 'cheat', 'student', 'tell', 'whole', 'story', 'meet', 'teacher', 'think', 'generative', 'ai', 'actually', 'make', 'learn', 'well', 'release', 'chatgpt', 'send', 'shock', 'wave', 'hall', 'high', 'education', 'university', 'rush', 'release', 'guideline', 'use', 'classroom', 'professor', 'take', 'social', 'medium', 'share', 'spectrum', 'policy', 'student', 'admit', 'cautiously', 'experiment', 'idea', 'allow', 'play', 'part', 'academic', 'work', 'notion', 'measure', 'response', 'emergence', 'powerful', 'chatbot', 'seem', 'barely', 'penetrate', 'world', 'instead', 'transparent', 'welldefine', 'expectation', 'high', 'schooler', 'country', 'confront', 'silent', 'coup', 'block', 'shame', 'educator', 'actively', 'engage', 'student', 'technology', 'capability', 'limitation', 'work', 'define', 'new', 'academic', 'standard', 'chatgpt', 'generative', 'ai', 'broadly', 'democratize', 'revitalize', 'education', 'unprecedented', 'scale', 'bold', 'claim', 'know', 'month', 'put', 'generative', 'ai', 'test', 'nerdy', 'case', 'senioritis', 'optimistic', 'exhibit', 'college', 'application', 'thing', 'mentally', 'drain', 'apply', 'college', 'day', 'slave', 'away', 'supplemental', 'essay', 'promise', 'use', 'chatgpt', 'realtime', 'editor', 'attractive', 'partly', 'potential', 'productivity', 'boost', 'mostly', 'distraction', 'chatgpt', 'carefully', 'review', 'cloy', 'use', 'semicolon', 'grade', 'writing', '0–10', 'scale', 'result', 'erratic', 'madden', 'even', 'roleplay', 'admission', 'counselor', 'advice', 'fundamentally', 'incompatible', 'creative', 'demand', 'modern', 'college', 'essay', 'mostly', 'ignore', 'act', 'discuss', 'writing', 'loud', 'machine', 'help', 'figure', 'want', 'say', 'next', 'use', 'chatgpt', 'verbalize', 'space', 'possibility', 'scale', 'word', 'paragraph', 'strengthen', 'thinking', 'experience', 'similar', 'domain', 'apply', 'generate', 'fifthgraderlevel', 'explanation', 'french', 'pluperfect', 'decipher', 'latin', 'name', 'human', 'muscle', 'add', 'simple', 'profound', 'fact', 'internet', 'connection', 'personal', 'tutor', 'cost', 'associate', 'private', 'tutoring', 'sure', 'easily', 'hoodwink', 'slightly', 'delusional', 'tutor', 'tutor', 'nonetheless', 'impact', 'hard', 'overstate', 'relevant', 'large', 'public', 'school', 'classroom', 'student', 'struggle', 'receive', 'individual', 'attention', 'underserved', 'impoverished', 'community', 'sufficient', 'educational', 'infrastructure', 'bloom', 'demonstrate', 'early', 'oneonone', 'instruction', 'mastery', 'allow', 'almost', 'student', 'outperform', 'class', 'average', 'standard', 'deviation', 'attain', 'level', 'reach', 'high', 'chatgpt', 'certainly', 'replicate', 'human', 'interaction', 'even', 'staunch', 'critic', 'admit', 'step', 'right', 'direction', 'front', 'maybe', 'student', 'use', 'way', 'maybe', 'half', 'effective', 'human', 'tutor', 'even', 'lowball', 'number', 'potential', 'democratize', 'educational', 'access', 'enormous', 'even', 'go', 'far', 'say', 'chatgpt', 'exist', 'pandemic', 'many', 'student', 'fall', 'course', 'decrying', 'chatgpt', 'end', 'critical', 'thinking', 'likely', 'protest', 'bot', 'exacerbate', 'lazy', 'academic', 'habit', 'student', 'form', 'course', 'pandemic', 'enough', 'experience', 'tip', 'trick', 'high', 'schooler', 'employ', 'regular', 'basis', 'know', 'valid', 'concern', 'one', 'brush', 'cast', 'chatgpt', 'late', 'long', 'line', 'technological', 'revolution', 'classroom', 'calculator', 'internet', 'say', 'chatgpt', 'much', 'potential', 'classroom', 'improve', 'individual', 'educational', 'outcome', 'english', 'teacher', 'use', 'rephrase', 'notoriously', 'confusing', 'answer', 'key', 'test', 'question', 'help', 'student', 'prepare', 'effectively', 'provide', 'student', 'essay', 'antithetical', 'one', 'turn', 'pick', 'apart', 'contrary', 'argument', 'future', 'draft', 'human', 'teacher', 'spend', 'time', 'energy', 'need', 'explain', 'page', 'page', 'lengthy', 'reading', 'comprehension', 'question', 'compose', 'hundred', 'fivepage', 'essay', 'chatbot', 'educator', 'even', 'lean', 'chatgpt', 'tendency', 'falsify', 'misattribute', 'straightout', 'lie', 'way', 'teach', 'student', 'disinformation', 'imagine', 'use', 'chatgpt', 'pen', 'essay', 'conceal', 'subtle', 'logical', 'fallacy', 'propose', 'scientific', 'explanation', 'almost', 'quite', 'correct', 'learn', 'discriminate', 'convincing', 'mistake', 'correct', 'answer', 'pinnacle', 'critical', 'thinking', 'new', 'breed', 'academic', 'assignment', 'prepare', 'student', 'world', 'fraught', 'politically', 'correct', 'censorship', 'deepfake', 'certainly', 'less', 'optimistic', 'vision', 'future', 'way', 'avoid', 'way', 'technology', 'normalize', 'regulate', 'similarly', 'disruptive', 'forebear', 'discussion', 'guidance', 'understanding', 'time', 'catch', 'chatgpt', 'win', 'ace', 'class', 'anytime', 'soon', 'recent', 'release', 'gpt4', 'already', 'see', 'explosion', 'edtech', 'company', 'reduce', 'effort', 'expertise', 'need', 'teacher', 'student', 'operate', 'bot', 'pitch', 'power', 'regardless', 'specific', 'policy', 'choose', 'employ', 'school', 'unblock', 'unban', 'path', 'forward', 'start', 'trust', 'student', 'experiment', 'tool', 'guide', 'use', 'need', 'restructure', 'whole', 'curriculum', 'block', 'send', 'underground', 'lead', 'confusion', 'misinterpretation', 'good', 'case', 'misuse', 'abuse', 'bad', 'chatgpt', 'beginning', 'simply', 'many', 'generative', 'ai', 'tool', 'try', 'block', 'send', 'wrong', 'message', 'need', 'direct', 'discourse', 'student', 'teacher', 'administrator', 'lucky', 'enough', 'school', 'take', 'first', 'step', 'direction', 'hope', 'many', 'follow', 'suit', 'high', 'school', 'senior']"
