title,url,date,summary,text,cleaning,tokens
"Introducing NVIDIA’s Audio Flamingo, the Next Frontier in Audio Language Models",https://syncedreview.com/2024/02/11/introducing-nvidias-audio-flamingo-the-next-frontier-in-audio-language-models/,2024-02-11,"
An NVIDIA research team introduces Audio Flamingo, a groundbreaking audio language model that incorporates in-context learning (ICL), retrieval augmented generation (RAG), and multi-turn dialogue capabilities, achieving SOTA performance across various audio understanding tasks.

 ","Understanding sound is undeniably crucial for an agent’s interaction with the world. Despite the impressive capabilities of large language models (LLMs) in comprehending and reasoning through textual data, their grasp of sound remains limited. In their recent paper titled “Audio Flamingo: A Novel Audio Language Model with Few-Shot Learning and Dialogue Abilities,” a team of researchers from NVIDIA introduces Audio Flamingo, a groundbreaking audio language model. This model incorporates in-context learning (ICL), retrieval augmented generation (RAG), and multi-turn dialogue capabilities, achieving state-of-the-art performance across various audio understanding tasks. The team summarizes their key contributions as follows: The Audio Flamingo architecture is composed of four components: i) an audio feature extractor with sliding window, ii) audio representation transformation layers, iii) a decoder-only language model, and iv) gated xattn-dense layers. Specifically, the team utilizes ClapCap (Elizalde et al., 2023b) as the backbone for the audio feature extractor, processing 7-second, 44.1kHz raw audio inputs into a 1024-dimensional vector representation. For longer audio segments, they employ sliding windows to capture temporal information effectively. The audio representation transformation layers consist of three self-attention layers with 8 heads and an inner dimension of 2048 each. For the language model, they employ OPT-IML-MAX-1.3B (Iyer et al., 2022), a model with 1.3 billion parameters and 24 LM blocks. They integrate gated xattn-dense layers from Flamingo to condition the model on audio inputs. The researchers evaluated Audio Flamingo across a diverse range of close and open-ended benchmarks. A single Audio Flamingo model outperforms previous state-of-the-art systems on most benchmarks, with the dialogue version significantly surpassing baseline performance on dialogue tasks. The team intends to open-source both the training and inference code for Audio Flamingo, with a demo website available at https://audioflamingo.github.io/. The paper Audio Flamingo: A Novel Audio Language Model with Few-Shot Learning and Dialogue Abilities is on arXiv. Author: Hecate He | Editor: Chain Zhang We know you don’t want to miss any news or research breakthroughs. Subscribe to our popular newsletter Synced Global AI Weekly to get weekly AI updates.","Understanding sound is undeniably crucial for an agent ’ s interaction with the world . Despite the impressive capabilities of large language models ( LLMs ) in comprehending and reasoning through textual data , their grasp of sound remains limited . In their recent paper titled “ Audio Flamingo : A Novel Audio Language Model with Few-Shot Learning and Dialogue Abilities , ” a team of researchers from NVIDIA introduces Audio Flamingo , a groundbreaking audio language model . This model incorporates in-context learning ( ICL ) , retrieval augmented generation ( RAG ) , and multi-turn dialogue capabilities , achieving state-of-the-art performance across various audio understanding tasks . The team summarizes their key contributions as follows : The Audio Flamingo architecture is composed of four components : i ) an audio feature extractor with sliding window , ii ) audio representation transformation layers , iii ) a decoder-only language model , and iv ) gated xattn-dense layers . Specifically , the team utilizes ClapCap ( Elizalde et al. , 2023b ) as the backbone for the audio feature extractor , processing 7-second , 44.1kHz raw audio inputs into a 1024-dimensional vector representation . For longer audio segments , they employ sliding windows to capture temporal information effectively . The audio representation transformation layers consist of three self-attention layers with 8 heads and an inner dimension of 2048 each . For the language model , they employ OPT-IML-MAX-1.3B ( Iyer et al. , 2022 ) , a model with 1.3 billion parameters and 24 LM blocks . They integrate gated xattn-dense layers from Flamingo to condition the model on audio inputs . The researchers evaluated Audio Flamingo across a diverse range of close and open-ended benchmarks . A single Audio Flamingo model outperforms previous state-of-the-art systems on most benchmarks , with the dialogue version significantly surpassing baseline performance on dialogue tasks . The team intends to open-source both the training and inference code for Audio Flamingo , with a demo website available at https : //audioflamingo.github.io/ . The paper Audio Flamingo : A Novel Audio Language Model with Few-Shot Learning and Dialogue Abilities is on arXiv . Author : Hecate He | Editor : Chain Zhang We know you don ’ t want to miss any news or research breakthroughs . Subscribe to our popular newsletter Synced Global AI Weekly to get weekly AI updates .","['understand', 'sound', 'undeniably', 'crucial', 'agent', 'interaction', 'world', 'impressive', 'capability', 'large', 'language', 'model', 'llm', 'comprehend', 'reason', 'textual', 'datum', 'grasp', 'sound', 'remain', 'limit', 'recent', 'paper', 'title', 'audio', 'flamingo', 'novel', 'audio', 'language', 'model', 'learning', 'dialogue', 'ability', 'team', 'researcher', 'groundbreake', 'audio', 'language', 'model', 'model', 'incorporate', 'incontext', 'learn', 'retrieval', 'augment', 'generation', 'rag', 'multiturn', 'dialogue', 'capability', 'achieve', 'stateoftheart', 'performance', 'various', 'audio', 'understanding', 'task', 'team', 'summarize', 'key', 'contribution', 'follow', 'audio', 'architecture', 'compose', 'component', 'audio', 'feature', 'extractor', 'slide', 'window', 'audio', 'representation', 'transformation', 'layer', 'decoderonly', 'language', 'model', 'gate', 'xattndense', 'layer', 'specifically', 'team', 'utilize', 'clapcap', 'elizalde', 'backbone', 'audio', 'feature', 'extractor', 'processing', 'raw', 'audio', 'input', '1024dimensional', 'vector', 'representation', 'long', 'audio', 'segment', 'employ', 'slide', 'window', 'capture', 'temporal', 'information', 'effectively', 'audio', 'representation', 'transformation', 'layer', 'consist', 'selfattention', 'layer', 'head', 'inner', 'dimension', 'language', 'model', 'employ', 'optimlmax13b', 'iyer', 'model', 'parameter', 'lm', 'block', 'integrate', 'gate', 'xattndense', 'layer', 'condition', 'model', 'audio', 'input', 'researcher', 'evaluate', 'audio', 'flamingo', 'diverse', 'range', 'close', 'openende', 'benchmark', 'single', 'audio', 'flamingo', 'model', 'outperform', 'previous', 'stateoftheart', 'system', 'benchmark', 'dialogue', 'version', 'significantly', 'surpass', 'baseline', 'performance', 'dialogue', 'task', 'team', 'intend', 'opensource', 'training', 'inference', 'code', 'audio', 'flamingo', 'demo', 'website', 'available', 'https', 'paper', 'audio', 'flamingo', 'novel', 'audio', 'language', 'model', 'learning', 'dialogue', 'ability', 'arxiv', 'author', 'hecate', 'editor', 'chain', 'know', 'want', 'miss', 'news', 'research', 'breakthrough', 'subscribe', 'popular', 'newsletter', 'sync', 'global', 'ai', 'weekly', 'get', 'weekly', 'update']"
Nomic Embed: The Inaugural Open-Source Long Text Embedding Model Outshining OpenAI’s Finest,https://syncedreview.com/2024/02/07/nomic-embed-the-inaugural-open-source-long-text-embedding-model-outshining-openais-finest/,2024-02-07,"
In a new paper Nomic Embed: Training a Reproducible Long Context Text Embedder, a Nomic AI research team introduces nomic-embed-text-v1, which marks the inception of the first fully reproducible, open-source, open-weights, open-data text embedding model, capable of handling an extensive context length of 8192 in English. 
","Text embedding, the process of converting text into numerical representations, stands as a crucial component in natural language processing (NLP) tasks. It facilitates the comprehension of meaning and context (semantic relationships) within data, as well as the discovery of intricate patterns and relationships. However, the accessibility of high-performing embedding models with a context length surpassing 2048 has been limited since they are closed-source. Moreover, many of the leading open-source long context embedding models suffer from substantial inference requirements, rendering them impractical for various engineering applications. In a new paper Nomic Embed: Training a Reproducible Long Context Text Embedder, a Nomic AI research team introduces nomic-embed-text-v1, which marks the inception of the first fully reproducible, open-source, open-weights, open-data text embedding model, capable of handling an extensive context length of 8192 in English. Impressively, nomic-embed-text-v1 surpasses both OpenAI Ada-002 and OpenAI text-embedding-3-small in both short and long-context tasks. This technical report meticulously outlines the training methodology behind nomic-embed-text-v1. To craft a model capable of accommodating lengthy sequences, the researchers began by adapting BERT, focusing on achieving an 8192 sequence length. The adaptation involved a series of architectural modifications and optimizations to the BERT base: For Masked Language Modeling pretraining, the team utilized BooksCorpus and a Wikipedia dump from 2023 to train a BERT model tailored for long contexts, dubbed nomic-bert-2048. During the Unsupervised Contrastive Pretraining phase, the team leveraged extensive collections of publicly available data to form pairs, amassing a total of 470 million pairs from 29 datasets. They opted for the gte-base model instead of the all-MiniLM-L6-v2 model, sampling pairs from individual data sources to discourage the model from learning source-specific shortcuts. Supervised Contrastive Fine-tuning was conducted across various datasets, including MSMarco, NQ, NLI, FEVER, and HotpotQA. Training encompassed the released training sets from the BEIR benchmark, with additional negative mining for retrieval datasets, if not already conducted using gte-base. In their empirical evaluation, nomic-bert-2048 was assessed on the GLUE benchmark, while nomic-embed-text-v1 underwent evaluation on MTEB, Jina’s Long Context Benchmark, and LoCo. Notably, nomic-embed-text-v1 surpassed text-embedding-ada-002 and jina-embeddings-v2-base-en across various benchmarks. In long context assessments, particularly LoCo and Jina’s Long Context Benchmark, nomic-embed-text-v1 consistently outperformed jina-embeddings-v2-base-en. Additionally, it outperformed text-embedding-ada002 on LoCo and on two out of four datasets in Jina’s Long Context Benchmark. The paper Nomic Embed: Training a Reproducible Long Context Text EmbedderarXiv. Author: Hecate He | Editor: Chain Zhang We know you don’t want to miss any news or research breakthroughs. Subscribe to our popular newsletter Synced Global AI Weekly to get weekly AI updates.","Text embedding , the process of converting text into numerical representations , stands as a crucial component in natural language processing ( NLP ) tasks . It facilitates the comprehension of meaning and context ( semantic relationships ) within data , as well as the discovery of intricate patterns and relationships . However , the accessibility of high-performing embedding models with a context length surpassing 2048 has been limited since they are closed-source . Moreover , many of the leading open-source long context embedding models suffer from substantial inference requirements , rendering them impractical for various engineering applications . In a new paper Nomic Embed : Training a Reproducible Long Context Text Embedder , a Nomic AI research team introduces nomic-embed-text-v1 , which marks the inception of the first fully reproducible , open-source , open-weights , open-data text embedding model , capable of handling an extensive context length of 8192 in English . Impressively , nomic-embed-text-v1 surpasses both OpenAI Ada-002 and OpenAI text-embedding-3-small in both short and long-context tasks . This technical report meticulously outlines the training methodology behind nomic-embed-text-v1 . To craft a model capable of accommodating lengthy sequences , the researchers began by adapting BERT , focusing on achieving an 8192 sequence length . The adaptation involved a series of architectural modifications and optimizations to the BERT base : For Masked Language Modeling pretraining , the team utilized BooksCorpus and a Wikipedia dump from 2023 to train a BERT model tailored for long contexts , dubbed nomic-bert-2048 . During the Unsupervised Contrastive Pretraining phase , the team leveraged extensive collections of publicly available data to form pairs , amassing a total of 470 million pairs from 29 datasets . They opted for the gte-base model instead of the all-MiniLM-L6-v2 model , sampling pairs from individual data sources to discourage the model from learning source-specific shortcuts . Supervised Contrastive Fine-tuning was conducted across various datasets , including MSMarco , NQ , NLI , FEVER , and HotpotQA . Training encompassed the released training sets from the BEIR benchmark , with additional negative mining for retrieval datasets , if not already conducted using gte-base . In their empirical evaluation , nomic-bert-2048 was assessed on the GLUE benchmark , while nomic-embed-text-v1 underwent evaluation on MTEB , Jina ’ s Long Context Benchmark , and LoCo . Notably , nomic-embed-text-v1 surpassed text-embedding-ada-002 and jina-embeddings-v2-base-en across various benchmarks . In long context assessments , particularly LoCo and Jina ’ s Long Context Benchmark , nomic-embed-text-v1 consistently outperformed jina-embeddings-v2-base-en . Additionally , it outperformed text-embedding-ada002 on LoCo and on two out of four datasets in Jina ’ s Long Context Benchmark . The paper Nomic Embed : Training a Reproducible Long Context Text EmbedderarXiv . Author : Hecate He | Editor : Chain Zhang We know you don ’ t want to miss any news or research breakthroughs . Subscribe to our popular newsletter Synced Global AI Weekly to get weekly AI updates .","['text', 'embed', 'process', 'convert', 'text', 'numerical', 'representation', 'stand', 'crucial', 'component', 'natural', 'language', 'processing', 'nlp', 'task', 'facilitate', 'comprehension', 'meaning', 'context', 'semantic', 'relationship', 'datum', 'well', 'discovery', 'intricate', 'pattern', 'relationship', 'however', 'accessibility', 'highperforme', 'embed', 'model', 'context', 'length', 'surpass', 'limit', 'closedsource', 'moreover', 'many', 'lead', 'opensource', 'long', 'context', 'embed', 'model', 'suffer', 'substantial', 'inference', 'requirement', 'render', 'impractical', 'various', 'engineering', 'application', 'new', 'paper', 'nomic', 'embed', 'train', 'reproducible', 'long', 'context', 'text', 'embedder', 'nomic', 'ai', 'research', 'team', 'introduce', 'mark', 'inception', 'first', 'fully', 'reproducible', 'opensource', 'openweight', 'opendata', 'text', 'embed', 'model', 'capable', 'handle', 'extensive', 'context', 'length', 'impressively', 'nomicembedtextv1', 'surpasse', 'openai', 'short', 'longcontext', 'task', 'technical', 'report', 'meticulously', 'outline', 'training', 'methodology', 'craft', 'model', 'capable', 'accommodate', 'lengthy', 'sequence', 'researcher', 'begin', 'adapt', 'bert', 'focus', 'achieve', 'sequence', 'length', 'adaptation', 'involve', 'series', 'architectural', 'modification', 'optimization', 'base', 'mask', 'language', 'modeling', 'pretraine', 'team', 'utilize', 'bookscorpus', 'wikipedia', 'dump', 'train', 'bert', 'model', 'tailor', 'long', 'dub', 'unsupervised', 'contrastive', 'pretraining', 'phase', 'team', 'leverage', 'extensive', 'collection', 'publicly', 'available', 'datum', 'form', 'pair', 'amass', 'total', 'pair', 'dataset', 'opt', 'gtebase', 'model', 'instead', 'allminilml6v2', 'model', 'sample', 'pair', 'individual', 'datum', 'source', 'discourage', 'model', 'learn', 'shortcut', 'supervise', 'contrastive', 'finetuning', 'conduct', 'various', 'dataset', 'include', 'msmarco', 'nli', 'fever', 'hotpotqa', 'training', 'encompass', 'release', 'training', 'set', 'beir', 'benchmark', 'additional', 'negative', 'mining', 'retrieval', 'dataset', 'already', 'conduct', 'use', 'gtebase', 'empirical', 'evaluation', 'assess', 'glue', 'benchmark', 'nomicembedtextv1', 'underwent', 'evaluation', 'long', 'context', 'benchmark', 'loco', 'notably', 'surpass', 'textembeddingada002', 'various', 'benchmark', 'long', 'context', 'assessment', 'particularly', 'loco', 'long', 'context', 'benchmark', 'consistently', 'outperform', 'additionally', 'outperform', 'loco', 'dataset', 'long', 'context', 'benchmark', 'paper', 'nomic', 'embed', 'train', 'reproducible', 'long', 'context', 'text', 'embedderarxiv', 'author', 'hecate', 'editor', 'chain', 'know', 'want', 'miss', 'news', 'research', 'breakthrough', 'subscribe', 'popular', 'newsletter', 'sync', 'global', 'ai', 'weekly', 'get', 'weekly', 'update']"
