title,url,date,summary,text,cleaning,tokens
Meet Magneto: Microsoft’s Foundation Transformer for General-Purpose Modelling Across Tasks and Modalities,https://syncedreview.com/2022/10/18/meet-magneto-microsofts-foundation-transformer-for-general-purpose-modelling-across-tasks-and-modalities/,2022-10-18,"
In the new paper Foundation Transformers, a Microsoft team proposes a method for true general-purpose modelling. Their Foundation Transformer is a single unified transformer that provides guaranteed training stability and can handle diverse tasks and modalities without performance degradation.
","The machine learning community has seen a trend in recent years, with researchers working to converge their model architectures across language, vision, speech, and multimodal classes. While transformer architectures have become the de facto standard for building such highly desirable general-purpose foundation models, the optimal transformer variants still differ for different input modalities. In the new paper Foundation Transformers, a Microsoft team proposes a method for true general-purpose modelling. Their Foundation Transformer is a single unified transformer that provides guaranteed training stability and is capable of handling diverse tasks and modalities without performance degradation. The team first identifies the properties a foundation model should possess for true general-purpose modelling: 1) The desired modelling should be able to serve as a go-to architecture for various tasks and modalities, so that we can use the same backbone without trial and error, and 2) The architecture should provide guaranteed training stability. The proposed Magneto is a Foundation Transformer implementation designed to achieve the abovementioned goals. Magento uses Sub-LayerNorm (Sub-LN), which adds another LayerNorm inside each sublayer. The team also introduces a novel initialization method theoretically proven to guarantee training stability, enabling the model to be scaled relatively easily. In their empirical studies, the team compared Magneto with popular transformer variants such as BERT, GPT, and BEiT-3 on a wide range of tasks and modalities, including natural language processing, speech recognition, vision tasks, etc. Magneto significantly surpassed its baseline counterparts in the experiments. Moreover, it was shown to be more stable in terms of optimization, indicating its potential for effectively scaling up all manner of transformer models.The paper Foundation Transformers is on arXiv. Author: Hecate He | Editor: Michael Sarazen We know you don’t want to miss any news or research breakthroughs. Subscribe to our popular newsletter Synced Global AI Weekly to get weekly AI updates.","The machine learning community has seen a trend in recent years, with researchers working to converge their model architectures across language, vision, speech, and multimodal classes. While transformer architectures have become the de facto standard for building such highly desirable general-purpose foundation models, the optimal transformer variants still differ for different input modalities. In the new paper Foundation Transformers, a Microsoft team proposes a method for true general-purpose modelling. Their Foundation Transformer is a single unified transformer that provides guaranteed training stability and is capable of handling diverse tasks and modalities without performance degradation. The team first identifies the properties a foundation model should possess for true general-purpose modelling: 1) The desired modelling should be able to serve as a go-to architecture for various tasks and modalities, so that we can use the same backbone without trial and error, and 2) The architecture should provide guaranteed training stability. The proposed Magneto is a Foundation Transformer implementation designed to achieve the abovementioned goals. Magento uses Sub-LayerNorm (Sub-LN), which adds another LayerNorm inside each sublayer. The team also introduces a novel initialization method theoretically proven to guarantee training stability, enabling the model to be scaled relatively easily. In their empirical studies, the team compared Magneto with popular transformer variants such as BERT, GPT, and BEiT-3 on a wide range of tasks and modalities, including natural language processing, speech recognition, vision tasks, etc. Magneto significantly surpassed its baseline counterparts in the experiments. Moreover, it was shown to be more stable in terms of optimization, indicating its potential for effectively scaling up all manner of transformer models.The paper Foundation Transformers is on arXiv. Author: Hecate He | Editor: Michael Sarazen We know you don’t want to miss any news or research breakthroughs. Subscribe to our popular newsletter Synced Global AI Weekly to get weekly AI updates.","['machine', 'learning', 'community', 'see', 'trend', 'recent', 'year', 'researcher', 'work', 'converge', 'model', 'architecture', 'language', 'vision', 'speech', 'multimodal', 'class', 'transformer', 'architecture', 'become', 'standard', 'build', 'highly', 'desirable', 'generalpurpose', 'foundation', 'model', 'optimal', 'transformer', 'variant', 'still', 'differ', 'different', 'input', 'modality', 'new', 'paper', 'foundation', 'transformer', 'team', 'propose', 'method', 'true', 'generalpurpose', 'model', 'foundation', 'transformer', 'single', 'unified', 'transformer', 'provide', 'guarantee', 'training', 'stability', 'capable', 'handle', 'diverse', 'task', 'modality', 'performance', 'degradation', 'team', 'first', 'identify', 'property', 'foundation', 'model', 'possess', 'true', 'generalpurpose', 'modelling', 'desire', 'modelling', 'able', 'serve', 'goto', 'architecture', 'various', 'task', 'modality', 'use', 'backbone', 'trial', 'error', 'architecture', 'provide', 'guarantee', 'training', 'stability', 'propose', 'magneto', 'foundation', 'transformer', 'implementation', 'design', 'achieve', 'abovementione', 'goal', 'magento', 'use', 'sublayernorm', 'subln', 'add', 'layernorm', 'sublayer', 'team', 'also', 'introduce', 'novel', 'initialization', 'method', 'theoretically', 'prove', 'guarantee', 'training', 'stability', 'enable', 'model', 'scale', 'relatively', 'easily', 'empirical', 'study', 'team', 'compare', 'magneto', 'popular', 'transformer', 'variant', 'beit3', 'wide', 'range', 'task', 'modality', 'include', 'natural', 'language', 'processing', 'speech', 'recognition', 'vision', 'task', 'magneto', 'significantly', 'surpass', 'baseline', 'counterpart', 'experiment', 'moreover', 'show', 'stable', 'term', 'optimization', 'indicate', 'potential', 'effectively', 'scale', 'manner', 'transformer', 'paper', 'foundation', 'transformer', 'author', 'hecate', 'editor', 'know', 'want', 'miss', 'news', 'research', 'breakthrough', 'subscribe', 'popular', 'newsletter', 'sync', 'global', 'ai', 'weekly', 'get', 'weekly', 'ai', 'update']"
Stanford U & Google Brain’s Classifier-Free Guidance Model Diffusion Technique Reduces Sampling Steps by 256x,https://syncedreview.com/2022/10/17/stanford-u-google-brains-classifier-free-guidance-model-diffusion-technique-reduces-sampling-steps-by-256x/,2022-10-17,"
In the new paper On Distillation of Guided Diffusion Models, researchers from Google Brain and Stanford University propose a novel approach for distilling classifier-free guided diffusion models with high sampling efficiency. The resulting models achieve performance comparable to the original model but with sampling steps reduced by up to 256 times. 
","Denoising diffusion probabilistic models (DDPMs) with classifier-free guidance such as DALL·E 2, GLIDE, and Imagen have achieved state-of-the-art results in high-resolution image generation. The downside to such models is that their inference process requires evaluating both a class-conditional model and an unconditional model hundreds of times, rendering them prohibitively compute-expensive for many real-world applications. In the new paper On Distillation of Guided Diffusion Models, researchers from Google Brain and Stanford University propose a novel approach for distilling classifier-free guided diffusion models with high sampling efficiency. The resulting models achieve performance comparable to the original model but with sampling steps reduced by up to 256 times. The researchers’ distillation approach comprises two steps: Given a trained guided teacher model, a single student model first matches the combined output of the teacher’s two diffusion models, and this learned student model is then progressively distilled to a fewer-step model. The resulting single distilled model can handle a wide range of different guidance strengths and enable efficient tradeoffs between sample quality and diversity. The proposed sampling method employs a deterministic sampler and a novel stochastic sampling process. One deterministic sampling step is first applied with two times the original step length, and one stochastic step is then performed backward (i.e., perturb with noise) using the original step length. This approach was inspired by Karras et al.’s paperElucidating the Design Space of Diffusion-Based Generative Models, published earlier this year. In their empirical study, the team applied their method to classifier-free guidance DDPMs and performed image generation experiments on the ImageNet 64×64 and CIFAR-10 datasets. The results show that the proposed approach can achieve “visually decent” samples using as few as one step and obtain FID/IS (Frechet Inception Distance/Inception) scores comparable to that of the original baseline models while being up to 256 times faster to sample from. Overall, this work demonstrates the effectiveness of the proposed approach in addressing the high computational costs that have limited the deployment of denoising diffusion probabilistic models.The paper On Distillation of Guided Diffusion Models is on arXiv. Author: Hecate He | Editor: Michael Sarazen We know you don’t want to miss any news or research breakthroughs. Subscribe to our popular newsletter Synced Global AI Weekly to get weekly AI updates.","Denoising diffusion probabilistic models (DDPMs) with classifier-free guidance such as DALL·E 2, GLIDE, and Imagen have achieved state-of-the-art results in high-resolution image generation. The downside to such models is that their inference process requires evaluating both a class-conditional model and an unconditional model hundreds of times, rendering them prohibitively compute-expensive for many real-world applications. In the new paper On Distillation of Guided Diffusion Models, researchers from Google Brain and Stanford University propose a novel approach for distilling classifier-free guided diffusion models with high sampling efficiency. The resulting models achieve performance comparable to the original model but with sampling steps reduced by up to 256 times. The researchers’ distillation approach comprises two steps: Given a trained guided teacher model, a single student model first matches the combined output of the teacher’s two diffusion models, and this learned student model is then progressively distilled to a fewer-step model. The resulting single distilled model can handle a wide range of different guidance strengths and enable efficient tradeoffs between sample quality and diversity. The proposed sampling method employs a deterministic sampler and a novel stochastic sampling process. One deterministic sampling step is first applied with two times the original step length, and one stochastic step is then performed backward (i.e., perturb with noise) using the original step length. This approach was inspired by Karras et al.’s paperElucidating the Design Space of Diffusion-Based Generative Models, published earlier this year. In their empirical study, the team applied their method to classifier-free guidance DDPMs and performed image generation experiments on the ImageNet 64×64 and CIFAR-10 datasets. The results show that the proposed approach can achieve “visually decent” samples using as few as one step and obtain FID/IS (Frechet Inception Distance/Inception) scores comparable to that of the original baseline models while being up to 256 times faster to sample from. Overall, this work demonstrates the effectiveness of the proposed approach in addressing the high computational costs that have limited the deployment of denoising diffusion probabilistic models.The paper On Distillation of Guided Diffusion Models is on arXiv. Author: Hecate He | Editor: Michael Sarazen We know you don’t want to miss any news or research breakthroughs. Subscribe to our popular newsletter Synced Global AI Weekly to get weekly AI updates.","['denoise', 'diffusion', 'probabilistic', 'model', 'ddpm', 'classifierfree', 'guidance', 'glide', 'imagen', 'achieve', 'stateoftheart', 'result', 'highresolution', 'image', 'generation', 'downside', 'model', 'inference', 'process', 'require', 'evaluate', 'classconditional', 'model', 'unconditional', 'model', 'hundred', 'time', 'render', 'prohibitively', 'computeexpensive', 'many', 'realworld', 'application', 'new', 'paper', 'distillation', 'guide', 'diffusion', 'model', 'researcher', 'propose', 'novel', 'approach', 'distil', 'classifierfree', 'guide', 'diffusion', 'model', 'high', 'sampling', 'efficiency', 'result', 'model', 'achieve', 'performance', 'comparable', 'original', 'model', 'sample', 'step', 'reduce', 'time', 'researcher', 'distillation', 'approach', 'comprise', 'step', 'give', 'train', 'guide', 'teacher', 'model', 'single', 'student', 'model', 'first', 'match', 'combine', 'output', 'teacher', 'diffusion', 'model', 'learn', 'student', 'model', 'progressively', 'distil', 'fewerstep', 'model', 'result', 'single', 'distil', 'model', 'handle', 'wide', 'range', 'different', 'guidance', 'strength', 'enable', 'efficient', 'tradeoff', 'sample', 'quality', 'diversity', 'propose', 'sampling', 'method', 'employ', 'deterministic', 'sampler', 'novel', 'stochastic', 'sampling', 'process', 'deterministic', 'sampling', 'step', 'first', 'apply', 'time', 'original', 'step', 'length', 'stochastic', 'step', 'perform', 'backward', 'perturb', 'noise', 'use', 'original', 'step', 'length', 'approach', 'inspire', 'karra', 'paperelucidate', 'design', 'space', 'diffusionbased', 'generative', 'model', 'publish', 'early', 'year', 'empirical', 'study', 'team', 'apply', 'method', 'classifierfree', 'guidance', 'ddpm', 'perform', 'image', 'generation', 'experiment', 'imagenet', 'cifar10', 'dataset', 'result', 'show', 'propose', 'approach', 'achieve', 'visually', 'decent', 'sample', 'use', 'step', 'obtain', 'frechet', 'inception', 'distanceinception', 'score', 'comparable', 'original', 'baseline', 'model', 'time', 'fast', 'sample', 'overall', 'work', 'demonstrate', 'effectiveness', 'propose', 'approach', 'address', 'high', 'computational', 'cost', 'limit', 'deployment', 'denoise', 'diffusion', 'probabilistic', 'modelsthe', 'paper', 'distillation', 'guide', 'diffusion', 'model', 'author', 'hecate', 'editor', 'know', 'want', 'miss', 'news', 'research', 'breakthrough', 'subscribe', 'popular', 'newsletter', 'sync', 'global', 'ai', 'weekly', 'get', 'weekly', 'ai', 'update']"
Beyond Bayes-Optimality: DeepMind & Stanford’s Meta-Learning Approach Builds Risk & Ambiguity Sensitive Agents,https://syncedreview.com/2022/10/13/beyond-bayes-optimality-deepmind-stanfords-meta-learning-approach-builds-risk-ambiguity-sensitive-agents/,2022-10-13,"
In the new paper Beyond Bayes-Optimality: Meta-Learning What You Know You Don’t Know, researchers from DeepMind and Stanford University use modified meta-training algorithms to build agents with risk- and ambiguity-sensitivity.
","Reasoning about uncertainty is one of the crucial components informing human intelligence and our very survival — it can encourage us to take risks that have a higher expected return but also discourage us from impulsively doing things that may lead to catastrophic consequences. Contemporary Bayes-optimal AI agents however are generally risk- and ambiguity-neutral, lacking this natural human capacity for advanced reasoning with regard to uncertainty. In the new paper Beyond Bayes-Optimality: Meta-Learning What You Know You Don’t Know, a research team from DeepMind and Stanford University employs modified meta-training algorithms to build agents with risk- and ambiguity-sensitivity, and empirically demonstrates the validity of such agents. The team first clarifies the distinction between Bayesian-optimal, risk-sensitive, and ambiguity-sensitive agents. Simple put, both risk and ambiguity belong to uncertainty: risk applies to scenarios where the output of an event is uncertain but can be roughly calculated using probability functions; while in ambiguity, the probability is unknown or cannot be reliably determined. Bayesian-optimal agents assign certainty-equivalents that are equal to the expected payoff, then choose the optimal action. Such agents are both risk-neutral (insensitive to the distribution over returns except for the target value) and ambiguity-neutral (acting as if the uncertainty were known). In their bid to create risk-sensitive agents, the team modifies the meta-training protocol by tweaking the distribution of observations to make these observations sensitive to the valuations of the agent. They leverage an ensemble of agents and a meta-policy to build a mechanism able to detect and use novelty. As such, the resulting agent can evolve to become uncertainty-seeking and risk-averting based on its experiences. In their empirical study, the team applied their proposed meta-training algorithms to agents in various decision-making experiments, with the results confirming that the agents can learn both risk- and ambiguity-sensitivity. Overall, this work demonstrates the possibility of building risk- and ambiguity-sensitive agents via the modification of meta-training algorithms. The team hopes their contributions can serve as the starting point in the development of data-dependent methods for the study and application of uncertainty-sensitivity in humans and machines. The paper Beyond Bayes-Optimality: Meta-Learning What You Know You Don’t Know is on arXiv. Author: Hecate He | Editor: Michael Sarazen We know you don’t want to miss any news or research breakthroughs. Subscribe to our popular newsletter Synced Global AI Weekly to get weekly AI updates.","Reasoning about uncertainty is one of the crucial components informing human intelligence and our very survival — it can encourage us to take risks that have a higher expected return but also discourage us from impulsively doing things that may lead to catastrophic consequences. Contemporary Bayes-optimal AI agents however are generally risk- and ambiguity-neutral, lacking this natural human capacity for advanced reasoning with regard to uncertainty. In the new paper Beyond Bayes-Optimality: Meta-Learning What You Know You Don’t Know, a research team from DeepMind and Stanford University employs modified meta-training algorithms to build agents with risk- and ambiguity-sensitivity, and empirically demonstrates the validity of such agents. The team first clarifies the distinction between Bayesian-optimal, risk-sensitive, and ambiguity-sensitive agents. Simple put, both risk and ambiguity belong to uncertainty: risk applies to scenarios where the output of an event is uncertain but can be roughly calculated using probability functions; while in ambiguity, the probability is unknown or cannot be reliably determined. Bayesian-optimal agents assign certainty-equivalents that are equal to the expected payoff, then choose the optimal action. Such agents are both risk-neutral (insensitive to the distribution over returns except for the target value) and ambiguity-neutral (acting as if the uncertainty were known). In their bid to create risk-sensitive agents, the team modifies the meta-training protocol by tweaking the distribution of observations to make these observations sensitive to the valuations of the agent. They leverage an ensemble of agents and a meta-policy to build a mechanism able to detect and use novelty. As such, the resulting agent can evolve to become uncertainty-seeking and risk-averting based on its experiences. In their empirical study, the team applied their proposed meta-training algorithms to agents in various decision-making experiments, with the results confirming that the agents can learn both risk- and ambiguity-sensitivity. Overall, this work demonstrates the possibility of building risk- and ambiguity-sensitive agents via the modification of meta-training algorithms. The team hopes their contributions can serve as the starting point in the development of data-dependent methods for the study and application of uncertainty-sensitivity in humans and machines. The paper Beyond Bayes-Optimality: Meta-Learning What You Know You Don’t Know is on arXiv. Author: Hecate He | Editor: Michael Sarazen We know you don’t want to miss any news or research breakthroughs. Subscribe to our popular newsletter Synced Global AI Weekly to get weekly AI updates.","['reasoning', 'uncertainty', 'crucial', 'component', 'inform', 'human', 'intelligence', 'survival', 'encourage', 'take', 'risk', 'high', 'expect', 'return', 'also', 'discourage', 'impulsively', 'thing', 'lead', 'catastrophic', 'consequence', 'contemporary', 'bayesoptimal', 'agent', 'however', 'generally', 'risk', 'ambiguityneutral', 'lack', 'natural', 'human', 'capacity', 'advanced', 'reasoning', 'regard', 'uncertainty', 'new', 'paper', 'bayesoptimality', 'metalearne', 'know', 'know', 'research', 'team', 'employ', 'modify', 'metatraine', 'algorithm', 'build', 'agent', 'risk', 'ambiguitysensitivity', 'empirically', 'demonstrate', 'validity', 'agent', 'team', 'first', 'clarify', 'distinction', 'bayesianoptimal', 'risksensitive', 'ambiguitysensitive', 'agent', 'simple', 'put', 'risk', 'ambiguity', 'belong', 'uncertainty', 'risk', 'apply', 'scenario', 'output', 'event', 'uncertain', 'roughly', 'calculate', 'use', 'probability', 'function', 'ambiguity', 'probability', 'unknown', 'reliably', 'determine', 'bayesianoptimal', 'agent', 'assign', 'certaintyequivalent', 'equal', 'expect', 'payoff', 'choose', 'optimal', 'action', 'agent', 'riskneutral', 'insensitive', 'distribution', 'return', 'target', 'value', 'ambiguityneutral', 'acting', 'uncertainty', 'know', 'bid', 'create', 'risksensitive', 'agent', 'team', 'modify', 'metatraining', 'protocol', 'tweak', 'distribution', 'observation', 'make', 'observation', 'sensitive', 'valuation', 'agent', 'leverage', 'ensemble', 'agent', 'metapolicy', 'build', 'mechanism', 'able', 'detect', 'use', 'novelty', 'result', 'agent', 'evolve', 'become', 'uncertaintyseeke', 'riskaverting', 'base', 'experience', 'empirical', 'study', 'team', 'apply', 'propose', 'metatraining', 'algorithm', 'agent', 'various', 'decisionmake', 'experiment', 'result', 'confirm', 'agent', 'learn', 'risk', 'ambiguitysensitivity', 'overall', 'work', 'demonstrate', 'possibility', 'build', 'risk', 'ambiguitysensitive', 'agent', 'modification', 'metatraine', 'algorithm', 'team', 'hope', 'contribution', 'serve', 'starting', 'point', 'development', 'datadependent', 'method', 'study', 'application', 'uncertaintysensitivity', 'human', 'machine', 'paper', 'bayesoptimality', 'metalearne', 'know', 'know', 'author', 'hecate', 'editor', 'know', 'want', 'miss', 'news', 'research', 'breakthrough', 'subscribe', 'popular', 'newsletter', 'sync', 'global', 'ai', 'weekly', 'get', 'weekly', 'ai', 'update']"
