title,url,date,summary,text,cleaning,tokens
Tencent’s FaceStudio Redefines Image Generation with Identity-Preserving Efficiency in Seconds,https://syncedreview.com/2023/12/12/tencents-facestudio-redefines-image-generation-with-identity-preserving-efficiency-in-seconds/,2023-12-12,"
A recent paper from Tencent’s research team introduces a novel identity-preserving synthesis approach, with a specific focus on human images. The proposed model adopts a direct feed-forward mechanism, eliminating the need for intensive fine-tuning and streamlining the image generation process.

 ","In recent years, text-to-image diffusion models have emerged as a groundbreaking approach, seamlessly transforming textual descriptions into visually stunning, multi-styled images. This innovation has opened doors to a myriad of applications previously deemed unattainable. Despite these strides, several challenges persist. Notably, existing text-to-image diffusion models often struggle to accurately capture and describe a subject based solely on textual input. Additionally, the tuning process for most models proves resource-intensive and time-consuming, demanding substantial computational power and human intervention. Addressing these constraints, a recent paper from Tencent’s research team introduces a novel identity-preserving synthesis approach, with a specific focus on human images. The proposed model adopts a direct feed-forward mechanism, eliminating the need for intensive fine-tuning and streamlining the image generation process. The key contributions of the team’s work include: The FaceStudio model, a derivative of StableDiffusion with crucial modifications, particularly in the condition modules for hybrid-guidance image generation, stands out. By adopting a direct feed-forward approach, it accelerates image generation without the cumbersome fine-tuning steps. At the core of the framework lies the hybrid guidance module, steering the image generation process of the latent diffusion model. This module not only considers textual prompts but also integrates additional information from style and identity images. To handle images with multiple identities effectively, the team introduces a multi-identity cross-attention mechanism. This innovative mechanism enables the model to aptly associate guidance particulars from various identities with specific human regions within an image. Experiments demonstrate that FaceStudio excels in synthesizing human images with remarkable fidelity, eliminating the need for further adjustments. Notably, it introduces a unique capability to superimpose a user’s facial features onto stylistic images, allowing users to visualize themselves in diverse styles without compromising their identity. Moreover, it impressively generates images that seamlessly blend multiple identities when supplied with respective reference photos. The code is available on project’s GitHub. The paper FaceStudio: Put Your Face Everywhere in Seconds on arXiv. Author: Hecate He | Editor: Chain Zhang We know you don’t want to miss any news or research breakthroughs. Subscribe to our popular newsletter Synced Global AI Weekly to get weekly AI updates.","In recent years , text-to-image diffusion models have emerged as a groundbreaking approach , seamlessly transforming textual descriptions into visually stunning , multi-styled images . This innovation has opened doors to a myriad of applications previously deemed unattainable . Despite these strides , several challenges persist . Notably , existing text-to-image diffusion models often struggle to accurately capture and describe a subject based solely on textual input . Additionally , the tuning process for most models proves resource-intensive and time-consuming , demanding substantial computational power and human intervention . Addressing these constraints , a recent paper from Tencent ’ s research team introduces a novel identity-preserving synthesis approach , with a specific focus on human images . The proposed model adopts a direct feed-forward mechanism , eliminating the need for intensive fine-tuning and streamlining the image generation process . The key contributions of the team ’ s work include : The FaceStudio model , a derivative of StableDiffusion with crucial modifications , particularly in the condition modules for hybrid-guidance image generation , stands out . By adopting a direct feed-forward approach , it accelerates image generation without the cumbersome fine-tuning steps . At the core of the framework lies the hybrid guidance module , steering the image generation process of the latent diffusion model . This module not only considers textual prompts but also integrates additional information from style and identity images . To handle images with multiple identities effectively , the team introduces a multi-identity cross-attention mechanism . This innovative mechanism enables the model to aptly associate guidance particulars from various identities with specific human regions within an image . Experiments demonstrate that FaceStudio excels in synthesizing human images with remarkable fidelity , eliminating the need for further adjustments . Notably , it introduces a unique capability to superimpose a user ’ s facial features onto stylistic images , allowing users to visualize themselves in diverse styles without compromising their identity . Moreover , it impressively generates images that seamlessly blend multiple identities when supplied with respective reference photos . The code is available on project ’ s GitHub . The paper FaceStudio : Put Your Face Everywhere in Seconds on arXiv . Author : Hecate He | Editor : Chain Zhang We know you don ’ t want to miss any news or research breakthroughs . Subscribe to our popular newsletter Synced Global AI Weekly to get weekly AI updates .","['recent', 'year', 'texttoimage', 'diffusion', 'model', 'emerge', 'groundbreaking', 'approach', 'seamlessly', 'transform', 'textual', 'description', 'visually', 'stunning', 'multistyled', 'image', 'innovation', 'open', 'door', 'myriad', 'application', 'previously', 'deem', 'unattainable', 'stride', 'several', 'challenge', 'persist', 'notably', 'exist', 'texttoimage', 'diffusion', 'model', 'often', 'struggle', 'accurately', 'capture', 'describe', 'subject', 'base', 'solely', 'textual', 'input', 'additionally', 'tuning', 'process', 'model', 'prove', 'resourceintensive', 'timeconsuming', 'demand', 'substantial', 'computational', 'power', 'human', 'intervention', 'address', 'constraint', 'recent', 'paper', 'tencent', 'research', 'team', 'introduce', 'novel', 'identitypreserve', 'synthesis', 'approach', 'specific', 'focus', 'human', 'image', 'propose', 'model', 'adopt', 'direct', 'feedforward', 'mechanism', 'eliminate', 'need', 'intensive', 'finetuning', 'streamline', 'image', 'generation', 'process', 'key', 'contribution', 'team', 'work', 'include', 'facestudio', 'model', 'derivative', 'stablediffusion', 'crucial', 'modification', 'particularly', 'condition', 'module', 'hybridguidance', 'image', 'generation', 'stand', 'adopt', 'direct', 'feedforward', 'approach', 'accelerate', 'image', 'generation', 'cumbersome', 'finetuning', 'step', 'core', 'framework', 'lie', 'hybrid', 'guidance', 'module', 'steer', 'image', 'generation', 'process', 'latent', 'diffusion', 'model', 'module', 'consider', 'textual', 'prompt', 'also', 'integrate', 'additional', 'information', 'style', 'identity', 'image', 'handle', 'image', 'multiple', 'identity', 'effectively', 'team', 'introduce', 'multiidentity', 'crossattention', 'mechanism', 'innovative', 'mechanism', 'enable', 'model', 'aptly', 'associate', 'guidance', 'particular', 'various', 'identity', 'specific', 'human', 'region', 'image', 'experiment', 'demonstrate', 'facestudio', 'excel', 'synthesize', 'human', 'image', 'remarkable', 'fidelity', 'eliminate', 'need', 'adjustment', 'notably', 'introduce', 'unique', 'capability', 'superimpose', 'user', 'facial', 'feature', 'stylistic', 'image', 'allow', 'user', 'visualize', 'diverse', 'style', 'compromise', 'identity', 'moreover', 'impressively', 'generate', 'image', 'seamlessly', 'blend', 'multiple', 'identity', 'supply', 'respective', 'reference', 'photo', 'code', 'available', 'project', 'paper', 'facestudio', 'put', 'face', 'everywhere', 'second', 'arxiv', 'author', 'hecate', 'editor', 'chain', 'know', 'want', 'miss', 'news', 'research', 'breakthrough', 'subscribe', 'popular', 'newsletter', 'sync', 'global', 'ai', 'weekly', 'get', 'weekly', 'update']"
Microsoft’s TaskWeaver: Empowering Intelligent Conversational Agents for Handling Domain-Specific Complex Tasks,https://syncedreview.com/2023/12/09/microsofts-taskweaver-empowering-intelligent-conversational-agents-for-handling-domain-specific-complex-tasks/,2023-12-09,"
A Microsoft research team introduces TaskWeaver, a cutting-edge, code-first framework designed to empower LLM-powered autonomous agents. TaskWeaver offers a potent and flexible platform for constructing intelligent conversational agents capable of handling complex tasks and seamlessly adapting to domain-specific scenarios.
","Recent advancements in Large Language Models (LLMs), exemplified by models like GPT, Claude, and Llama, have showcased remarkable prowess in natural language understanding and generation. These models have found extensive applications in chatbots and virtual assistants. However, their effectiveness has been hindered when confronted with domain-specific data analytics tasks featuring intricate data structures, and they often struggle to adapt to diverse user requirements. In response to these challenges, a Microsoft research team introduces TaskWeaver, a cutting-edge, code-first framework designed to empower LLM-powered autonomous agents. TaskWeaver offers a potent and flexible platform for constructing intelligent conversational agents capable of handling complex tasks and seamlessly adapting to domain-specific scenarios. TaskWeaver converts user requests into executable code, treating user-defined plugins as callable functions. This approach provides robust support for rich data structures, flexible plugin usage, dynamic plugin selection, and leverages the coding capabilities of LLMs to handle complex logic. The system ensures the secure execution of the generated code. More specifically, TaskWeaver comprises three essential components: the Planner, Code Generator (CG), and Code Executor (CE). The Planner, serving as the system’s entry point, interacts with the user, handling tasks such as breaking down user requests into subtasks and managing the execution process with self-reflection. The CG generates code for subtasks based on user requests, considering existing plugins and incorporating function calls for specific tasks. The CE executes the generated code, maintaining the execution state throughout the entire session. TaskWeaver provides the capability to expand into a multi-agent architecture through two approaches. The first involves one agent (powered by TaskWeaver) calling other agents via its plugins. The second approach integrates TaskWeaver-powered agents into existing multi-agent frameworks like AutoGen. Overall, TaskWeaver emerges as a robust solution for constructing intelligent conversational agents, addressing the limitations of existing LLMs in handling domain-specific data analytics tasks. As LLMs continue to evolve and improve, TaskWeaver stands poised to facilitate the development of more advanced and sophisticated applications, marking a significant step forward in the realm of conversational AI. The code is open-sourced at https://github.com/microsoft/TaskWeaver/. The paper TaskWeaver: A Code-First Agent Framework on arXiv. Author: Hecate He | Editor: Chain Zhang We know you don’t want to miss any news or research breakthroughs. Subscribe to our popular newsletter Synced Global AI Weekly to get weekly AI updates.","Recent advancements in Large Language Models ( LLMs ) , exemplified by models like GPT , Claude , and Llama , have showcased remarkable prowess in natural language understanding and generation . These models have found extensive applications in chatbots and virtual assistants . However , their effectiveness has been hindered when confronted with domain-specific data analytics tasks featuring intricate data structures , and they often struggle to adapt to diverse user requirements . In response to these challenges , a Microsoft research team introduces TaskWeaver , a cutting-edge , code-first framework designed to empower LLM-powered autonomous agents . TaskWeaver offers a potent and flexible platform for constructing intelligent conversational agents capable of handling complex tasks and seamlessly adapting to domain-specific scenarios . TaskWeaver converts user requests into executable code , treating user-defined plugins as callable functions . This approach provides robust support for rich data structures , flexible plugin usage , dynamic plugin selection , and leverages the coding capabilities of LLMs to handle complex logic . The system ensures the secure execution of the generated code . More specifically , TaskWeaver comprises three essential components : the Planner , Code Generator ( CG ) , and Code Executor ( CE ) . The Planner , serving as the system ’ s entry point , interacts with the user , handling tasks such as breaking down user requests into subtasks and managing the execution process with self-reflection . The CG generates code for subtasks based on user requests , considering existing plugins and incorporating function calls for specific tasks . The CE executes the generated code , maintaining the execution state throughout the entire session . TaskWeaver provides the capability to expand into a multi-agent architecture through two approaches . The first involves one agent ( powered by TaskWeaver ) calling other agents via its plugins . The second approach integrates TaskWeaver-powered agents into existing multi-agent frameworks like AutoGen . Overall , TaskWeaver emerges as a robust solution for constructing intelligent conversational agents , addressing the limitations of existing LLMs in handling domain-specific data analytics tasks . As LLMs continue to evolve and improve , TaskWeaver stands poised to facilitate the development of more advanced and sophisticated applications , marking a significant step forward in the realm of conversational AI . The code is open-sourced at https : //github.com/microsoft/TaskWeaver/ . The paper TaskWeaver : A Code-First Agent Framework on arXiv . Author : Hecate He | Editor : Chain Zhang We know you don ’ t want to miss any news or research breakthroughs . Subscribe to our popular newsletter Synced Global AI Weekly to get weekly AI updates .","['recent', 'advancement', 'large', 'language', 'model', 'llm', 'exemplify', 'model', 'gpt', 'claude', 'showcase', 'remarkable', 'prowess', 'natural', 'language', 'understanding', 'generation', 'model', 'find', 'extensive', 'application', 'chatbot', 'virtual', 'assistant', 'however', 'effectiveness', 'hinder', 'confront', 'domainspecific', 'data', 'analytic', 'task', 'feature', 'intricate', 'data', 'structure', 'often', 'struggle', 'adapt', 'diverse', 'user', 'requirement', 'response', 'challenge', 'research', 'team', 'introduce', 'cuttingedge', 'codefirst', 'framework', 'design', 'empower', 'llmpowere', 'autonomous', 'agent', 'taskweaver', 'offer', 'potent', 'flexible', 'platform', 'construct', 'intelligent', 'conversational', 'agent', 'capable', 'handle', 'complex', 'task', 'seamlessly', 'adapt', 'domainspecific', 'scenario', 'taskweaver', 'convert', 'user', 'request', 'executable', 'code', 'treat', 'userdefined', 'plugin', 'callable', 'function', 'approach', 'provide', 'robust', 'support', 'rich', 'data', 'structure', 'flexible', 'usage', 'dynamic', 'plugin', 'selection', 'leverage', 'code', 'capability', 'llm', 'handle', 'complex', 'logic', 'system', 'ensure', 'secure', 'execution', 'generate', 'code', 'specifically', 'taskweaver', 'comprise', 'essential', 'component', 'planner', 'code', 'generator', 'cg', 'executor', 'ce', 'planner', 'serve', 'system', 'entry', 'point', 'interact', 'user', 'handling', 'task', 'break', 'user', 'request', 'subtask', 'manage', 'execution', 'process', 'selfreflection', 'cg', 'generate', 'code', 'subtask', 'base', 'user', 'request', 'consider', 'exist', 'plugin', 'incorporate', 'function', 'call', 'specific', 'task', 'execute', 'generate', 'code', 'maintain', 'execution', 'state', 'entire', 'session', 'taskweaver', 'provide', 'capability', 'expand', 'multiagent', 'architecture', 'approach', 'first', 'involve', 'agent', 'power', 'call', 'agent', 'plugin', 'second', 'approach', 'integrate', 'taskweaverpowere', 'agent', 'exist', 'multiagent', 'framework', 'autogen', 'overall', 'taskweaver', 'emerge', 'robust', 'solution', 'construct', 'intelligent', 'conversational', 'agent', 'address', 'limitation', 'exist', 'llm', 'handle', 'domainspecific', 'data', 'analytic', 'task', 'llm', 'continue', 'evolve', 'improve', 'stand', 'poise', 'facilitate', 'development', 'advanced', 'sophisticated', 'application', 'mark', 'significant', 'step', 'forward', 'realm', 'conversational', 'ai', 'code', 'opensource', 'paper', 'taskweaver', 'codefirst', 'agent', 'framework', 'arxiv', 'author', 'hecate', 'editor', 'chain', 'know', 'want', 'miss', 'news', 'research', 'breakthrough', 'subscribe', 'popular', 'newsletter', 'sync', 'global', 'ai', 'weekly', 'get', 'weekly', 'update']"
Tencent & Sydney U’s GPT4Video: A Unified Multimodal Large Language Significantly Elevates LMs’ Video Generative Capabilities,https://syncedreview.com/2023/12/06/tencent-sydney-us-gpt4video-a-unified-multimodal-large-language-significantly-elevates-lms-video-generative-capabilities/,2023-12-06,"
A collaborative effort between Tencent AI Lab and The University of Sydney introduces GPT4Video, which stands as a unified multi-model framework that endows Large Language Models (LLMs) with the unique ability for both video understanding and generation. 
","In recent strides within the field of Multimodal Large Language Models (MLLMs), while notable progress has been made in input-side multimodal comprehension, a notable void persists in the domain of multimodal content generation. Addressing this gap, a collaborative effort between Tencent AI Lab and The University of Sydney introduces GPT4Video in a new paper GPT4Video: A Unified Multimodal Large Language Model for lnstruction-Followed Understanding and Safety-Aware Generation. GPT4Video stands as a unified multi-model framework that endows Large Language Models (LLMs) with the unique ability for both video understanding and generation. The primary contributions of the research team can be summarized as follows: GPT4Video arises as a response to the limitations of existing Multimodal Large Language Models (MLLMs), which, despite excelling at processing multimodal inputs, display shortcomings in generating multimodal outputs. The architecture of GPT4Video comprises three integral components: The team initiates the process by utilizing a frozen ViT-L/14 model to capture raw video features, followed by employing a video abstraction module to condense video information across temporal and spatial axes. GPT4Video’s core is driven by a frozen LLaMA model, efficiently fine-tuned via LoRA with custom video-centric and safety-aligned data. This equips it to comprehend videos and generate appropriate video prompts, subsequently used to produce videos from the Textto-Video Model Gallery. Experimental results across various multimodal benchmarks, encompassing open-ended question-answer, video captioning, and text-to-video generation, validate the effectiveness and universality of GPT4Video. Moreover, GPT4Video showcases its ability to harness the robust contextual summarization and textual expression capabilities of LLMs to generate detailed prompts for videos. In essence, GPT4Video significantly elevates Large Language Models by integrating advanced video understanding and generative functions. Its effectiveness is further emphasized by its superior performance across multimodal benchmarks. The code is available on project’s GitHub. The paper GPT4Video: A Unified Multimodal Large Language Model for lnstruction-Followed Understanding and Safety-Aware Generation on arXiv. Author: Hecate He | Editor: Chain Zhang We know you don’t want to miss any news or research breakthroughs. Subscribe to our popular newsletter Synced Global AI Weekly to get weekly AI updates.","In recent strides within the field of Multimodal Large Language Models ( MLLMs ) , while notable progress has been made in input-side multimodal comprehension , a notable void persists in the domain of multimodal content generation . Addressing this gap , a collaborative effort between Tencent AI Lab and The University of Sydney introduces GPT4Video in a new paper GPT4Video : A Unified Multimodal Large Language Model for lnstruction-Followed Understanding and Safety-Aware Generation . GPT4Video stands as a unified multi-model framework that endows Large Language Models ( LLMs ) with the unique ability for both video understanding and generation . The primary contributions of the research team can be summarized as follows : GPT4Video arises as a response to the limitations of existing Multimodal Large Language Models ( MLLMs ) , which , despite excelling at processing multimodal inputs , display shortcomings in generating multimodal outputs . The architecture of GPT4Video comprises three integral components : The team initiates the process by utilizing a frozen ViT-L/14 model to capture raw video features , followed by employing a video abstraction module to condense video information across temporal and spatial axes . GPT4Video ’ s core is driven by a frozen LLaMA model , efficiently fine-tuned via LoRA with custom video-centric and safety-aligned data . This equips it to comprehend videos and generate appropriate video prompts , subsequently used to produce videos from the Textto-Video Model Gallery . Experimental results across various multimodal benchmarks , encompassing open-ended question-answer , video captioning , and text-to-video generation , validate the effectiveness and universality of GPT4Video . Moreover , GPT4Video showcases its ability to harness the robust contextual summarization and textual expression capabilities of LLMs to generate detailed prompts for videos . In essence , GPT4Video significantly elevates Large Language Models by integrating advanced video understanding and generative functions . Its effectiveness is further emphasized by its superior performance across multimodal benchmarks . The code is available on project ’ s GitHub . The paper GPT4Video : A Unified Multimodal Large Language Model for lnstruction-Followed Understanding and Safety-Aware Generation on arXiv . Author : Hecate He | Editor : Chain Zhang We know you don ’ t want to miss any news or research breakthroughs . Subscribe to our popular newsletter Synced Global AI Weekly to get weekly AI updates .","['recent', 'stride', 'field', 'multimodal', 'large', 'language', 'model', 'mllm', 'notable', 'progress', 'make', 'inputside', 'multimodal', 'comprehension', 'notable', 'void', 'persist', 'domain', 'multimodal', 'content', 'generation', 'address', 'gap', 'collaborative', 'effort', 'tencent', 'ai', 'lab', 'introduce', 'new', 'paper', 'unified', 'multimodal', 'large', 'language', 'model', 'lnstructionfollowed', 'understanding', 'safetyaware', 'generation', 'stand', 'unified', 'multimodel', 'framework', 'endow', 'large', 'language', 'model', 'llm', 'unique', 'ability', 'video', 'understanding', 'generation', 'primary', 'contribution', 'research', 'team', 'summarize', 'follow', 'arise', 'response', 'limitation', 'exist', 'multimodal', 'large', 'language', 'model', 'mllm', 'excel', 'processing', 'multimodal', 'input', 'display', 'shortcoming', 'generate', 'multimodal', 'output', 'architecture', 'gpt4video', 'comprise', 'integral', 'component', 'team', 'initiate', 'process', 'utilize', 'frozen', 'vitl14', 'model', 'capture', 'raw', 'video', 'feature', 'follow', 'employ', 'video', 'abstraction', 'module', 'condense', 'video', 'information', 'temporal', 'spatial', 'axis', 'core', 'drive', 'frozen', 'llama', 'model', 'efficiently', 'finetune', 'custom', 'videocentric', 'safetyaligne', 'datum', 'equip', 'comprehend', 'video', 'generate', 'appropriate', 'video', 'prompt', 'subsequently', 'use', 'produce', 'video', 'texttovideo', 'model', 'gallery', 'experimental', 'result', 'various', 'multimodal', 'benchmark', 'encompass', 'openende', 'video', 'captioning', 'texttovideo', 'generation', 'validate', 'effectiveness', 'universality', 'moreover', 'showcase', 'ability', 'harness', 'robust', 'contextual', 'summarization', 'textual', 'expression', 'capability', 'llm', 'generate', 'detailed', 'prompt', 'video', 'essence', 'significantly', 'elevate', 'large', 'language', 'model', 'integrate', 'advanced', 'video', 'understanding', 'generative', 'function', 'effectiveness', 'far', 'emphasize', 'superior', 'performance', 'multimodal', 'benchmark', 'code', 'available', 'project', 'paper', 'unified', 'multimodal', 'large', 'language', 'model', 'lnstructionfollowed', 'understanding', 'safetyaware', 'generation', 'arxiv', 'author', 'hecate', 'editor', 'chain', 'know', 'want', 'miss', 'news', 'research', 'breakthrough', 'subscribe', 'popular', 'newsletter', 'sync', 'global', 'ai', 'weekly', 'get', 'weekly', 'update']"
