title,url,date,summary,text,cleaning,tokens
"‘Ask Me Anything’: Stanford U, Numbers Station & UW Madison’s Novel Prompting Strategy Enables LLMs With 30x Fewer Parameters to Outperform Few-Shot GPT3-175B",https://syncedreview.com/2022/10/12/ask-me-anything-stanford-u-numbers-station-uw-madisons-novel-prompting-strategy-enables-llms-with-30x-fewer-parameters-to-outperform-few-shot-gpt3-175b/,2022-10-12,"
In the new paper Ask Me Anything: A Simple Strategy for Prompting Language Models, a research team from Stanford University, Numbers Station, and the University of Wisconsin-Madison presents Ask Me Anything Prompting (AMA), a simple large language model prompting strategy that enables a 30x smaller language model to outperform few-shot GPT3-175B.
","Large language models (LLMs) have taken a step toward task-agnostic machine learning by leveraging user prompts — instructions written in natural language — to help them target specific tasks without additional training or fine-tuning. Prompts can significantly boost model performance, but designing the perfect prompt, aka “prompt engineering,” remains a time-consuming, hands-on process that often comes down to trial and error. In the new paper Ask Me Anything: A Simple Strategy for Prompting Language Models, a research team from Stanford University, Numbers Station, and the University of Wisconsin-Madison presents Ask Me Anything Prompting (AMA), a simple LLM prompting strategy that aggregates multiple “effective yet imperfect” prompts to enable a 30x smaller language model to outperform few-shot GPT3-175B. The team summarizes their main contributions as follows: The researchers first explore different prompt formats, concluding that open-ended question-answering (QA) prompts (e.g. “Who went to the park?”) outperform prompts that restrict the model to particular tokens (e.g. “John went to the park. Output True or False”). They recursively use the LLM to transform task inputs to the effective open-ended question-answering format noted above, collecting multiple candidate prompts with different accuracies and complex dependencies. Finally, they apply a weak supervision (WS) technique to aggregate the outputs and produce final predictions that demonstrably improve the prompting reliability and performance of off-the-shelf LLMs without further training. In their empirical study, the team evaluated AMA’s impact on the out-of-the-box few-shot performance of four open-source LLMs (EleutherAI, OPT, BLOOM, and T0) on seven tasks. In the experiments, AMA achieved an average improvement of 10.2 percent over the few-shot baselines; and also enabled a 30x smaller LLM to outperform few-shot GPT3-175B on 15 of 20 popular benchmarks. Overall, this work validates the effectiveness of the proposed AMA prompting strategy. The team believes AMA could also benefit LLM applications that involve private data or require operating over large amounts of data. The AMA code is available on the project GitHub. The paper Ask Me Anything: A Simple Strategy for Prompting Language Models is on arXiv. Author: Hecate He | Editor: Michael Sarazen We know you don’t want to miss any news or research breakthroughs. Subscribe to our popular newsletter Synced Global AI Weekly to get weekly AI updates.","Large language models (LLMs) have taken a step toward task-agnostic machine learning by leveraging user prompts — instructions written in natural language — to help them target specific tasks without additional training or fine-tuning. Prompts can significantly boost model performance, but designing the perfect prompt, aka “prompt engineering,” remains a time-consuming, hands-on process that often comes down to trial and error. In the new paper Ask Me Anything: A Simple Strategy for Prompting Language Models, a research team from Stanford University, Numbers Station, and the University of Wisconsin-Madison presents Ask Me Anything Prompting (AMA), a simple LLM prompting strategy that aggregates multiple “effective yet imperfect” prompts to enable a 30x smaller language model to outperform few-shot GPT3-175B. The team summarizes their main contributions as follows: The researchers first explore different prompt formats, concluding that open-ended question-answering (QA) prompts (e.g. “Who went to the park?”) outperform prompts that restrict the model to particular tokens (e.g. “John went to the park. Output True or False”). They recursively use the LLM to transform task inputs to the effective open-ended question-answering format noted above, collecting multiple candidate prompts with different accuracies and complex dependencies. Finally, they apply a weak supervision (WS) technique to aggregate the outputs and produce final predictions that demonstrably improve the prompting reliability and performance of off-the-shelf LLMs without further training. In their empirical study, the team evaluated AMA’s impact on the out-of-the-box few-shot performance of four open-source LLMs (EleutherAI, OPT, BLOOM, and T0) on seven tasks. In the experiments, AMA achieved an average improvement of 10.2 percent over the few-shot baselines; and also enabled a 30x smaller LLM to outperform few-shot GPT3-175B on 15 of 20 popular benchmarks. Overall, this work validates the effectiveness of the proposed AMA prompting strategy. The team believes AMA could also benefit LLM applications that involve private data or require operating over large amounts of data. The AMA code is available on the project GitHub. The paper Ask Me Anything: A Simple Strategy for Prompting Language Models is on arXiv. Author: Hecate He | Editor: Michael Sarazen We know you don’t want to miss any news or research breakthroughs. Subscribe to our popular newsletter Synced Global AI Weekly to get weekly AI updates.","['large', 'language', 'model', 'llm', 'take', 'step', 'taskagnostic', 'machine', 'learning', 'leverage', 'user', 'prompt', 'instruction', 'write', 'natural', 'language', 'help', 'target', 'specific', 'task', 'additional', 'training', 'finetune', 'prompt', 'significantly', 'boost', 'model', 'performance', 'design', 'perfect', 'prompt', 'aka', 'prompt', 'engineering', 'remain', 'timeconsuming', 'handson', 'process', 'often', 'come', 'trial', 'error', 'new', 'paper', 'ask', 'simple', 'strategy', 'prompt', 'language', 'model', 'research', 'team', 'number', 'station', 'wisconsinmadison', 'present', 'ask', 'prompt', 'simple', 'llm', 'prompt', 'strategy', 'aggregate', 'multiple', 'effective', 'imperfect', 'prompt', 'enable', '30x', 'small', 'language', 'model', 'outperform', 'fewshot', 'gpt3175b', 'team', 'summarize', 'main', 'contribution', 'follow', 'researcher', 'first', 'explore', 'different', 'prompt', 'format', 'conclude', 'openende', 'questionanswere', 'qa', 'prompt', 'go', 'park', 'outperform', 'prompt', 'restrict', 'model', 'particular', 'go', 'park', 'output', 'true', 'false', 'recursively', 'use', 'llm', 'transform', 'task', 'input', 'effective', 'openended', 'questionanswere', 'format', 'note', 'collect', 'multiple', 'candidate', 'prompt', 'different', 'accuracy', 'complex', 'dependency', 'finally', 'apply', 'weak', 'supervision', 'ws', 'technique', 'aggregate', 'output', 'produce', 'final', 'prediction', 'demonstrably', 'improve', 'prompt', 'reliability', 'performance', 'llm', 'training', 'empirical', 'study', 'team', 'evaluate', 'impact', 'outofthebox', 'fewshot', 'performance', 'opensource', 'llm', 'eleutherai', 'task', 'experiment', 'ama', 'achieve', 'average', 'improvement', 'percent', 'fewshot', 'baseline', 'also', 'enable', '30x', 'small', 'llm', 'outperform', 'fewshot', 'gpt3175b', 'popular', 'benchmark', 'overall', 'work', 'validate', 'effectiveness', 'propose', 'ama', 'prompt', 'strategy', 'team', 'believe', 'also', 'benefit', 'llm', 'application', 'involve', 'private', 'datum', 'require', 'operate', 'large', 'amount', 'datum', 'ama', 'code', 'available', 'project', 'github', 'paper', 'ask', 'simple', 'strategy', 'prompt', 'language', 'model', 'author', 'hecate', 'editor', 'know', 'want', 'miss', 'news', 'research', 'breakthrough', 'subscribe', 'popular', 'newsletter', 'sync', 'global', 'ai', 'weekly', 'get', 'weekly', 'ai', 'update']"
Maximizing FLOPS Utilization: DeepMind & NYU Propose Efficiency Evaluations for Visual Pretraining Methods,https://syncedreview.com/2022/10/11/maximizing-flops-utilization-deepmind-nyu-propose-efficiency-evaluations-for-visual-pretraining-methods/,2022-10-11,"
In the new paper Where Should I Spend My FLOPS? Efficiency Evaluations of Visual Pre-training Methods, DeepMind and NYU Center for Neural Systems researchers introduce computational efficiency evaluation approaches designed to aid in the selection of optimal methods, datasets and models for pretraining visual tasks on a fixed FLOP budget.
","While self-supervised learning (SSL) has achieved impressive results in recent years thanks to complex data augmentation techniques and lengthy training schedules, these approaches also lead to extremely high computation costs. Given a fixed FLOPS budget, is it possible to identify the best datasets, models, and self-supervised training strategies for obtaining high accuracy on visual tasks? In the new paper Where Should I Spend My FLOPS? Efficiency Evaluations of Visual Pre-training Methods, a research team from DeepMind and the NYU Center for Neural Systems introduces evaluation approaches designed to measure the computational efficiency of various visual pretraining strategies across multiple datasets and model sizes and aid in the selection of optimal methods, datasets and models for pretraining visual tasks on a fixed FLOP budget. Previous studies on SSL have mainly focused on improving performance with little regard for the associated computational costs. This work takes the first steps toward identifying computationally optimal pretraining methods, datasets and models. The team analyzes four common self-supervised methods (BYOL, SimCLR, DINO, and MAE) and two supervised methods (CLIP and standard softmax classification). The methods’ per gradient-step FLOP costs are computed and used for comparisons across three axes: pretraining method, model size, and dataset. Downstream task performance is measured by finetuning the pretrained encoders on semantic segmentation tasks on the ADE20K dataset. Based on the evaluations, the team concludes that: 1) Self-supervised methods are generally less FLOP efficient and supervised representations dominate the efficiency Pareto-front; 2) For most methods, the small and large model curves intersect, indicating the point at which it is better to switch to larger model sizes for a given FLOP budget; 3) Dataset quality and curation level significantly affect model accuracy. The team sees their work as a first step towards more rigorously measuring the computational efficiency of contemporary supervised and self-supervised pretraining approaches in terms of pretraining method, dataset and model size. They hope their results will spark future research into visual SSL methods that learn more effectively and scalably on uncurated data. The paper Where Should I Spend My FLOPS? Efficiency Evaluations of Visual Pre-training Methods is on arXiv. Author: Hecate He | Editor: Michael Sarazen We know you don’t want to miss any news or research breakthroughs. Subscribe to our popular newsletter Synced Global AI Weekly to get weekly AI updates.","While self-supervised learning (SSL) has achieved impressive results in recent years thanks to complex data augmentation techniques and lengthy training schedules, these approaches also lead to extremely high computation costs. Given a fixed FLOPS budget, is it possible to identify the best datasets, models, and self-supervised training strategies for obtaining high accuracy on visual tasks? In the new paper Where Should I Spend My FLOPS? Efficiency Evaluations of Visual Pre-training Methods, a research team from DeepMind and the NYU Center for Neural Systems introduces evaluation approaches designed to measure the computational efficiency of various visual pretraining strategies across multiple datasets and model sizes and aid in the selection of optimal methods, datasets and models for pretraining visual tasks on a fixed FLOP budget. Previous studies on SSL have mainly focused on improving performance with little regard for the associated computational costs. This work takes the first steps toward identifying computationally optimal pretraining methods, datasets and models. The team analyzes four common self-supervised methods (BYOL, SimCLR, DINO, and MAE) and two supervised methods (CLIP and standard softmax classification). The methods’ per gradient-step FLOP costs are computed and used for comparisons across three axes: pretraining method, model size, and dataset. Downstream task performance is measured by finetuning the pretrained encoders on semantic segmentation tasks on the ADE20K dataset. Based on the evaluations, the team concludes that: 1) Self-supervised methods are generally less FLOP efficient and supervised representations dominate the efficiency Pareto-front; 2) For most methods, the small and large model curves intersect, indicating the point at which it is better to switch to larger model sizes for a given FLOP budget; 3) Dataset quality and curation level significantly affect model accuracy. The team sees their work as a first step towards more rigorously measuring the computational efficiency of contemporary supervised and self-supervised pretraining approaches in terms of pretraining method, dataset and model size. They hope their results will spark future research into visual SSL methods that learn more effectively and scalably on uncurated data. The paper Where Should I Spend My FLOPS? Efficiency Evaluations of Visual Pre-training Methods is on arXiv. Author: Hecate He | Editor: Michael Sarazen We know you don’t want to miss any news or research breakthroughs. Subscribe to our popular newsletter Synced Global AI Weekly to get weekly AI updates.","['selfsupervise', 'learning', 'achieve', 'impressive', 'result', 'recent', 'year', 'thank', 'complex', 'datum', 'augmentation', 'technique', 'lengthy', 'training', 'schedule', 'approach', 'also', 'lead', 'extremely', 'high', 'computation', 'cost', 'give', 'fix', 'flop', 'budget', 'possible', 'identify', 'good', 'dataset', 'model', 'selfsupervise', 'training', 'strategy', 'obtain', 'high', 'accuracy', 'visual', 'task', 'new', 'paper', 'spend', 'flop', 'efficiency', 'evaluation', 'visual', 'pretraine', 'method', 'research', 'team', 'deepmind', 'neural', 'system', 'introduce', 'evaluation', 'approach', 'design', 'measure', 'computational', 'efficiency', 'various', 'visual', 'pretraine', 'strategy', 'multiple', 'dataset', 'model', 'size', 'aid', 'selection', 'optimal', 'method', 'dataset', 'model', 'pretraine', 'visual', 'task', 'fix', 'flop', 'budget', 'previous', 'study', 'mainly', 'focus', 'improve', 'performance', 'little', 'regard', 'associate', 'computational', 'cost', 'work', 'take', 'first', 'step', 'identify', 'computationally', 'optimal', 'pretraine', 'method', 'dataset', 'model', 'team', 'analyze', 'common', 'selfsupervise', 'method', 'byol', 'simclr', 'dino', 'supervised', 'method', 'clip', 'standard', 'softmax', 'classification', 'method', 'gradientstep', 'flop', 'cost', 'compute', 'use', 'comparison', 'axis', 'pretraine', 'method', 'model', 'size', 'dataset', 'downstream', 'task', 'performance', 'measure', 'finetune', 'pretraine', 'encoder', 'semantic', 'segmentation', 'task', 'dataset', 'base', 'evaluation', 'team', 'conclude', 'selfsupervise', 'method', 'generally', 'less', 'flop', 'efficient', 'supervised', 'representation', 'dominate', 'efficiency', 'paretofront', 'method', 'small', 'large', 'model', 'curve', 'intersect', 'indicate', 'point', 'well', 'switch', 'large', 'model', 'size', 'give', 'flop', 'budget', 'dataset', 'quality', 'curation', 'level', 'significantly', 'affect', 'model', 'accuracy', 'team', 'see', 'work', 'first', 'step', 'rigorously', 'measure', 'computational', 'efficiency', 'contemporary', 'supervised', 'selfsupervise', 'pretraine', 'approach', 'term', 'pretraine', 'method', 'dataset', 'model', 'size', 'hope', 'result', 'spark', 'future', 'research', 'visual', 'ssl', 'method', 'learn', 'effectively', 'scalably', 'uncurated', 'datum', 'paper', 'spend', 'flop', 'efficiency', 'evaluation', 'visual', 'pretraine', 'method', 'author', 'hecate', 'editor', 'know', 'want', 'miss', 'news', 'research', 'breakthrough', 'subscribe', 'popular', 'newsletter', 'sync', 'global', 'ai', 'weekly', 'get', 'weekly', 'ai', 'update']"
MIT’s DIFFDOCK Boosts the Molecular Docking Top-1 Success Rate from 23% to 38%,https://syncedreview.com/2022/10/06/mits-diffdock-boosts-the-molecular-docking-top-1-success-rate-from-23-to-38/,2022-10-06,"
MIT Researchers propose DIFFDOCK, a diffusion generative model that significantly improves the molecular docking top-1 prediction success rate, from state-of-the-art traditional docking approaches’ 23 percent to 38 percent.
","Market research firm Emersion Insights reports that global funding for AI-powered drug development topped US$4 billion in 2021, a 36 percent year-over-year increase, and is expected to continue its rapid growth. A critical component of computer-aided drug discovery is molecular docking, a task that predicts the binding structure of small molecule ligands to a protein. Although new approaches using deep learning models have increased the speed of such research compared to traditional search-based methods, they have not significantly boosted prediction accuracy. In the new paper DiffDock: Diffusion Steps, Twists, and Turns for Molecular Docking, researchers from the Massachusetts Institute of Technology’s Computer Science & Artificial Intelligence Laboratory propose DIFFDOCK, a diffusion generative model (DGM) that significantly improves the molecular docking top-1 prediction success rate, from state-of-the-art traditional docking approaches’ 23 percent to 38 percent. The team summarizes their main contributions as follows: The team defines molecular docking as a generative modelling problem, i.e., given a ligand and target protein structure, the goal is to learn a distribution over ligand poses. They introduce a diffusion process over the degrees of freedom involved in docking, covering: 1) the position of the ligand, 2) its orientation in the pocket, and 3) its torsion angles. DIFFDOCK samples poses during the diffusion process to iteratively transform an uninformed, noisy prior distribution over ligand poses into the output model distribution. The researchers also train a model to estimate the confidence level of the poses sampled from the DGM, to enable it to pick the most likely sample. In their empirical study, the team evaluated DIFFDOCK on molecular complexes from PDBBind benchmark and compared it with state-of-the-art search-based methods such as SMINA and GLIDE and recent deep learning methods EquiBind and TANKBind. DIFFDOCK excelled in the evaluations, surpassing all the baselines and achieving an impressive 38.2 percent top-1 success rate when sampling 40 poses while reaching much faster inference times. This work presents an exciting breakthrough in molecular docking. The team believes DIFFDOCK can help existing real-world pipelines and open new research avenues for downstream task integration and protein-protein and protein-nucleic acid docking. The paper DiffDock: Diffusion Steps, Twists, and Turns for Molecular Docking is on arXiv. Author: Hecate He | Editor: Michael Sarazen We know you don’t want to miss any news or research breakthroughs. Subscribe to our popular newsletter Synced Global AI Weekly to get weekly AI updates.","Market research firm Emersion Insights reports that global funding for AI-powered drug development topped US$4 billion in 2021, a 36 percent year-over-year increase, and is expected to continue its rapid growth. A critical component of computer-aided drug discovery is molecular docking, a task that predicts the binding structure of small molecule ligands to a protein. Although new approaches using deep learning models have increased the speed of such research compared to traditional search-based methods, they have not significantly boosted prediction accuracy. In the new paper DiffDock: Diffusion Steps, Twists, and Turns for Molecular Docking, researchers from the Massachusetts Institute of Technology’s Computer Science & Artificial Intelligence Laboratory propose DIFFDOCK, a diffusion generative model (DGM) that significantly improves the molecular docking top-1 prediction success rate, from state-of-the-art traditional docking approaches’ 23 percent to 38 percent. The team summarizes their main contributions as follows: The team defines molecular docking as a generative modelling problem, i.e., given a ligand and target protein structure, the goal is to learn a distribution over ligand poses. They introduce a diffusion process over the degrees of freedom involved in docking, covering: 1) the position of the ligand, 2) its orientation in the pocket, and 3) its torsion angles. DIFFDOCK samples poses during the diffusion process to iteratively transform an uninformed, noisy prior distribution over ligand poses into the output model distribution. The researchers also train a model to estimate the confidence level of the poses sampled from the DGM, to enable it to pick the most likely sample. In their empirical study, the team evaluated DIFFDOCK on molecular complexes from PDBBind benchmark and compared it with state-of-the-art search-based methods such as SMINA and GLIDE and recent deep learning methods EquiBind and TANKBind. DIFFDOCK excelled in the evaluations, surpassing all the baselines and achieving an impressive 38.2 percent top-1 success rate when sampling 40 poses while reaching much faster inference times. This work presents an exciting breakthrough in molecular docking. The team believes DIFFDOCK can help existing real-world pipelines and open new research avenues for downstream task integration and protein-protein and protein-nucleic acid docking. The paper DiffDock: Diffusion Steps, Twists, and Turns for Molecular Docking is on arXiv. Author: Hecate He | Editor: Michael Sarazen We know you don’t want to miss any news or research breakthroughs. Subscribe to our popular newsletter Synced Global AI Weekly to get weekly AI updates.","['market', 'research', 'firm', 'emersion', 'insight', 'report', 'global', 'funding', 'aipowere', 'drug', 'development', 'top', 'percent', 'yearoveryear', 'increase', 'expect', 'continue', 'rapid', 'growth', 'critical', 'component', 'computeraide', 'drug', 'discovery', 'molecular', 'dock', 'task', 'predict', 'binding', 'structure', 'small', 'molecule', 'ligand', 'protein', 'new', 'approach', 'use', 'deep', 'learning', 'model', 'increase', 'speed', 'research', 'compare', 'traditional', 'searchbased', 'method', 'significantly', 'boost', 'prediction', 'accuracy', 'new', 'paper', 'diffdock', 'diffusion', 'step', 'twist', 'turn', 'molecular', 'dock', 'researcher', 'computer', 'science', 'artificial', 'intelligence', 'laboratory', 'propose', 'diffdock', 'diffusion', 'generative', 'model', 'dgm', 'significantly', 'improve', 'molecular', 'docking', 'top1', 'prediction', 'success', 'rate', 'stateoftheart', 'traditional', 'docking', 'approach', 'percent', 'percent', 'team', 'summarize', 'main', 'contribution', 'follow', 'team', 'define', 'molecular', 'docking', 'generative', 'modelling', 'problem', 'ie', 'give', 'ligand', 'target', 'protein', 'structure', 'goal', 'learn', 'distribution', 'ligand', 'pose', 'introduce', 'diffusion', 'process', 'degree', 'freedom', 'involve', 'docking', 'cover', 'position', 'ligand', 'orientation', 'pocket', 'torsion', 'angle', 'diffdock', 'sample', 'pose', 'diffusion', 'process', 'iteratively', 'transform', 'uninformed', 'noisy', 'prior', 'distribution', 'ligand', 'pose', 'output', 'model', 'distribution', 'researcher', 'also', 'train', 'model', 'estimate', 'confidence', 'level', 'pose', 'sample', 'dgm', 'enable', 'pick', 'likely', 'sample', 'empirical', 'study', 'team', 'evaluate', 'diffdock', 'molecular', 'complex', 'pdbbind', 'benchmark', 'compare', 'stateoftheart', 'searchbased', 'method', 'smina', 'glide', 'recent', 'deep', 'learning', 'method', 'equibind', 'tankbind', 'diffdock', 'excel', 'evaluation', 'surpass', 'baseline', 'achieve', 'impressive', 'percent', 'top1', 'success', 'rate', 'sample', 'pose', 'reach', 'much', 'fast', 'inference', 'time', 'work', 'present', 'exciting', 'breakthrough', 'molecular', 'dock', 'team', 'believe', 'diffdock', 'help', 'exist', 'realworld', 'pipeline', 'open', 'new', 'research', 'avenue', 'downstream', 'task', 'integration', 'proteinprotein', 'proteinnucleic', 'acid', 'dock', 'paper', 'diffdock', 'diffusion', 'step', 'twist', 'turn', 'molecular', 'docking', 'author', 'hecate', 'editor', 'know', 'want', 'miss', 'news', 'research', 'breakthrough', 'subscribe', 'popular', 'newsletter', 'sync', 'global', 'ai', 'weekly', 'get', 'weekly', 'ai', 'update']"
