title,url,date,summary,text,cleaning,tokens
CMU Takes a Big Step Toward Real-Time Realistic Video Generation Based on Language Descriptions,https://syncedreview.com/2022/10/26/cmu-takes-a-big-step-toward-real-time-realistic-video-generation-based-on-language-descriptions/,2022-10-26,"
In the new paper Towards Real-Time Text2Video via CLIP-Guided, Pixel-Level Optimization, researchers from Carnegie Mellon University leverage CLIP-guided, pixel-level optimization to generate 720p resolution videos from natural language descriptions at a rate of one-to-two frames per second — taking a big step towards a real-time text-to-video system.

 ","There are now dozens of AI-powered text-to-image models on the Internet, with DALL.E Mini alone generating more than 50,000 images daily from users’ natural language prompts. The next challenging step for such generative AI models is text-to-video — which brings the potential for creating animated scenes based on users’ storytelling inputs. While current text-to-video approaches guided by Open AI’s CLIP network can translate text into highly-realistic imagery, they are slow — requiring from 17 seconds to five minutes to generate a single frame of video. In the new paper Towards Real-Time Text2Video via CLIP-Guided, Pixel-Level Optimization, researchers from Carnegie Mellon University leverage CLIP-guided, pixel-level optimization to generate 720p resolution videos from natural language descriptions at a rate of one-to-two frames per second — taking a big step towards a real-time text-to-video system. Existing CLIP-Guided text-to-video approaches generate their highly realistic imagery by optimizing through large pretrained image generator diffusion models, a process that is both time-consuming and computationally heavy. The CMU team employs a novel two-step approach to approach real-time text-to-video generation: 1) Generating noisy semantic content at a fast speed; and 2) Refining the generated image textures in a post-processing step. The proposed approach generates each frame sequentially while iterating through the input language to guide the content. CLIP-Guided techniques are used to compare the frame and the language description and evolve the frame toward consistency with the content. A trained CycleGAN model smooths and denoises the generated images. In their empirical study, the team demonstrated their approach’s ability to generate realistic videos at up to 720p resolution at speeds 20-300 times faster than existing methods. The code and sample videos are available on the team’s website. In future work, the researchers plan to add priors to enable smoother motion in the videos and improve user control over their style and appearance. The paper Towards Real-Time Text2Video via CLIP-Guided, Pixel-Level Optimization is on arXiv. Author: Hecate He | Editor: Michael Sarazen We know you don’t want to miss any news or research breakthroughs. Subscribe to our popular newsletter Synced Global AI Weekly to get weekly AI updates.","There are now dozens of AI-powered text-to-image models on the Internet, with DALL.E Mini alone generating more than 50,000 images daily from users’ natural language prompts. The next challenging step for such generative AI models is text-to-video — which brings the potential for creating animated scenes based on users’ storytelling inputs. While current text-to-video approaches guided by Open AI’s CLIP network can translate text into highly-realistic imagery, they are slow — requiring from 17 seconds to five minutes to generate a single frame of video. In the new paper Towards Real-Time Text2Video via CLIP-Guided, Pixel-Level Optimization, researchers from Carnegie Mellon University leverage CLIP-guided, pixel-level optimization to generate 720p resolution videos from natural language descriptions at a rate of one-to-two frames per second — taking a big step towards a real-time text-to-video system. Existing CLIP-Guided text-to-video approaches generate their highly realistic imagery by optimizing through large pretrained image generator diffusion models, a process that is both time-consuming and computationally heavy. The CMU team employs a novel two-step approach to approach real-time text-to-video generation: 1) Generating noisy semantic content at a fast speed; and 2) Refining the generated image textures in a post-processing step. The proposed approach generates each frame sequentially while iterating through the input language to guide the content. CLIP-Guided techniques are used to compare the frame and the language description and evolve the frame toward consistency with the content. A trained CycleGAN model smooths and denoises the generated images. In their empirical study, the team demonstrated their approach’s ability to generate realistic videos at up to 720p resolution at speeds 20-300 times faster than existing methods. The code and sample videos are available on the team’s website. In future work, the researchers plan to add priors to enable smoother motion in the videos and improve user control over their style and appearance. The paper Towards Real-Time Text2Video via CLIP-Guided, Pixel-Level Optimization is on arXiv. Author: Hecate He | Editor: Michael Sarazen We know you don’t want to miss any news or research breakthroughs. Subscribe to our popular newsletter Synced Global AI Weekly to get weekly AI updates.","['dozen', 'aipowere', 'texttoimage', 'model', 'internet', 'dalle', 'mini', 'alone', 'generate', 'image', 'daily', 'user', 'natural', 'language', 'prompt', 'next', 'challenge', 'step', 'generative', 'ai', 'model', 'texttovideo', 'bring', 'potential', 'create', 'animate', 'scene', 'base', 'user', 'storytelling', 'input', 'current', 'texttovideo', 'approach', 'guide', 'open', 'ai', 'network', 'translate', 'text', 'highlyrealistic', 'imagery', 'slow', 'require', 'second', 'minute', 'generate', 'single', 'frame', 'video', 'new', 'paper', 'realtime', 'text2video', 'clipguide', 'pixellevel', 'optimization', 'researcher', 'leverage', 'clipguide', 'pixellevel', 'optimization', 'generate', 'resolution', 'video', 'natural', 'language', 'description', 'rate', 'onetotwo', 'frame', 'second', 'take', 'big', 'step', 'realtime', 'texttovideo', 'system', 'exist', 'clipguide', 'texttovideo', 'approach', 'generate', 'highly', 'realistic', 'imagery', 'optimize', 'large', 'pretraine', 'image', 'generator', 'diffusion', 'model', 'process', 'timeconsuming', 'computationally', 'heavy', 'cmu', 'team', 'employ', 'novel', 'twostep', 'approach', 'approach', 'realtime', 'texttovideo', 'generation', 'generate', 'noisy', 'semantic', 'content', 'fast', 'speed', 'refine', 'generate', 'image', 'texture', 'postprocesse', 'step', 'propose', 'approach', 'generate', 'frame', 'sequentially', 'iterate', 'input', 'language', 'guide', 'content', 'clipguide', 'technique', 'use', 'compare', 'frame', 'language', 'description', 'evolve', 'frame', 'consistency', 'content', 'train', 'cyclegan', 'model', 'smooth', 'denoise', 'generate', 'image', 'empirical', 'study', 'team', 'demonstrate', 'approach', 'ability', 'generate', 'realistic', 'video', '720p', 'resolution', 'speed', 'time', 'fast', 'exist', 'method', 'code', 'sample', 'video', 'available', 'team', '’s', 'website', 'future', 'work', 'researcher', 'plan', 'add', 'prior', 'enable', 'smooth', 'motion', 'video', 'improve', 'user', 'control', 'style', 'appearance', 'paper', 'realtime', 'text2video', 'clipguide', 'pixellevel', 'optimization', 'author', 'hecate', 'editor', 'know', 'want', 'miss', 'news', 'research', 'breakthrough', 'subscribe', 'popular', 'newsletter', 'sync', 'global', 'ai', 'weekly', 'get', 'weekly', 'ai', 'update']"
DeepMind Study Shows That Language Models Can Learn From Explanations in Context Even Without Tuning,https://syncedreview.com/2022/10/25/deepmind-study-shows-that-language-models-can-learn-from-explanations-in-context-even-without-tuning/,2022-10-25,"
In the new paper Can Language Models Learn From Explanations in Context?, DeepMind researchers investigate how different types of explanations, instructions, and controls affect language models’ zero- and few-shot performance and how such explanations can support in-context learning for large language models on challenging tasks.
","If you have ever considered the answer to a question and asked “…but why?” you are not alone. Humans have an innate ability to improve their learning and broaden their understanding via explanations that relate examples to principles. The machine learning community in recent years has witnessed the rapid growth of few-shot prompting language models (LMs) that exhibit impressive transfer learning capability, enabling them to successfully perform new tasks by adapting to a few in-context examples. Might these LMs benefit, as humans do, from explanations of these few-shot examples? In the new paper Can Language Models Learn From Explanations in Context?, DeepMind researchers investigate how different types of explanations, instructions, and controls affect language models’ zero- and few-shot performance and how such explanations can support in-context learning for large language models on challenging tasks. The team highlights their main contributions as follows: The team considered a set of decoder-only transformer models ranging from 1 billion to 280 billion parameters and crafted a variety of control explanations that match different aspects of the semantics and word- or sentence-level content, including scrambled explanations, true non-explanations, and other item explanations. They tested model performance under each prompt condition on all task dataset items (except those in the prompt) and calculated the model’s likelihood of returning each answer option. They then chose the highest-likelihood answer from the set and evaluated model accuracy based on the answer scores defined by the task. In their empirical experiments, the team examined the benefits of different prompt components for the largest (280B parameter) LM and the relative distribution of benefits from different explanation types. They also provided raw summaries of the average effects of untuned explanations across model scales. Their findings can be summarized as follows: The researchers believe their work can contribute to improved prompt engineering and scientific understanding of the in-context learning abilities of large LMs. The paper Can Language Models Learn From Explanations in Context? is on arXiv. Author: Hecate He | Editor: Michael Sarazen We know you don’t want to miss any news or research breakthroughs. Subscribe to our popular newsletter Synced Global AI Weekly to get weekly AI updates.","If you have ever considered the answer to a question and asked “…but why?” you are not alone. Humans have an innate ability to improve their learning and broaden their understanding via explanations that relate examples to principles. The machine learning community in recent years has witnessed the rapid growth of few-shot prompting language models (LMs) that exhibit impressive transfer learning capability, enabling them to successfully perform new tasks by adapting to a few in-context examples. Might these LMs benefit, as humans do, from explanations of these few-shot examples? In the new paper Can Language Models Learn From Explanations in Context?, DeepMind researchers investigate how different types of explanations, instructions, and controls affect language models’ zero- and few-shot performance and how such explanations can support in-context learning for large language models on challenging tasks. The team highlights their main contributions as follows: The team considered a set of decoder-only transformer models ranging from 1 billion to 280 billion parameters and crafted a variety of control explanations that match different aspects of the semantics and word- or sentence-level content, including scrambled explanations, true non-explanations, and other item explanations. They tested model performance under each prompt condition on all task dataset items (except those in the prompt) and calculated the model’s likelihood of returning each answer option. They then chose the highest-likelihood answer from the set and evaluated model accuracy based on the answer scores defined by the task. In their empirical experiments, the team examined the benefits of different prompt components for the largest (280B parameter) LM and the relative distribution of benefits from different explanation types. They also provided raw summaries of the average effects of untuned explanations across model scales. Their findings can be summarized as follows: The researchers believe their work can contribute to improved prompt engineering and scientific understanding of the in-context learning abilities of large LMs. The paper Can Language Models Learn From Explanations in Context? is on arXiv. Author: Hecate He | Editor: Michael Sarazen We know you don’t want to miss any news or research breakthroughs. Subscribe to our popular newsletter Synced Global AI Weekly to get weekly AI updates.","['ever', 'consider', 'answer', 'question', 'ask', 'alone', 'human', 'innate', 'ability', 'improve', 'learning', 'broaden', 'understanding', 'explanation', 'relate', 'example', 'principle', 'machine', 'learn', 'community', 'recent', 'year', 'witness', 'rapid', 'growth', 'fewshot', 'prompt', 'language', 'model', 'lm', 'exhibit', 'impressive', 'transfer', 'learning', 'capability', 'enable', 'successfully', 'perform', 'new', 'task', 'adapt', 'incontext', 'example', 'lm', 'benefit', 'human', 'explanation', 'fewshot', 'example', 'new', 'paper', 'language', 'model', 'learn', 'explanation', 'context', 'deepmind', 'researcher', 'investigate', 'different', 'type', 'explanation', 'instruction', 'control', 'affect', 'language', 'model', 'fewshot', 'performance', 'explanation', 'support', 'incontext', 'learn', 'large', 'language', 'model', 'challenging', 'task', 'team', 'highlight', 'main', 'contribution', 'follow', 'team', 'consider', 'set', 'decoderonly', 'transformer', 'model', 'range', 'parameter', 'craft', 'variety', 'control', 'explanation', 'match', 'different', 'aspect', 'semantic', 'word', 'sentencelevel', 'content', 'include', 'scramble', 'explanation', 'true', 'nonexplanation', 'item', 'explanation', 'test', 'model', 'performance', 'prompt', 'condition', 'task', 'dataset', 'item', 'prompt', 'calculate', 'model', 'likelihood', 'return', 'answer', 'option', 'choose', 'highestlikelihood', 'answer', 'set', 'evaluate', 'model', 'accuracy', 'base', 'answer', 'score', 'define', 'task', 'empirical', 'experiment', 'team', 'examine', 'benefit', 'different', 'prompt', 'component', 'large', '280b', 'parameter', 'relative', 'distribution', 'benefit', 'different', 'explanation', 'type', 'also', 'provide', 'raw', 'summary', 'average', 'effect', 'untuned', 'explanation', 'model', 'scale', 'finding', 'summarize', 'follow', 'researcher', 'believe', 'work', 'contribute', 'improved', 'prompt', 'engineering', 'scientific', 'understanding', 'incontext', 'learn', 'ability', 'large', 'lm', 'paper', 'language', 'model', 'learn', 'explanation', 'context', 'author', 'hecate', 'editor', 'know', 'want', 'miss', 'news', 'research', 'breakthrough', 'subscribe', 'popular', 'newsletter', 'sync', 'global', 'ai', 'weekly', 'get', 'weekly', 'ai', 'update']"
Google & Stanford Team Applies Chain-of-Thought Prompting to Surpass Human Performance on Challenging BIG-Bench Tasks,https://syncedreview.com/2022/10/24/google-stanford-team-applies-chain-of-thought-prompting-to-surpass-human-performance-on-challenging-big-bench-tasks/,2022-10-24,"
In the new paper Challenging BIG-Bench Tasks and Whether Chain-of-Thought Can Solve Them, a Google Research and Stanford University team applies chain-of-thought (CoT) prompting — a series of intermediate reasoning steps — to 23 BIG-Bench tasks on which language models have failed to outperform the average human rater. The proposed approach enables models to surpass human performance on 17 of the 23 tasks.
","Today’s large language models (LLMs) have demonstrated game-changing performance across a wide range of tasks and domains, but they have their limits. These weaknesses can be identified by the Beyond the Imitation Game benchmark (BIG-Bench, Srivastava et al., 2022), which evaluates LLM capabilities on a diverse suite of especially challenging tasks. A 540B parameter PaLM language model surpasses average human-rater performance on 65 percent of the BIG-Bench tasks, but what about the remainder — are they simply unsolvable by LLMs? A Google Research and Stanford University team addresses this question in the new paper Challenging BIG-Bench Tasks and Whether Chain-of-Thought Can Solve Them. The team applies chain-of-thought (CoT) prompting — a series of intermediate reasoning steps inspired by the paper Chain-of-Thought Prompting Elicits Reasoning in Large Language Models (Wei et al., 2022b) — to 23 BIG-Bench tasks on which LLMs have failed to match the average human rater. Their strongest resulting model outperforms the human baseline on 17 of the 23 tasks. The team selected their 23 evaluation tasks — a subset they dub BIG-Bench Hard (BBH) — from BIG-Bench tasks where state-of-the-art LLMs perform worse than the average human rater, tasks fundamentally not solvable by scaling existing LLMs, and tasks that require prompting techniques beyond the standard few-shot prompting setup. In their experiments, the team applied the standard BIG-Bench answer-only prompting setup and the proposed CoT prompting approach on three language model families — Codex, InstructGPT and PaLM — to explore whether and to what extent CoT prompting can improve performance on the 23 BBH tasks. The results show that conventional answer-only prompting underestimates LLM performance and capabilities on challenging tasks that require multiple reasoning steps; as CoT prompting achieves double-digit improvements for all three models, surpassing the average human-rater score on 10 of the 23 tasks on PaLM, on 15/23 tasks on InstructGPT, and on 17/23 tasks on Codex. The paper also details the effects of CoT prompting on four BBH task categories: algorithmic and multi-step arithmetic reasoning, natural language understanding, use of world knowledge, and multilingual knowledge and reasoning.The data, prompts, and Codex model outputs are available on the project’s GitHub. The paper Challenging BIG-Bench Tasks and Whether Chain-of-Thought Can Solve Them is on arXiv. Author: Hecate He | Editor: Michael Sarazen We know you don’t want to miss any news or research breakthroughs. Subscribe to our popular newsletter Synced Global AI Weekly to get weekly AI updates.","Today’s large language models (LLMs) have demonstrated game-changing performance across a wide range of tasks and domains, but they have their limits. These weaknesses can be identified by the Beyond the Imitation Game benchmark (BIG-Bench, Srivastava et al., 2022), which evaluates LLM capabilities on a diverse suite of especially challenging tasks. A 540B parameter PaLM language model surpasses average human-rater performance on 65 percent of the BIG-Bench tasks, but what about the remainder — are they simply unsolvable by LLMs? A Google Research and Stanford University team addresses this question in the new paper Challenging BIG-Bench Tasks and Whether Chain-of-Thought Can Solve Them. The team applies chain-of-thought (CoT) prompting — a series of intermediate reasoning steps inspired by the paper Chain-of-Thought Prompting Elicits Reasoning in Large Language Models (Wei et al., 2022b) — to 23 BIG-Bench tasks on which LLMs have failed to match the average human rater. Their strongest resulting model outperforms the human baseline on 17 of the 23 tasks. The team selected their 23 evaluation tasks — a subset they dub BIG-Bench Hard (BBH) — from BIG-Bench tasks where state-of-the-art LLMs perform worse than the average human rater, tasks fundamentally not solvable by scaling existing LLMs, and tasks that require prompting techniques beyond the standard few-shot prompting setup. In their experiments, the team applied the standard BIG-Bench answer-only prompting setup and the proposed CoT prompting approach on three language model families — Codex, InstructGPT and PaLM — to explore whether and to what extent CoT prompting can improve performance on the 23 BBH tasks. The results show that conventional answer-only prompting underestimates LLM performance and capabilities on challenging tasks that require multiple reasoning steps; as CoT prompting achieves double-digit improvements for all three models, surpassing the average human-rater score on 10 of the 23 tasks on PaLM, on 15/23 tasks on InstructGPT, and on 17/23 tasks on Codex. The paper also details the effects of CoT prompting on four BBH task categories: algorithmic and multi-step arithmetic reasoning, natural language understanding, use of world knowledge, and multilingual knowledge and reasoning.The data, prompts, and Codex model outputs are available on the project’s GitHub. The paper Challenging BIG-Bench Tasks and Whether Chain-of-Thought Can Solve Them is on arXiv. Author: Hecate He | Editor: Michael Sarazen We know you don’t want to miss any news or research breakthroughs. Subscribe to our popular newsletter Synced Global AI Weekly to get weekly AI updates.","['today', 'large', 'language', 'model', 'llm', 'demonstrate', 'gamechange', 'performance', 'wide', 'range', 'task', 'domain', 'limit', 'weakness', 'identify', 'imitation', 'game', 'benchmark', 'bigbench', 'evaluate', 'llm', 'capability', 'diverse', 'suite', 'especially', 'challenging', 'task', 'parameter', 'model', 'surpasse', 'average', 'humanrater', 'performance', 'percent', 'bigbench', 'task', 'remainder', 'simply', 'unsolvable', 'llm', 'university', 'team', 'address', 'question', 'new', 'paper', 'challenge', 'bigbench', 'task', 'chainofthought', 'solve', 'team', 'apply', 'chainofthought', 'cot', 'prompt', 'series', 'intermediate', 'reasoning', 'step', 'inspire', 'paper', 'chainofthought', 'prompt', 'elicit', 'reasoning', 'large', 'language', 'model', 'bigbench', 'task', 'llm', 'fail', 'match', 'average', 'human', 'rater', 'strong', 'result', 'model', 'outperform', 'human', 'baseline', 'task', 'team', 'select', 'evaluation', 'task', 'subset', 'dub', 'bigbench', 'hard', 'bbh', 'bigbench', 'task', 'stateoftheart', 'llm', 'perform', 'bad', 'average', 'human', 'rater', 'task', 'fundamentally', 'solvable', 'scale', 'exist', 'llm', 'task', 'require', 'prompt', 'technique', 'standard', 'fewshot', 'prompting', 'setup', 'experiment', 'team', 'apply', 'standard', 'bigbench', 'answeronly', 'prompt', 'setup', 'propose', 'cot', 'prompt', 'approach', 'language', 'model', 'family', 'codex', 'instructgpt', 'palm', 'explore', 'extent', 'cot', 'prompt', 'improve', 'performance', 'bbh', 'task', 'result', 'show', 'conventional', 'answeronly', 'prompt', 'underestimate', 'llm', 'performance', 'capability', 'challenging', 'task', 'require', 'multiple', 'reasoning', 'step', 'cot', 'prompt', 'achieve', 'doubledigit', 'improvement', 'model', 'surpass', 'average', 'humanrater', 'score', 'task', 'palm', 'task', 'instructgpt', 'task', 'codex', 'paper', 'also', 'detail', 'effect', 'cot', 'prompt', 'bbh', 'task', 'category', 'algorithmic', 'multistep', 'arithmetic', 'reasoning', 'natural', 'language', 'understanding', 'use', 'world', 'knowledge', 'multilingual', 'knowledge', 'reasoningthe', 'data', 'prompt', 'codex', 'model', 'output', 'available', 'project', 'paper', 'challenge', 'bigbench', 'task', 'chainofthought', 'solve', 'author', 'hecate', 'editor', 'know', 'want', 'miss', 'news', 'research', 'breakthrough', 'subscribe', 'popular', 'newsletter', 'sync', 'global', 'ai', 'weekly', 'get', 'weekly', 'ai', 'update']"
